username;date;retweets;favorites;text;geo;mentions;hashtags;id;permalink;place_full_name;location;timezone;profile_location_name
asirrichti;2017-12-06 15:33;0;0;"Found a Transponder Snail! Giants, sea monsters and other amazing encounters! http:// bnent.jp/optc-den2e/ #TreCru pic.twitter.com/2n3GvwgddE";;;#TreCru;"938506695919198208";https://twitter.com/asirrichti/status/938506695919198208;;None,None,
asirrichti;2017-12-05 11:40;0;0;"Found a Transponder Snail! Killer rabbits?! Amazing fauna on one winter isle! http:// bnent.jp/optc-den2e/ #TreCru pic.twitter.com/XtdwGgvuFf";;;#TreCru;"938085788264423425";https://twitter.com/asirrichti/status/938085788264423425;;None,None,
asirrichti;2017-12-05 11:40;0;0;"Found a Transponder Snail! Exclusive Profile: Those who follow their dreams! http:// bnent.jp/optc-den2e/ #TreCru pic.twitter.com/qK5EphWMua";;;#TreCru;"938085613160583168";https://twitter.com/asirrichti/status/938085613160583168;;None,None,
asirrichti;2017-12-05 11:39;0;0;"Found a Transponder Snail! Extra! Extra! Devil of Ohara captured by CP9! http:// bnent.jp/optc-den2e/ #TreCru pic.twitter.com/zMRhE4ejza";;;#TreCru;"938085335157936129";https://twitter.com/asirrichti/status/938085335157936129;;None,None,
asirrichti;2017-12-05 11:38;0;0;"Found a Transponder Snail! Shots of the Pirate Empress Boa Hancock! http:// bnent.jp/optc-den2e/ #TreCru pic.twitter.com/isFX1nfDsk";;;#TreCru;"938085063635423232";https://twitter.com/asirrichti/status/938085063635423232;;None,None,
asirrichti;2017-12-05 11:36;0;0;"Found a Transponder Snail! A behind-the-scenes look at Galley-La Shipyard! http:// bnent.jp/optc-den2e/ #TreCru pic.twitter.com/rksIYx8zes";;;#TreCru;"938084688417251328";https://twitter.com/asirrichti/status/938084688417251328;;None,None,
asirrichti;2017-12-05 03:38;0;0;"Found a Transponder Snail! Who made the escape from Impel Down a success? http:// bnent.jp/optc-den2e/ #TreCru pic.twitter.com/xCdyNd5iUB";;;#TreCru;"937964321421844481";https://twitter.com/asirrichti/status/937964321421844481;;None,None,
asirrichti;2017-12-03 13:08;0;0;"Found a Transponder Snail! Candid pics from the Alubarna Palace Baths! http:// bnent.jp/optc-den2e/ #TreCru pic.twitter.com/RrJQEBhhVH";;;#TreCru;"937382955890208768";https://twitter.com/asirrichti/status/937382955890208768;;None,None,
asirrichti;2017-12-03 13:07;0;0;"Found a Transponder Snail! For honor! Giants clash in ancient jungle! http:// bnent.jp/optc-den2e/ #TreCru pic.twitter.com/oDwCaOT2HW";;;#TreCru;"937382801938239488";https://twitter.com/asirrichti/status/937382801938239488;;None,None,
asirrichti;2017-12-03 13:07;0;0;"Found a Transponder Snail! Get an inside look at a shadowy criminal empire! http:// bnent.jp/optc-den2e/ #TreCru pic.twitter.com/HoK4ir1Cq2";;;#TreCru;"937382727669690368";https://twitter.com/asirrichti/status/937382727669690368;;None,None,
asirrichti;2017-12-03 13:06;0;0;"Found a Transponder Snail! "I'll never forget you!!" Local cook sets sail! http:// bnent.jp/optc-den2e/ #TreCru pic.twitter.com/rynrpKG30W";;;#TreCru;"937382595993722880";https://twitter.com/asirrichti/status/937382595993722880;;None,None,
asirrichti;2017-12-03 10:28;0;0;"Found a Transponder Snail! Oars comes back as a henchman of Moria?! http:// bnent.jp/optc-den2e/ #TreCru pic.twitter.com/AaGUZhmglJ";;;#TreCru;"937342814815490048";https://twitter.com/asirrichti/status/937342814815490048;;None,None,
asirrichti;2017-12-02 03:16;0;0;"Found a Transponder Snail! After two years, Luffy is making moves again! http:// bnent.jp/optc-den2e/ #TreCru pic.twitter.com/oqoQFCyH6W";;;#TreCru;"936871731716689920";https://twitter.com/asirrichti/status/936871731716689920;;None,None,
asirrichti;2017-12-02 03:16;0;0;"Found a Transponder Snail! Luffy struggles to overcome his brother's death. http:// bnent.jp/optc-den2e/ #TreCru pic.twitter.com/gslIj3LZm3";;;#TreCru;"936871637252685825";https://twitter.com/asirrichti/status/936871637252685825;;None,None,
asirrichti;2017-12-02 03:15;0;0;"Found a Transponder Snail! The Stunning Scientific Navy Unit at Headquarters! http:// bnent.jp/optc-den2e/ #TreCru pic.twitter.com/7mzu3Xj567";;;#TreCru;"936871334595801088";https://twitter.com/asirrichti/status/936871334595801088;;None,None,
asirrichti;2017-12-02 03:14;0;0;"Found a Transponder Snail! A tearful farewell: The Going Merry's last voyage. http:// bnent.jp/optc-den2e/ #TreCru pic.twitter.com/exurWLxiGC";;;#TreCru;"936871128248737792";https://twitter.com/asirrichti/status/936871128248737792;;None,None,
asirrichti;2017-12-01 08:42;0;0;"Found a Transponder Snail! Giants, sea monsters and other amazing encounters! http:// bnent.jp/optc-den2e/ #TreCru pic.twitter.com/blV4NcjjON";;;#TreCru;"936591276203487232";https://twitter.com/asirrichti/status/936591276203487232;;None,None,
asirrichti;2017-11-30 14:50;0;0;"Found a Transponder Snail! Candid shots of the Straw Hats on their new ship! http:// bnent.jp/optc-den2e/ #TreCru pic.twitter.com/yvR5Sqttxu";;;#TreCru;"936321548516052992";https://twitter.com/asirrichti/status/936321548516052992;;None,None,
asirrichti;2017-11-30 14:49;0;0;"Found a Transponder Snail! For honor! Giants clash in ancient jungle! http:// bnent.jp/optc-den2e/ #TreCru pic.twitter.com/qKolj2gVet";;;#TreCru;"936321379695255554";https://twitter.com/asirrichti/status/936321379695255554;;None,None,
asirrichti;2017-11-30 14:49;0;0;"Found a Transponder Snail! Scoop! Exclusive photos of the mysterious Mr. 0!! http:// bnent.jp/optc-den2e/ #TreCru pic.twitter.com/bo4traIInP";;;#TreCru;"936321282471354369";https://twitter.com/asirrichti/status/936321282471354369;;None,None,
asirrichti;2017-11-30 14:47;0;0;"Found a Transponder Snail! Giant mermaid princess!? Sanji, don't turn around! http:// bnent.jp/optc-den2e/ #TreCru pic.twitter.com/MeywGu5ADC";;;#TreCru;"936320679812698114";https://twitter.com/asirrichti/status/936320679812698114;;None,None,
asirrichti;2017-11-30 14:46;0;0;"Found a Transponder Snail! Chopper and Law are investigating medication! http:// bnent.jp/optc-den2e/ #TreCru pic.twitter.com/jCeA9iD52s";;;#TreCru;"936320587567427584";https://twitter.com/asirrichti/status/936320587567427584;;None,None,
asirrichti;2017-11-30 01:57;0;0;"Found a Transponder Snail! Chopper and Law are investigating medication! http:// bnent.jp/optc-den2e/ #TreCru pic.twitter.com/Vo5UB4tvtY";;;#TreCru;"936126968365494272";https://twitter.com/asirrichti/status/936126968365494272;;None,None,
asirrichti;2017-11-29 07:40;0;0;"Found a Transponder Snail! Giants, sea monsters and other amazing encounters! http:// bnent.jp/optc-den2e/ #TreCru pic.twitter.com/u8FTnuiuPW";;;#TreCru;"935850929928196096";https://twitter.com/asirrichti/status/935850929928196096;;None,None,
asirrichti;2017-11-28 15:10;0;0;"Found a Transponder Snail! Ace and Luffy form an unbreakable wall in battle! http:// bnent.jp/optc-den2e/ #TreCru pic.twitter.com/JQAGTex1JR";;;#TreCru;"935601937101328390";https://twitter.com/asirrichti/status/935601937101328390;;None,None,
asirrichti;2017-11-28 15:04;0;0;"Found a Transponder Snail! A whale of an encounter! "We'll meet here again!" http:// bnent.jp/optc-den2e/ #TreCru pic.twitter.com/1uRtqjlq68";;;#TreCru;"935600363750731777";https://twitter.com/asirrichti/status/935600363750731777;;None,None,
asirrichti;2017-11-28 15:04;0;0;"Found a Transponder Snail! Execution! Is this the Straw Hats' final moment?! http:// bnent.jp/optc-den2e/ #TreCru pic.twitter.com/i2i0tx6SEP";;;#TreCru;"935600199246012416";https://twitter.com/asirrichti/status/935600199246012416;;None,None,
asirrichti;2017-11-28 15:03;0;0;"Found a Transponder Snail! Take a look at the Fishmen behind Arlong Park! http:// bnent.jp/optc-den2e/ #TreCru pic.twitter.com/lZdCLmIJHK";;;#TreCru;"935600100889497602";https://twitter.com/asirrichti/status/935600100889497602;;None,None,
asirrichti;2017-11-28 15:03;0;0;"Found a Transponder Snail! "I'll never forget you!!" Local cook sets sail! http:// bnent.jp/optc-den2e/ #TreCru pic.twitter.com/QrTFrbC52Z";;;#TreCru;"935600037098377216";https://twitter.com/asirrichti/status/935600037098377216;;None,None,
asirrichti;2017-11-28 05:44;0;0;"Found a Transponder Snail! After two years, Luffy is making moves again! http:// bnent.jp/optc-den2e/ #TreCru pic.twitter.com/fhZpVcVczd";;;#TreCru;"935459324788428800";https://twitter.com/asirrichti/status/935459324788428800;;None,None,
asirrichti;2017-11-27 14:36;0;0;"Found a Transponder Snail! Giants, sea monsters and other amazing encounters! http:// bnent.jp/optc-den2e/ #TreCru pic.twitter.com/0xgcy2mks0";;;#TreCru;"935230914761756673";https://twitter.com/asirrichti/status/935230914761756673;;None,None,