username;date;retweets;favorites;text;geo;mentions;hashtags;id;permalink;place_full_name;location;timezone;profile_location_name
AxissMundi;2017-12-06 20:55;2;0;"geminianja";;;;"938587839259922432";https://twitter.com/AxissMundi/status/938587839259922432;;None,None,
AxissMundi;2017-12-06 19:49;0;0;"queria poder ajudá-la a ficar bem. :(";;;;"938571046688624640";https://twitter.com/AxissMundi/status/938571046688624640;;None,None,
AxissMundi;2017-12-06 19:39;0;0;"vi meu bebê hoje e eu só sabia olhar para ela e pensar nossa que mulher linda poxa ela é maravilhosa";;;;"938568719390986242";https://twitter.com/AxissMundi/status/938568719390986242;;None,None,
AxissMundi;2017-12-04 19:02;3;3;"cara, se tu gosta de alguém, DEMONSTRA se tu se importa, DEMONSTRA se tu sente a falta, DIZ ninguém é adivinha não meu brother";;;;"937834509520826369";https://twitter.com/AxissMundi/status/937834509520826369;;None,None,
AxissMundi;2017-12-02 17:42;2;7;"quando vocês não quiserem mais nada com alguém, cheguem com a pessoa e abram o jogo. não fiquem de enrolação. ser a pessoa insegura de "vou ser deixada ou não?" é uma merda e nos destrói.";;;;"937089734995775488";https://twitter.com/AxissMundi/status/937089734995775488;;None,None,