username;date;retweets;favorites;text;geo;mentions;hashtags;id;permalink;place_full_name;location;timezone;profile_location_name
ErickMiPrinceso;2017-12-06 22:38;0;0;"Me pasarían fotos de las FAS con los chicos goals";;;;"938613754341810181";https://twitter.com/ErickMiPrinceso/status/938613754341810181;;Donde vallan estos pelotudos💙,None,
ErickMiPrinceso;2017-12-06 17:22;0;1;"Muchas gracias";;;;"938534150155526144";https://twitter.com/ErickMiPrinceso/status/938534150155526144;;Donde vallan estos pelotudos💙,None,
ErickMiPrinceso;2017-12-06 16:15;0;0;"Ami se me tiene que borrar , todo no";;;;"938517159805931520";https://twitter.com/ErickMiPrinceso/status/938517159805931520;;Donde vallan estos pelotudos💙,None,
ErickMiPrinceso;2017-12-06 16:14;0;0;"Gracias , de los chicos también";;;;"938516988216963072";https://twitter.com/ErickMiPrinceso/status/938516988216963072;;Donde vallan estos pelotudos💙,None,
ErickMiPrinceso;2017-12-06 16:03;0;0;"Me pasarías mas ahre";;;;"938514156419993600";https://twitter.com/ErickMiPrinceso/status/938514156419993600;;Donde vallan estos pelotudos💙,None,
ErickMiPrinceso;2017-12-06 15:53;0;0;"Quiero fotos de los chicos";;;;"938511681034080258";https://twitter.com/ErickMiPrinceso/status/938511681034080258;;Donde vallan estos pelotudos💙,None,
ErickMiPrinceso;2017-12-06 15:09;0;0;"Si fueran tan amables me pasarían fotos de los chicos";;;;"938500722714398720";https://twitter.com/ErickMiPrinceso/status/938500722714398720;;Donde vallan estos pelotudos💙,None,
ErickMiPrinceso;2017-12-06 15:08;0;0;"Quien fue la pelotuda de borrar todas la fotos y vídeos yo";;;;"938500474969427968";https://twitter.com/ErickMiPrinceso/status/938500474969427968;;Donde vallan estos pelotudos💙,None,
ErickMiPrinceso;2017-12-06 08:47;0;0;"Yo no";;;;"938404538469543936";https://twitter.com/ErickMiPrinceso/status/938404538469543936;;Donde vallan estos pelotudos💙,None,
ErickMiPrinceso;2017-12-05 23:37;0;0;"Mis bebes";;;;"938266194368450560";https://twitter.com/ErickMiPrinceso/status/938266194368450560;;Donde vallan estos pelotudos💙,None,
ErickMiPrinceso;2017-12-05 16:12;0;0;"Como , me voy a enojar gordo";;;;"938154105985478656";https://twitter.com/ErickMiPrinceso/status/938154105985478656;;Donde vallan estos pelotudos💙,None,
ErickMiPrinceso;2017-12-05 13:57;0;0;"Ojo por ojo";;;;"938120161181224960";https://twitter.com/ErickMiPrinceso/status/938120161181224960;;Donde vallan estos pelotudos💙,None,
ErickMiPrinceso;2017-12-05 13:57;0;0;"Estoy muy orgullosa de johann , todo lo que logro y lo que esta logrando con sus hermosa voz que tiene vamos por mas cosas lindas @JohannVera1";;@JohannVera1;;"938120067778252800";https://twitter.com/ErickMiPrinceso/status/938120067778252800;;Donde vallan estos pelotudos💙,None,
ErickMiPrinceso;2017-12-05 02:16;0;1;"Yo re queeee carajo";;;;"937943735761031170";https://twitter.com/ErickMiPrinceso/status/937943735761031170;;Donde vallan estos pelotudos💙,None,
ErickMiPrinceso;2017-12-05 02:15;0;0;"Bueno , buenas noches";;;;"937943392088182788";https://twitter.com/ErickMiPrinceso/status/937943392088182788;;Donde vallan estos pelotudos💙,None,
ErickMiPrinceso;2017-12-05 02:13;0;0;"Yo viendo , todo joerick los extraño demasiado";;;;"937943011539013632";https://twitter.com/ErickMiPrinceso/status/937943011539013632;;Donde vallan estos pelotudos💙,None,
ErickMiPrinceso;2017-12-05 02:12;0;0;"Cuando entras y hay todo porno";;;;"937942706910789633";https://twitter.com/ErickMiPrinceso/status/937942706910789633;;Donde vallan estos pelotudos💙,None,
ErickMiPrinceso;2017-12-04 23:55;0;0;"Me encanto la canción de johaan es un gran artista";;;;"937908300296998914";https://twitter.com/ErickMiPrinceso/status/937908300296998914;;Donde vallan estos pelotudos💙,None,
ErickMiPrinceso;2017-12-04 23:46;1;3;"Me parece una falta de respeto ahre pic.twitter.com/0XhiXgLX7l";;;;"937906087654838272";https://twitter.com/ErickMiPrinceso/status/937906087654838272;;Donde vallan estos pelotudos💙,None,
ErickMiPrinceso;2017-12-04 23:35;2;1;"Así estoy pic.twitter.com/tlFRx5Gykc";;;;"937903213281513473";https://twitter.com/ErickMiPrinceso/status/937903213281513473;;Donde vallan estos pelotudos💙,None,
ErickMiPrinceso;2017-12-04 21:45;1;1;"Yo también lose bebe";;;;"937875464768671744";https://twitter.com/ErickMiPrinceso/status/937875464768671744;;Donde vallan estos pelotudos💙,None,
ErickMiPrinceso;2017-12-04 21:44;0;0;"HAY ESTOY LLORANDO LOS AMO";;;;"937875301039734784";https://twitter.com/ErickMiPrinceso/status/937875301039734784;;Donde vallan estos pelotudos💙,None,
ErickMiPrinceso;2017-12-04 11:23;1;3;"Awwww , mi bebe como te amo si ya 15 meses bebé , vos también gila ojo ahre sos mi mejor Ifb";;;;"937719005447622658";https://twitter.com/ErickMiPrinceso/status/937719005447622658;;Donde vallan estos pelotudos💙,None,
ErickMiPrinceso;2017-12-03 20:28;0;0;"Es muy lindo maluma chau";;;;"937493720101945346";https://twitter.com/ErickMiPrinceso/status/937493720101945346;;Donde vallan estos pelotudos💙,None,
ErickMiPrinceso;2017-12-03 15:33;2;1;"Estoy tan orgullosa de estos chicos lograron tantas en cosas en casi 1 año , gracias por hacerme tan bien gracias pic.twitter.com/PNzTm6aEjs";;;;"937419488110235649";https://twitter.com/ErickMiPrinceso/status/937419488110235649;;Donde vallan estos pelotudos💙,None,
ErickMiPrinceso;2017-12-03 15:05;0;0;"ESTOY TAN ORGULLOSA";;;;"937412484201410560";https://twitter.com/ErickMiPrinceso/status/937412484201410560;;Donde vallan estos pelotudos💙,None,
ErickMiPrinceso;2017-12-03 15:02;0;0;"LOS MOVIMIENTOS DE JOEL LA RE PUTA MADRE HACEME DE TODO";;;;"937411785279332352";https://twitter.com/ErickMiPrinceso/status/937411785279332352;;Donde vallan estos pelotudos💙,None,
ErickMiPrinceso;2017-12-03 14:50;0;0;"AJAJAJAJAJAJA YO TAMBIÉN AJAJA";;;;"937408796976140288";https://twitter.com/ErickMiPrinceso/status/937408796976140288;;Donde vallan estos pelotudos💙,None,
ErickMiPrinceso;2017-12-03 14:49;0;0;"ERICK BAILO SOLO AJAJAAJA LO DEJARON RE SOLO AJAJA PERO VENI QUE YO TE BAILO AHRE";;;;"937408460873981953";https://twitter.com/ErickMiPrinceso/status/937408460873981953;;Donde vallan estos pelotudos💙,None,
ErickMiPrinceso;2017-12-03 14:37;0;2;"COMO EL CHABON RE SALTIO A ERICK PARA HABLAR AAJAJAJAJA PARA QUE LE DIJIERON";;;;"937405419961683968";https://twitter.com/ErickMiPrinceso/status/937405419961683968;;Donde vallan estos pelotudos💙,None,
ErickMiPrinceso;2017-12-03 14:35;0;0;"YO ME EMAGINO A ERICK NO ENTIENDO UNA CHOTO DE LO QUE HABLABAN Y DESPUÉS JOEL LE TIENE QUE DECIR TODO LO QUE dijeron";;;;"937404932835217408";https://twitter.com/ErickMiPrinceso/status/937404932835217408;;Donde vallan estos pelotudos💙,None,
ErickMiPrinceso;2017-12-03 14:33;0;0;"DE LO QUE PUDE VER LA CONCHA DE LA LORA";;;;"937404503611138054";https://twitter.com/ErickMiPrinceso/status/937404503611138054;;Donde vallan estos pelotudos💙,None,
ErickMiPrinceso;2017-12-03 14:32;0;0;"VI EL FINAL Y ESTOY MUERTA";;;;"937404115734364160";https://twitter.com/ErickMiPrinceso/status/937404115734364160;;Donde vallan estos pelotudos💙,None,
ErickMiPrinceso;2017-12-03 14:25;0;0;"VIENE MIS HIJOS Y NO LO PUEDO HABLAME DE FRACASAR";;;;"937402421181079552";https://twitter.com/ErickMiPrinceso/status/937402421181079552;;Donde vallan estos pelotudos💙,None,
ErickMiPrinceso;2017-12-03 00:22;0;0;"Gracias por tanto";;;;"937190367572758528";https://twitter.com/ErickMiPrinceso/status/937190367572758528;;Donde vallan estos pelotudos💙,None,
ErickMiPrinceso;2017-12-02 22:54;0;0;"RETIRATE";;;;"937168158879899648";https://twitter.com/ErickMiPrinceso/status/937168158879899648;;Donde vallan estos pelotudos💙,None,
ErickMiPrinceso;2017-12-02 22:22;0;1;"quiero hacer un grupo";;;;"937160179799298048";https://twitter.com/ErickMiPrinceso/status/937160179799298048;;Donde vallan estos pelotudos💙,None,
ErickMiPrinceso;2017-12-02 22:20;0;0;"yo me haria fan de federico pero tengo muchos idolos ahre , igual soy como fan ahre";;;;"937159609923579904";https://twitter.com/ErickMiPrinceso/status/937159609923579904;;Donde vallan estos pelotudos💙,None,
ErickMiPrinceso;2017-12-02 22:11;0;0;"@chrispriority13 hermoso icon , linda cuenta";;@chrispriority13;;"937157232101380096";https://twitter.com/ErickMiPrinceso/status/937157232101380096;;Donde vallan estos pelotudos💙,None,
ErickMiPrinceso;2017-12-02 22:10;0;0;"@Allproudcnco tu icon , tu header perfectos linda cuenta aguante dosogas loco";;@Allproudcnco;;"937156944200196096";https://twitter.com/ErickMiPrinceso/status/937156944200196096;;Donde vallan estos pelotudos💙,None,
ErickMiPrinceso;2017-12-02 22:08;1;1;"@Chrispirobo hermoso fijado lloro nunca me va pasar , linda cuenta";;@Chrispirobo;;"937156541706330118";https://twitter.com/ErickMiPrinceso/status/937156541706330118;;Donde vallan estos pelotudos💙,None,
ErickMiPrinceso;2017-12-02 22:07;1;1;"@ccno_mex26 hermoso fijado , me encanta tu cuenta";;@ccno_mex26;;"937156255747059713";https://twitter.com/ErickMiPrinceso/status/937156255747059713;;Donde vallan estos pelotudos💙,None,
ErickMiPrinceso;2017-12-02 22:02;0;0;"@AngieCNCO_SV27 Linda cuenta";;@AngieCNCO_SV27;;"937155035573706755";https://twitter.com/ErickMiPrinceso/status/937155035573706755;;Donde vallan estos pelotudos💙,None,
ErickMiPrinceso;2017-12-02 22:01;0;1;"@joelsbxbe hermoso twee fijado linda cuenta";;@joelsbxbe;;"937154897417506816";https://twitter.com/ErickMiPrinceso/status/937154897417506816;;Donde vallan estos pelotudos💙,None,
ErickMiPrinceso;2017-12-02 22:01;1;1;"@HappinessForSV Te gusta sebas es una hermosa persona , lo amo hermosa cuenta goasl";;@HappinessForSV;;"937154678533558274";https://twitter.com/ErickMiPrinceso/status/937154678533558274;;Donde vallan estos pelotudos💙,None,
ErickMiPrinceso;2017-12-02 21:59;0;1;"@bepcbyo Hermoso icon hermoso todo";;@bepcbyo;;"937154412275032064";https://twitter.com/ErickMiPrinceso/status/937154412275032064;;Donde vallan estos pelotudos💙,None,
ErickMiPrinceso;2017-12-02 21:59;1;0;"@joelhacemetuya tu user Ajajajja linda cuenta hermosa icon";;@joelhacemetuya;;"937154229428477952";https://twitter.com/ErickMiPrinceso/status/937154229428477952;;Donde vallan estos pelotudos💙,None,
ErickMiPrinceso;2017-12-02 21:58;1;1;"@ahrejoels Bonita cuenta , tu icon el feto de joel lloro";;@ahrejoels;;"937154005255491584";https://twitter.com/ErickMiPrinceso/status/937154005255491584;;Donde vallan estos pelotudos💙,None,
ErickMiPrinceso;2017-12-02 21:57;0;0;"@xKingXavierx Linda cuenta";;@xKingXavierx;;"937153751323947008";https://twitter.com/ErickMiPrinceso/status/937153751323947008;;Donde vallan estos pelotudos💙,None,
ErickMiPrinceso;2017-12-02 21:56;0;0;"@tamylbq2012 Linda cuenta me alegro que hallas conocido a erick";;@tamylbq2012;;"937153447383719937";https://twitter.com/ErickMiPrinceso/status/937153447383719937;;Donde vallan estos pelotudos💙,None,
ErickMiPrinceso;2017-12-02 21:41;1;1;"@valiouscnco Hermoso icon Linda cuenta";;@valiouscnco;;"937149890416840704";https://twitter.com/ErickMiPrinceso/status/937149890416840704;;Donde vallan estos pelotudos💙,None,
ErickMiPrinceso;2017-12-02 21:38;0;1;"@Tati20883 Me caes bien";;@Tati20883;;"937149025933029376";https://twitter.com/ErickMiPrinceso/status/937149025933029376;;Donde vallan estos pelotudos💙,None,
ErickMiPrinceso;2017-12-02 21:34;1;1;"@cncomybabies siempre me caíste bien lo que pasa que nunca te hable, hermosa cuenta";;@cncomybabies;;"937147897539448832";https://twitter.com/ErickMiPrinceso/status/937147897539448832;;Donde vallan estos pelotudos💙,None,
ErickMiPrinceso;2017-12-02 21:23;1;2;"@helendepimentel Linda cuenta siempre fiel a JOEL";;@helendepimentel;;"937145141453836288";https://twitter.com/ErickMiPrinceso/status/937145141453836288;;Donde vallan estos pelotudos💙,None,
ErickMiPrinceso;2017-12-02 21:18;27;5;"RT y opino de tu cuenta";;;;"937143872123219968";https://twitter.com/ErickMiPrinceso/status/937143872123219968;;Donde vallan estos pelotudos💙,None,
ErickMiPrinceso;2017-12-02 21:13;0;0;"11:11 @itsjoelpimentel";;@itsjoelpimentel;;"937142607318343680";https://twitter.com/ErickMiPrinceso/status/937142607318343680;;Donde vallan estos pelotudos💙,None,
ErickMiPrinceso;2017-12-02 21:12;0;0;"11:11 @antovasquez_";;@antovasquez_;;"937142470617522177";https://twitter.com/ErickMiPrinceso/status/937142470617522177;;Donde vallan estos pelotudos💙,None,
ErickMiPrinceso;2017-12-02 18:58;0;0;"Awwww mi bebé , te amo muchísimo";;;;"937108798224896000";https://twitter.com/ErickMiPrinceso/status/937108798224896000;;Donde vallan estos pelotudos💙,None,
ErickMiPrinceso;2017-12-02 18:57;0;0;"Joel ve todo";;;;"937108367696449536";https://twitter.com/ErickMiPrinceso/status/937108367696449536;;Donde vallan estos pelotudos💙,None,
ErickMiPrinceso;2017-12-02 15:49;0;0;"Estoy muy aburrida , mande memes de los chicos ahre";;;;"937061254048382983";https://twitter.com/ErickMiPrinceso/status/937061254048382983;;Donde vallan estos pelotudos💙,None,
ErickMiPrinceso;2017-12-02 15:22;1;1;"Siempre , voy a estar acá beba";;;;"937054510303899648";https://twitter.com/ErickMiPrinceso/status/937054510303899648;;Donde vallan estos pelotudos💙,None,
ErickMiPrinceso;2017-12-01 22:43;0;0;"FEDERICO ESTA MUY BUENO ESE PIBE , DIOS Y ES UN AMOR CON SUS fan AGUANTE DOSOGAS WACHO";;;;"936803069290954752";https://twitter.com/ErickMiPrinceso/status/936803069290954752;;Donde vallan estos pelotudos💙,None,
ErickMiPrinceso;2017-11-30 18:00;0;0;"Es una joyita pic.twitter.com/uqjtza4FYC";;;;"936369352374390793";https://twitter.com/ErickMiPrinceso/status/936369352374390793;;Donde vallan estos pelotudos💙,None,
ErickMiPrinceso;2017-11-30 09:44;0;0;"Es un hombre muy bello pic.twitter.com/fIZXp6yKZI";;;;"936244435200954369";https://twitter.com/ErickMiPrinceso/status/936244435200954369;;Donde vallan estos pelotudos💙,None,
ErickMiPrinceso;2017-11-30 09:41;0;1;"Mis padres como los extrañaba pic.twitter.com/z197ut8q8E";;;;"936243819430993920";https://twitter.com/ErickMiPrinceso/status/936243819430993920;;Donde vallan estos pelotudos💙,None,
ErickMiPrinceso;2017-11-30 09:38;0;1;"Wacho joerick loco pic.twitter.com/LCUSvkMmco";;;;"936243112032260101";https://twitter.com/ErickMiPrinceso/status/936243112032260101;;Donde vallan estos pelotudos💙,None,
ErickMiPrinceso;2017-11-29 18:57;0;0;"Dignidad* igual soy yo en la vida";;;;"936021295971500032";https://twitter.com/ErickMiPrinceso/status/936021295971500032;;Donde vallan estos pelotudos💙,None,
ErickMiPrinceso;2017-11-29 18:56;0;0;"AJAJAJAJAJAJAJ , ESA DOGNIDAD";;;;"936021143722582022";https://twitter.com/ErickMiPrinceso/status/936021143722582022;;Donde vallan estos pelotudos💙,None,
ErickMiPrinceso;2017-11-29 09:00;0;1;"Que mala, persona eres";;;;"935871102122938368";https://twitter.com/ErickMiPrinceso/status/935871102122938368;;Donde vallan estos pelotudos💙,None,
ErickMiPrinceso;2017-11-28 23:26;0;0;"Extraño mucho a joerick lloro";;;;"935726519237963776";https://twitter.com/ErickMiPrinceso/status/935726519237963776;;Donde vallan estos pelotudos💙,None,
ErickMiPrinceso;2017-11-28 23:25;0;0;"ALTO PORNO WACHO";;;;"935726324571934722";https://twitter.com/ErickMiPrinceso/status/935726324571934722;;Donde vallan estos pelotudos💙,None,
ErickMiPrinceso;2017-11-28 22:53;0;1;"Claro";;;;"935718400478842883";https://twitter.com/ErickMiPrinceso/status/935718400478842883;;Donde vallan estos pelotudos💙,None,
ErickMiPrinceso;2017-11-28 22:53;0;1;"Mentira que yo te hable gila , y no te caí bien";;;;"935718307889602560";https://twitter.com/ErickMiPrinceso/status/935718307889602560;;Donde vallan estos pelotudos💙,None,
ErickMiPrinceso;2017-11-28 20:12;0;1;"AJAJAJAJA Mal no";;;;"935677836215619584";https://twitter.com/ErickMiPrinceso/status/935677836215619584;;Donde vallan estos pelotudos💙,None,
ErickMiPrinceso;2017-11-28 08:54;0;1;"Me encanta mi icon";;;;"935507218690174976";https://twitter.com/ErickMiPrinceso/status/935507218690174976;;Donde vallan estos pelotudos💙,None,
ErickMiPrinceso;2017-11-27 20:32;0;0;"Ara https:// twitter.com/laughpimentel/ status/935319916751872000 …";;;;"935320452561625089";https://twitter.com/ErickMiPrinceso/status/935320452561625089;;Donde vallan estos pelotudos💙,None,