username;date;retweets;favorites;text;geo;mentions;hashtags;id;permalink;place_full_name;location;timezone;profile_location_name
GinsburgJobs;2017-12-06 18:18;3;2;"House Democrats voted to advance the impeachment of Trump. https://www. huffingtonpost.com/entry/house-im peachment-donald-trump_us_5a28616be4b03ece02ffedd1 …";;;;"938548152403099648";https://twitter.com/GinsburgJobs/status/938548152403099648;;New York, New York,Eastern Time (US & Canada),
GinsburgJobs;2017-12-06 17:16;3;6;"The most accurate climate change models predict the most alarming consequences, study finds http:// wapo.st/2jlhcR8?tid=ss _tw&utm_term=.10b9a72b6602 …";;;;"938532737782304768";https://twitter.com/GinsburgJobs/status/938532737782304768;;New York, New York,Eastern Time (US & Canada),
GinsburgJobs;2017-12-06 17:16;4;2;"Opinion | On second thought, Trump decides not to give peace a chance http:// wapo.st/2iXShGu?tid=ss _tw&utm_term=.783e84b94340 …";;;;"938532600314023941";https://twitter.com/GinsburgJobs/status/938532600314023941;;New York, New York,Eastern Time (US & Canada),
GinsburgJobs;2017-12-06 16:17;7;7;"Whistleblower To Dems: Flynn Promised Biz Associate He’d Gut Russia Sanctions http:// talkingpointsmemo.com/muckraker/whis tleblower-to-dems-flynn-promised-biz-associate-hed-gut-russia-sanctions … via @TPM";;@TPM;;"938517815325347841";https://twitter.com/GinsburgJobs/status/938517815325347841;;New York, New York,Eastern Time (US & Canada),
GinsburgJobs;2017-12-06 16:17;4;0;"Tillerson Alone In Defending Trump's Jerusalem Move That 'World Is Against' http:// talkingpointsmemo.com/news/tillerson -alone-defending-trump-recognition-jerusalem-israel-capital … via @TPM";;@TPM;;"938517754495340544";https://twitter.com/GinsburgJobs/status/938517754495340544;;New York, New York,Eastern Time (US & Canada),
GinsburgJobs;2017-12-06 14:46;5;3;"NAACP to Trump: Stay away from civil rights museum opening https:// shareblue.com/naacp-to-trump -stay-away-from-civil-rights-museum-opening/#.WihJAP1y5YA.twitter … via @shareblue";;@shareblue;#;"938494793017159680";https://twitter.com/GinsburgJobs/status/938494793017159680;;New York, New York,Eastern Time (US & Canada),
GinsburgJobs;2017-12-06 14:45;0;2;"Democratic women senators lead the way in demanding Al Franken’s resignation https:// shareblue.com/democratic-wom en-senators-lead-the-way-in-demanding-al-frankens-resignation/#.WihI80lcRPs.twitter … via @shareblue";;@shareblue;#;"938494740710002688";https://twitter.com/GinsburgJobs/status/938494740710002688;;New York, New York,Eastern Time (US & Canada),
GinsburgJobs;2017-12-06 14:45;2;0;"Roy Moore advertises his vile rally with Steve Bannon as “Kid Friendly” https:// shareblue.com/roy-moore-adve rtises-his-vile-rally-with-steve-bannon-as-kid-friendly/#.WihI4BYrccw.twitter … via @shareblue";;@shareblue;#;"938494659264962560";https://twitter.com/GinsburgJobs/status/938494659264962560;;New York, New York,Eastern Time (US & Canada),
GinsburgJobs;2017-12-06 12:59;2;3;"Trump’s Endorsement of Roy Moore Points Up a G.O.P. Problem: Chaos via @NYTimes https://www. nytimes.com/2017/12/05/us/ politics/trump-moore-republicans-chaos.html …";;@NYTimes;;"938467830655344640";https://twitter.com/GinsburgJobs/status/938467830655344640;;New York, New York,Eastern Time (US & Canada),
GinsburgJobs;2017-12-06 12:11;1;2;"Senate Democratic women call on Franken to resign amid further allegations of sexual harassment - The Washington Post https:// apple.news/AJPwHpD7OQqWET MEjMhl9gg …";;;;"938455957658636290";https://twitter.com/GinsburgJobs/status/938455957658636290;;New York, New York,Eastern Time (US & Canada),
GinsburgJobs;2017-12-06 12:06;0;0;"Once a populist, Trump governs like a conservative Republican http:// wapo.st/2BCTrdR?tid=ss _tw&utm_term=.196e81b8e84c …";;;;"938454516604768258";https://twitter.com/GinsburgJobs/status/938454516604768258;;New York, New York,Eastern Time (US & Canada),
GinsburgJobs;2017-12-06 11:51;0;0;"By attacking Mitt Romney, Steve Bannon is gearing up for 2020. https:// newrepublic.com/minutes/146124 /attacking-mitt-romney-steve-bannon-gearing-2020 …";;;;"938450897222455297";https://twitter.com/GinsburgJobs/status/938450897222455297;;New York, New York,Eastern Time (US & Canada),
GinsburgJobs;2017-12-06 10:58;0;0;"There’s not a crisis of uninsured people overusing the emergency room https://www. vox.com/health-care/20 17/12/5/16739504/health-care-uninsured-emergency-room-voxcare?utm_campaign=vox&utm_content=entry&utm_medium=social&utm_source=twitter … via @voxdotcom";;@voxdotcom;;"938437529463873537";https://twitter.com/GinsburgJobs/status/938437529463873537;;New York, New York,Eastern Time (US & Canada),
GinsburgJobs;2017-12-06 10:15;3;1;"Sarah Huckabee Sanders Doesn't Know If Trump Thinks Muslims Should Be Banned From Congress via @politicususa http://www. politicususa.com/2017/12/05/sar ah-sanders-trump-thinks-muslims-banned-congress.html …";;@politicususa;;"938426566140456960";https://twitter.com/GinsburgJobs/status/938426566140456960;;New York, New York,Eastern Time (US & Canada),
GinsburgJobs;2017-12-06 10:14;4;1;"Trump Ambassador Nominee Lied In Testimony About Information She Had Of Contact With Russians via @politicususa http://www. politicususa.com/2017/12/05/tru mp-ambassador-nominee-lied-testimony-information-contact-russians.html …";;@politicususa;;"938426510951763980";https://twitter.com/GinsburgJobs/status/938426510951763980;;New York, New York,Eastern Time (US & Canada),
GinsburgJobs;2017-12-06 10:14;11;8;"Rachel #Maddow Terrifies Trump By Showing Why The Deutsche Bank Subpoena Is The Next Leap Forward In The Russia Scandal via @politicususa http://www. politicususa.com/2017/12/05/rac hel-maddow-terrifies-trump-showing-deutsche-bank-subpoena-leap-russia-scandal.html …";;@politicususa;#Maddow;"938426439388553218";https://twitter.com/GinsburgJobs/status/938426439388553218;;New York, New York,Eastern Time (US & Canada),
GinsburgJobs;2017-12-06 09:20;7;7;"Russian Lawyer To Senate: Jr. Asked For Clinton Info At Trump Tower Meet http:// talkingpointsmemo.com/muckraker/russ ian-lawyer-trump-jr-clinton-info … via @TPM";;@TPM;;"938412776116183040";https://twitter.com/GinsburgJobs/status/938412776116183040;;New York, New York,Eastern Time (US & Canada),
GinsburgJobs;2017-12-06 09:19;2;0;"Conway Defends Support For Moore By Questioning Why Franken Still In Senate http:// talkingpointsmemo.com/livewire/conwa y-hypocrisy-moore-franken … via @TPM";;@TPM;;"938412644524068864";https://twitter.com/GinsburgJobs/status/938412644524068864;;New York, New York,Eastern Time (US & Canada),
GinsburgJobs;2017-12-06 09:19;9;8;"Why Economists Are Warning That The Trump Tax Plan Will Be An Epic Disaster http:// talkingpointsmemo.com/dc/political-p ressure-trumped-fiscal-responsibility-in-gop-tax-cut-crusade … via @TPM";;@TPM;;"938412474562433024";https://twitter.com/GinsburgJobs/status/938412474562433024;;New York, New York,Eastern Time (US & Canada),
GinsburgJobs;2017-12-06 08:22;5;6;"Investigators probe European travel of Trump associates http:// politi.co/2jkaxqp via @politico";;@politico;;"938398183813771266";https://twitter.com/GinsburgJobs/status/938398183813771266;;New York, New York,Eastern Time (US & Canada),
GinsburgJobs;2017-12-06 08:21;4;9;"‘Daily Show’s’ Trevor Noah Slams ‘Morally Degenerate’ Trump for Backing Roy Moore http:// thebea.st/2zVmid7?source =twitter&via=desktop … via @thedailybeast";;@thedailybeast;;"938397945111687169";https://twitter.com/GinsburgJobs/status/938397945111687169;;New York, New York,Eastern Time (US & Canada),
GinsburgJobs;2017-12-06 08:19;2;2;"Trump vs. the Pope on Middle East Peace https://www. axios.com/trump-vs-the-p ope-on-middle-east-peace-2515311460.html?utm_source=twitter&utm_medium=twsocialshare&utm_campaign=organic …";;;;"938397536724946944";https://twitter.com/GinsburgJobs/status/938397536724946944;;New York, New York,Eastern Time (US & Canada),
GinsburgJobs;2017-12-06 08:04;1;0;"They elected him, but is he delivering? (from @AP ) https:// apnews.com/afs:Content:16 34920016 …";;@AP;;"938393602803290113";https://twitter.com/GinsburgJobs/status/938393602803290113;;New York, New York,Eastern Time (US & Canada),
GinsburgJobs;2017-12-05 17:44;7;2;"The CHIP Program Is Beloved. Why Is Its Funding in Danger? https:// nyti.ms/2nzf3WG";;;;"938177219658244097";https://twitter.com/GinsburgJobs/status/938177219658244097;;New York, New York,Eastern Time (US & Canada),
GinsburgJobs;2017-12-05 15:26;41;50;"Sen. Susan Collins, caught in a tax bill lie, faces an enraged electorate back home https://www. dailykos.com/story/2017/12/ 5/1721366/-Susan-Collins-caught-in-a-tax-bill-lie-faces-an-enraged-electorate-back-home …";;;;"938142453244289027";https://twitter.com/GinsburgJobs/status/938142453244289027;;New York, New York,Eastern Time (US & Canada),
GinsburgJobs;2017-12-05 15:25;19;8;"Republicans take up mantle of sexual predation while Democrats let an icon go on principle https://www. dailykos.com/story/2017/12/ 5/1721337/-Republicans-take-up-mantle-of-sexual-predation-as-Democrats-let-an-icon-go-on-principle …";;;;"938142390514323457";https://twitter.com/GinsburgJobs/status/938142390514323457;;New York, New York,Eastern Time (US & Canada),
GinsburgJobs;2017-12-05 14:32;8;5;"Robert Mueller Just Crossed Trump’s ‘Red Line’ In Russia Probe https://www. huffingtonpost.com/entry/trump-re d-line-finances_us_5a26aa6ee4b0f9f0203f5571?73l …";;;;"938129091416518656";https://twitter.com/GinsburgJobs/status/938129091416518656;;New York, New York,Eastern Time (US & Canada),
GinsburgJobs;2017-12-05 13:42;2;0;"I.O.C. Gives Russia Major Punishment for Winter Olympics via @NYTimes https://www. nytimes.com/2017/12/05/spo rts/olympics/ioc-russia-winter-olympics.html …";;@NYTimes;;"938116321757327360";https://twitter.com/GinsburgJobs/status/938116321757327360;;New York, New York,Eastern Time (US & Canada),
GinsburgJobs;2017-12-05 13:16;3;5;"Opinion | Conyers resigns, setting up a stark contrast between the two parties http:// wapo.st/2AwT9pA?tid=ss _tw&utm_term=.bb79542334ac …";;;;"938109905390710786";https://twitter.com/GinsburgJobs/status/938109905390710786;;New York, New York,Eastern Time (US & Canada),
GinsburgJobs;2017-12-05 13:07;16;12;"“You’re not doing your job.” Reporters rip White House for refusing to answer questions https:// shareblue.com/youre-not-doin g-your-job-reporters-rip-white-house-for-refusing-to-answer-questions/#.WibgXl9GtpI.twitter … via @shareblue";;@shareblue;#;"938107567250829312";https://twitter.com/GinsburgJobs/status/938107567250829312;;New York, New York,Eastern Time (US & Canada),
GinsburgJobs;2017-12-05 13:07;10;5;"Pence took only 48 hours to go from plotting a takeover to shilling for Trump https:// shareblue.com/pence-took-onl y-48-hours-to-go-from-plotting-a-takeover-to-shilling-for-trump/#.WibgVAc_OFM.twitter … via @shareblue";;@shareblue;#;"938107523764314112";https://twitter.com/GinsburgJobs/status/938107523764314112;;New York, New York,Eastern Time (US & Canada),
GinsburgJobs;2017-12-05 13:06;2;2;"“Let’s leave my child out of this.” CNN anchor shames Moore apologist during vile interview https:// shareblue.com/lets-leave-my- child-out-of-this-cnn-anchor-shames-moore-apologist-during-vile-interview/#.WibgPk9FDrs.twitter … via @shareblue";;@shareblue;#;"938107432382984192";https://twitter.com/GinsburgJobs/status/938107432382984192;;New York, New York,Eastern Time (US & Canada),
GinsburgJobs;2017-12-05 11:46;5;1;"The Republican Tax Plan Is a Gift to the Next Democratic Majority | New Republic https:// newrepublic.com/article/146105 /republican-tax-plan-gift-next-democratic-majority …";;;;"938087069485813761";https://twitter.com/GinsburgJobs/status/938087069485813761;;New York, New York,Eastern Time (US & Canada),
GinsburgJobs;2017-12-05 11:45;16;6;"K.T. McFarland joins the growing list of Trump officials who have lied about Russian contacts. https:// newrepublic.com/minutes/146109 /kt-mcfarland-joins-growing-list-trump-officials-lied-russian-contacts …";;;;"938086968520593409";https://twitter.com/GinsburgJobs/status/938086968520593409;;New York, New York,Eastern Time (US & Canada),
GinsburgJobs;2017-12-05 10:48;3;1;"Conyers Will Leave Congress in Wake of Harassment Claims via @NYTimes https://www. nytimes.com/2017/12/05/us/ politics/john-conyers-election.html …";;@NYTimes;;"938072483579736064";https://twitter.com/GinsburgJobs/status/938072483579736064;;New York, New York,Eastern Time (US & Canada),
GinsburgJobs;2017-12-05 10:13;11;4;"These corporations are helping elect an alleged child sex abuser to the U.S. Senate https:// thinkprogress.org/corporate-cont ributions-rnc-roy-moore-cc9f837209e2/ … via @thinkprogress";;@thinkprogress;;"938063677558751232";https://twitter.com/GinsburgJobs/status/938063677558751232;;New York, New York,Eastern Time (US & Canada),
GinsburgJobs;2017-12-05 10:12;3;0;"Roy Moore spokeswoman appears on CNN, says Doug Jones wants to kill host's unborn baby https:// thinkprogress.org/roy-moore-spok esman-janet-porter-cnn-abortion-1786bde1d338/ … via @thinkprogress";;@thinkprogress;;"938063562349731845";https://twitter.com/GinsburgJobs/status/938063562349731845;;New York, New York,Eastern Time (US & Canada),
GinsburgJobs;2017-12-05 10:00;5;5;"Obama's - not Trump's - tweets make 2017 top 10 retweet list via @POLITICO for iOS http:// politi.co/2AqPyLI pic.twitter.com/GxNyrJVUfh";;@POLITICO;;"938060543470039041";https://twitter.com/GinsburgJobs/status/938060543470039041;;New York, New York,Eastern Time (US & Canada),
GinsburgJobs;2017-12-05 10:00;3;2;"Trump's Threat to Take Down the GOP Still Stands via @POLITICO for iOS http:// politi.co/2BzmyPk pic.twitter.com/P3MYm91Kjc";;@POLITICO;;"938060433428307969";https://twitter.com/GinsburgJobs/status/938060433428307969;;New York, New York,Eastern Time (US & Canada),
GinsburgJobs;2017-12-05 09:20;4;1;"'Out of control' Southern California fire explodes overnight, forcing thousands to flee http:// wapo.st/2Av4k1X?tid=ss _tw&utm_term=.14297c875808 …";;;;"938050325046493184";https://twitter.com/GinsburgJobs/status/938050325046493184;;New York, New York,Eastern Time (US & Canada),
GinsburgJobs;2017-12-05 09:17;9;10;"Report: Mueller subpoenaed Deutsche Bank for info on Trump family accounts. https://www. huffingtonpost.com/entry/trump-de utsche-bank-mueller_us_5a269325e4b07324e84082dc?sv5 …";;;;"938049713529671680";https://twitter.com/GinsburgJobs/status/938049713529671680;;New York, New York,Eastern Time (US & Canada),
GinsburgJobs;2017-12-05 09:17;5;6;"Bill O’Reilly’s Smear Campaign Backfires https://www. huffingtonpost.com/entry/bill-ore illy-sexual-harassment-lawsuit_us_5a25a0bfe4b0a02abe933382 …";;;;"938049685188763648";https://twitter.com/GinsburgJobs/status/938049685188763648;;New York, New York,Eastern Time (US & Canada),
GinsburgJobs;2017-12-05 08:26;3;10;"Meghan Markle Is Everything Ivanka Trump Wishes She Could Be http:// thebea.st/2jP5de0?source =twitter&via=desktop … via @thedailybeast";;@thedailybeast;;"938036812223741952";https://twitter.com/GinsburgJobs/status/938036812223741952;;New York, New York,Eastern Time (US & Canada),
GinsburgJobs;2017-12-05 08:25;5;4;"Report: Pence Tried to Bump Trump Off 2016 Ticket After P*ssy Tape Came Out http:// thebea.st/2jSKohE?source =twitter&via=desktop … via @thedailybeast";;@thedailybeast;;"938036691952160769";https://twitter.com/GinsburgJobs/status/938036691952160769;;New York, New York,Eastern Time (US & Canada),
GinsburgJobs;2017-12-05 08:09;1;0;"The Colorado Cake Case Is as Easy as Pie #LGBTQ https:// nyti.ms/2koBM6g";;;#LGBTQ;"938032593341177856";https://twitter.com/GinsburgJobs/status/938032593341177856;;New York, New York,Eastern Time (US & Canada),
GinsburgJobs;2017-12-05 08:09;2;3;"Don’t Prosecute Trump. Impeach Him. https:// nyti.ms/2kluoc8";;;;"938032471152758786";https://twitter.com/GinsburgJobs/status/938032471152758786;;New York, New York,Eastern Time (US & Canada),
GinsburgJobs;2017-12-05 08:08;2;4;"Yes, the President Can Obstruct Justice https:// nyti.ms/2kjAsld";;;;"938032392769540103";https://twitter.com/GinsburgJobs/status/938032392769540103;;New York, New York,Eastern Time (US & Canada),
GinsburgJobs;2017-12-04 17:45;8;3;"Woman shares new evidence of relationship with Roy Moore when she was 17 http:// wapo.st/2AoUTDq?tid=ss _tw&utm_term=.e3abeb54a24b …";;;;"937815197712076801";https://twitter.com/GinsburgJobs/status/937815197712076801;;New York, New York,Eastern Time (US & Canada),
GinsburgJobs;2017-12-04 16:16;9;1;"GOP senator: Ram tax bill through final stages so nobody figures out what’s in it https:// shareblue.com/gop-senator-ra m-tax-bill-final-stages-nobody-figures-whats/#.WiW7QHW_m_s.twitter … via @shareblue";;@shareblue;#;"937792835117637637";https://twitter.com/GinsburgJobs/status/937792835117637637;;New York, New York,Eastern Time (US & Canada),
GinsburgJobs;2017-12-04 16:16;9;6;"“I’m not going to stand back and just let evil win.” CEO to sue Trump over land grab https:// shareblue.com/im-not-going-t o-stand-back-and-just-let-evil-win-ceo-to-sue-trump-over-land-grab/#.WiW7Jb0jo0k.twitter … via @shareblue";;@shareblue;#;"937792724991922177";https://twitter.com/GinsburgJobs/status/937792724991922177;;New York, New York,Eastern Time (US & Canada),
GinsburgJobs;2017-12-04 15:04;2;3;"Pay very close attention to what Trump’s lawyer is saying. He’s making absolutely no sense. https:// thinkprogress.org/trumps-lawyer- not-making-sense-d2887073fcfc/ … via @thinkprogress";;@thinkprogress;;"937774589312163840";https://twitter.com/GinsburgJobs/status/937774589312163840;;New York, New York,Eastern Time (US & Canada),
GinsburgJobs;2017-12-04 15:03;6;4;"Trump says Hillary Clinton repeatedly lied to the FBI. The FBI disagrees. https:// thinkprogress.org/trump-says-hil lary-clinton-repeatedly-lied-to-the-fbi-the-fbi-disagrees-3ab6767d1a74/ … via @thinkprogress";;@thinkprogress;;"937774421502234626";https://twitter.com/GinsburgJobs/status/937774421502234626;;New York, New York,Eastern Time (US & Canada),
GinsburgJobs;2017-12-04 13:52;1;1;"McConnell: It was 'impossible' to make sure the middle class didn't get a tax increase in bill https://www. dailykos.com/story/2017/12/ 4/1720985/-McConnell-It-was-impossible-to-make-sure-the-middle-class-didn-t-get-a-tax-increase-in-bill …";;;;"937756468543180802";https://twitter.com/GinsburgJobs/status/937756468543180802;;New York, New York,Eastern Time (US & Canada),
GinsburgJobs;2017-12-04 13:51;1;4;"No lower bounds for new GOP: Sexual predator Trump endorses Alabama child molester Roy Moore https://www. dailykos.com/story/2017/12/ 4/1721007/-No-lower-bounds-for-new-GOP-Sexual-predator-Trump-endorses-Alabama-child-molester-Roy-Moore …";;;;"937756304445181952";https://twitter.com/GinsburgJobs/status/937756304445181952;;New York, New York,Eastern Time (US & Canada),
GinsburgJobs;2017-12-04 13:32;2;3;"Read This: "SNL’s Hillary Clinton Haunts (and Taunts) Donald Trump: ‘Lock Him Up!’" http:// thebea.st/2jHfY27?via=ios";;;;"937751353937580032";https://twitter.com/GinsburgJobs/status/937751353937580032;;New York, New York,Eastern Time (US & Canada),
GinsburgJobs;2017-12-04 13:31;6;5;"Read This: "Who Wrote That Flynn Tweet, Trump or Dowd? It Hardly Matters—Both Answers Are Horrible for Trump" http:// thebea.st/2nqCSzD?via=ios";;;;"937751226434891776";https://twitter.com/GinsburgJobs/status/937751226434891776;;New York, New York,Eastern Time (US & Canada),
GinsburgJobs;2017-12-04 11:07;14;9;"Trump says shrinking Utah’s monuments is about “states’ rights,” but it’s really about drilling rights. https:// newrepublic.com/minutes/146085 /trump-says-shrinking-utahs-monuments-states-rights-its-really-drilling-rights …";;;;"937715048880988160";https://twitter.com/GinsburgJobs/status/937715048880988160;;New York, New York,Eastern Time (US & Canada),
GinsburgJobs;2017-12-04 11:07;2;1;"Donald Trump and Roy Moore, together at last. https:// newrepublic.com/minutes/146094 /donald-trump-roy-moore-together-last …";;;;"937715012965191680";https://twitter.com/GinsburgJobs/status/937715012965191680;;New York, New York,Eastern Time (US & Canada),
GinsburgJobs;2017-12-04 10:16;5;6;"Billy Bush: ‘Of Course’ 'Access Hollywood' Tape Is Real, ‘He Said It’ http:// talkingpointsmemo.com/livewire/billy -bush-of-course-access-hollywood-tape-is-real … via @TPM";;@TPM;;"937702160153931776";https://twitter.com/GinsburgJobs/status/937702160153931776;;New York, New York,Eastern Time (US & Canada),
GinsburgJobs;2017-12-04 10:16;4;8;"Trump Accuser: We’re Forgotten By Those Who ‘Put Party Above All Else’ http:// talkingpointsmemo.com/livewire/trump -accuser-were-forgotten-by-those-who-put-party-above-all-else … via @TPM";;@TPM;;"937702085373685761";https://twitter.com/GinsburgJobs/status/937702085373685761;;New York, New York,Eastern Time (US & Canada),
GinsburgJobs;2017-12-04 09:27;3;4;"Obama: Elect More Women ‘Because Men Seem To Be Having Some Problems These Days’ https://www. huffingtonpost.com/entry/barack-o bama-women_us_5a24dd9ce4b03350e0b7a354 …";;;;"937689918775668736";https://twitter.com/GinsburgJobs/status/937689918775668736;;New York, New York,Eastern Time (US & Canada),
GinsburgJobs;2017-12-04 09:27;3;2;"Trump Defends Michael Flynn By Saying Hillary Clinton Is The Real Liar https://www. huffingtonpost.com/entry/donald-t rump-defends-michael-flynn_us_5a255146e4b03c44072ed3e1?3dm …";;;;"937689870855819264";https://twitter.com/GinsburgJobs/status/937689870855819264;;New York, New York,Eastern Time (US & Canada),
GinsburgJobs;2017-12-04 09:27;8;3;"Moore is accused of molesting teen girls. He’s Trump’s pick for the senate. https://www. huffingtonpost.com/entry/trump-en dorses-roy-moore_us_5a25399be4b03c44072ebdb1?fs4 …";;;;"937689773333938176";https://twitter.com/GinsburgJobs/status/937689773333938176;;New York, New York,Eastern Time (US & Canada),
GinsburgJobs;2017-12-04 08:40;2;1;"Yemen's former leader Ali Abdullah Saleh has died amid escalating fighting, political aides say https://www. washingtonpost.com/news/world/wp/ 2017/12/04/yemens-former-leader-ali-abdullah-saleh-has-died-amid-escalating-fighting-political-aides-say/?tid=ss_tw&utm_term=.fd97345ee19f …";;;;"937677931819819008";https://twitter.com/GinsburgJobs/status/937677931819819008;;New York, New York,Eastern Time (US & Canada),
GinsburgJobs;2017-12-04 08:35;4;2;"Still Hoping for a Comeback, Billy Bush Slams Trump: ‘Of Course He Said It.’ http:// thebea.st/2jLfnMu?source =twitter&via=desktop … via @thedailybeast";;@thedailybeast;;"937676713760362501";https://twitter.com/GinsburgJobs/status/937676713760362501;;New York, New York,Eastern Time (US & Canada),
GinsburgJobs;2017-12-04 08:33;3;2;"Trump lawyer says president knew Flynn had given FBI the same account he gave to vice president http:// wapo.st/2ApdW0w?tid=ss _tw&utm_term=.82cbd41ca2f5 …";;;;"937676114557849600";https://twitter.com/GinsburgJobs/status/937676114557849600;;New York, New York,Eastern Time (US & Canada),
GinsburgJobs;2017-12-04 08:32;16;8;"What happened when North Carolina cut taxes like the GOP plans to for the country http:// wapo.st/2Asghpr?tid=ss _tw&utm_term=.ee5ed392141a …";;;;"937675921288581121";https://twitter.com/GinsburgJobs/status/937675921288581121;;New York, New York,Eastern Time (US & Canada),
GinsburgJobs;2017-12-03 20:19;10;8;"Billy Bush: Yes, Donald Trump, You Said That https:// nyti.ms/2BGaFI7";;;;"937491547238600705";https://twitter.com/GinsburgJobs/status/937491547238600705;;New York, New York,Eastern Time (US & Canada),
GinsburgJobs;2017-12-03 15:41;5;7;"Feinstein: ‘We’re Beginning To See The Putting Together Of A Case’ Against Him https://www. huffingtonpost.com/entry/dianne-f einstein-trump-tweets-obstruction_us_5a24222ce4b0a02abe91d027?jua …";;;;"937421432455356417";https://twitter.com/GinsburgJobs/status/937421432455356417;;New York, New York,Eastern Time (US & Canada),
GinsburgJobs;2017-12-03 15:40;2;1;"Sheryl Sandberg Warns Of #MeToo Backlash Against Women https://www. huffingtonpost.com/entry/sheryl-s andberg-sexual-harassment-backlash_us_5a22c2a5e4b03350e0b710eb?vf …";;;#MeToo;"937421343544561665";https://twitter.com/GinsburgJobs/status/937421343544561665;;New York, New York,Eastern Time (US & Canada),
GinsburgJobs;2017-12-03 14:32;2;3;"CVS Is Said to Agree to Buy Aetna, Reshaping Health Care Industry https:// nyti.ms/2BIbJvp";;;;"937404229353988097";https://twitter.com/GinsburgJobs/status/937404229353988097;;New York, New York,Eastern Time (US & Canada),
GinsburgJobs;2017-12-03 13:07;5;3;"Watch: SNL introduces Trump’s ghosts of Christmas Past, Present, and Future https://www. vox.com/culture/2017/1 2/3/16729430/watch-snl-trumps-ghosts-of-christmas-past-present-future-christmas-carol?utm_campaign=vox&utm_content=entry&utm_medium=social&utm_source=twitter … via @voxdotcom";;@voxdotcom;;"937382757013114880";https://twitter.com/GinsburgJobs/status/937382757013114880;;New York, New York,Eastern Time (US & Canada),
GinsburgJobs;2017-12-03 13:06;5;6;"“The hypocrisy is astounding”: Tax bill shows the GOP’s debt concerns were pure fraud https://www. vox.com/policy-and-pol itics/2017/12/2/16724978/gop-tax-bill-deficit-debt-fraud?utm_campaign=vox&utm_content=entry&utm_medium=social&utm_source=twitter … via @voxdotcom";;@voxdotcom;;"937382657859768320";https://twitter.com/GinsburgJobs/status/937382657859768320;;New York, New York,Eastern Time (US & Canada),
GinsburgJobs;2017-12-03 11:55;2;2;"Tasks for Congress: Ignore President, Keep Government Open … via @NYTimes https://www. nytimes.com/2017/12/02/opi nion/sunday/tasks-for-congress-ignore-president-keep-government-open.html …";;@NYTimes;;"937364720021114880";https://twitter.com/GinsburgJobs/status/937364720021114880;;New York, New York,Eastern Time (US & Canada),
