username;date;retweets;favorites;text;geo;mentions;hashtags;id;permalink;place_full_name;location;timezone;profile_location_name
GoGoFuryu;2017-12-03 09:23;0;1;"遅くなりましたスミマセンm(_ _)m 今日も殆どのんびりしつつホビーショップに出向いてきましたが何も収穫はありませんでしたｗ WF限定は知人がWFに参加してまして買ってきてくれました＾＾ ただOSのねんどろはオプション品は何もないですがｗ ところで・・・アスナ大好きですか？ pic.twitter.com/JPst09NpQu";;;;"937326344446230528";https://twitter.com/GoGoFuryu/status/937326344446230528;;ホビーショップふりゅ,Hawaii,
GoGoFuryu;2017-12-03 09:19;0;1;"ですのでソロソロ選別が必要になってきてますね。。。 私の方はプライズ品は殆ど処分し残ってるのは僅かです。 ただプライズは売っても10円行けば良い方です。お店では980～1980円で並びますが・・・ｗ";;;;"937325506642317313";https://twitter.com/GoGoFuryu/status/937325506642317313;;ホビーショップふりゅ,Hawaii,
GoGoFuryu;2017-12-03 09:14;0;1;"ありがとうございます～m(_ _)m マテリア姉妹のアドバイスは役に立たないですねｗ";;;;"937324204805955584";https://twitter.com/GoGoFuryu/status/937324204805955584;;ホビーショップふりゅ,Hawaii,
GoGoFuryu;2017-12-03 09:14;0;1;"此方こそお題頂きありがとうございましたm(_ _)m 次の時も宜しくお願いします～♪";;;;"937324077085163520";https://twitter.com/GoGoFuryu/status/937324077085163520;;ホビーショップふりゅ,Hawaii,
GoGoFuryu;2017-12-03 09:13;0;1;"You！ヨハネ買っちゃいなYO！ｗ 私も後５個届くのでコレ以上の余計な出費出来ないですorz （と言いながらもまた友人からガンダムベース行こうぜ！とお誘いがｗ） pic.twitter.com/TF8hQ1v3hr";;;;"937323910969700352";https://twitter.com/GoGoFuryu/status/937323910969700352;;ホビーショップふりゅ,Hawaii,
GoGoFuryu;2017-12-03 07:50;0;3;"帰宅┌(┌՞ਊ՞)┐ｷｪｧｧｧｪｪｪｪｧｧｧ ホビーショップでねんどろ&figmaが全然なかった(・ω・)";;;;"937303114540924929";https://twitter.com/GoGoFuryu/status/937303114540924929;;ホビーショップふりゅ,Hawaii,
GoGoFuryu;2017-12-03 03:33;0;1;"更にニパ子さんにゲート処理されてますしね(*^ω^*) pic.twitter.com/pPsjRP36xk";;;;"937238389375377408";https://twitter.com/GoGoFuryu/status/937238389375377408;;ホビーショップふりゅ,Hawaii,
GoGoFuryu;2017-12-03 03:03;0;1;"もしかしたらリー先生はウッディより酷い目にあってるかもしれないですね(´∀｀*) pic.twitter.com/CKJwxM2I1M";;;;"937230801531367424";https://twitter.com/GoGoFuryu/status/937230801531367424;;ホビーショップふりゅ,Hawaii,
GoGoFuryu;2017-12-03 02:43;0;1;"figmaより小さいからやる場合には工夫は必要ですよね(°▽°) 名古屋飯。毎回、尾頭付き海老フライが出たのでキツかったです_:(´ཀ`」 ∠): pic.twitter.com/m3xAChcSBH";;;;"937225806157201409";https://twitter.com/GoGoFuryu/status/937225806157201409;;ホビーショップふりゅ,Hawaii,
GoGoFuryu;2017-12-03 02:38;0;0;"おはあんこうです(*^ω^*) pic.twitter.com/qQ7xqkYdFW";;;;"937224415066046464";https://twitter.com/GoGoFuryu/status/937224415066046464;;ホビーショップふりゅ,Hawaii,
GoGoFuryu;2017-12-03 02:37;0;1;"はいーでも起きたのはお昼過ぎですが_:(´ཀ`」 ∠):";;;;"937224240679469056";https://twitter.com/GoGoFuryu/status/937224240679469056;;ホビーショップふりゅ,Hawaii,
GoGoFuryu;2017-12-03 02:35;0;10;"散髪行ったら貰った(*^ω^*) pic.twitter.com/rUXSs1y6ca";;;;"937223735098011649";https://twitter.com/GoGoFuryu/status/937223735098011649;;ホビーショップふりゅ,Hawaii,
GoGoFuryu;2017-12-03 00:41;1;15;"おはようございます(・ω・) pic.twitter.com/njji7UMfKI";;;;"937195018296606720";https://twitter.com/GoGoFuryu/status/937195018296606720;;ホビーショップふりゅ,Hawaii,
GoGoFuryu;2017-12-02 11:28;0;1;"NTRって難しいですね（笑） ちょっとした陵辱系ならこんな感じなんでしょうが。。。(・ω・) pic.twitter.com/8V6i5c9dXP";;;;"936995558387998721";https://twitter.com/GoGoFuryu/status/936995558387998721;;ホビーショップふりゅ,Hawaii,
GoGoFuryu;2017-12-02 11:24;1;7;"落書き蝶さん（ @rakugakichouu ）さんからで「哀れなウッディを活躍」です リー先生の魔の手からニパ子さんを救い出したハードボイルドのウッディ・プライド！ pic.twitter.com/RuQdRlRrQG";;@rakugakichouu;;"936994555945091072";https://twitter.com/GoGoFuryu/status/936994555945091072;;ホビーショップふりゅ,Hawaii,
GoGoFuryu;2017-12-02 11:21;2;8;"グッセマーさん（ @gggsema1 ）から「アドバイス」です。 マテリア姉妹からのアドバイスでピーカブースタイルを使った轟雷vsスティ子のボクシング対決！ pic.twitter.com/kzTbNQoRmM";;@gggsema1;;"936993806016159745";https://twitter.com/GoGoFuryu/status/936993806016159745;;ホビーショップふりゅ,Hawaii,
GoGoFuryu;2017-12-02 11:08;0;1;"結局何もしないで土曜の休みが終わりました_:(´ཀ`」 ∠): 実は健康診断で引っかかってますが再検査に行ってないです（汗） アスナのスケールフィギュアはガンガン出てましたからね(^o^) 私はねんどろとfigma二つですね。 一番くじも色んなの出てますね！私はくじ運ないので。。。_:(´ཀ`」 ∠): pic.twitter.com/BcAGJLhGrS";;;;"936990574833410048";https://twitter.com/GoGoFuryu/status/936990574833410048;;ホビーショップふりゅ,Hawaii,
GoGoFuryu;2017-12-02 10:57;0;1;"スネーク小さいですね（╹◡╹） でも安かったので（笑） 実は愛知県のとある市で半年ほど一人暮らししてました( ͡° ͜ʖ ͡°)";;;;"936987726682796037";https://twitter.com/GoGoFuryu/status/936987726682796037;;ホビーショップふりゅ,Hawaii,
GoGoFuryu;2017-12-02 09:25;0;1;"大丈夫ですよー＾＾";;;;"936964632857554944";https://twitter.com/GoGoFuryu/status/936964632857554944;;ホビーショップふりゅ,Hawaii,
GoGoFuryu;2017-12-02 09:25;0;1;"仮に例のオヤジフィギュアを買ってたとしてもネタにしちゃいますからｗ ・・・でもネタとして使うキャラはキリトとアスナしか持ってないですね・・・";;;;"936964496458780672";https://twitter.com/GoGoFuryu/status/936964496458780672;;ホビーショップふりゅ,Hawaii,
GoGoFuryu;2017-12-02 09:20;0;1;"はいー大丈夫ですよー。";;;;"936963346460377088";https://twitter.com/GoGoFuryu/status/936963346460377088;;ホビーショップふりゅ,Hawaii,
GoGoFuryu;2017-12-02 09:11;0;0;"受付終了します～リクエスト無しでした(*´ω｀*) pic.twitter.com/Aa6fmUyStt";;;;"936961024824979456";https://twitter.com/GoGoFuryu/status/936961024824979456;;ホビーショップふりゅ,Hawaii,
GoGoFuryu;2017-12-02 08:59;0;1;"師匠応援ありがとうございます！ 相撲ブンドド頑張ります！ pic.twitter.com/TT2MOCkvs2";;;;"936957921740578816";https://twitter.com/GoGoFuryu/status/936957921740578816;;ホビーショップふりゅ,Hawaii,
GoGoFuryu;2017-12-02 08:56;0;1;"私がやるとネタに走ってしまうのでマトモなNTR物にはならないですよね。。。ｗ";;;;"936957152328945664";https://twitter.com/GoGoFuryu/status/936957152328945664;;ホビーショップふりゅ,Hawaii,
GoGoFuryu;2017-12-02 08:46;0;1;"延期しなければ今月後５つも届くので～なかなか難しいですね～ ただ無くなってから後悔するよりは買っておいて後悔した方のがマシと皆様申しますね。。。。 pic.twitter.com/VdrWT1MQf9";;;;"936954720056352772";https://twitter.com/GoGoFuryu/status/936954720056352772;;ホビーショップふりゅ,Hawaii,
GoGoFuryu;2017-12-02 08:36;0;2;"残念ですorz では私がはやて師匠の跡を継いで相撲ブンドドを少しやります！ pic.twitter.com/TdIz2Wj5Km";;;;"936952283031416832";https://twitter.com/GoGoFuryu/status/936952283031416832;;ホビーショップふりゅ,Hawaii,
GoGoFuryu;2017-12-02 07:16;0;0;"はやて師匠なら出来ますって( ͡° ͜ʖ ͡°)";;;;"936932050803703808";https://twitter.com/GoGoFuryu/status/936932050803703808;;ホビーショップふりゅ,Hawaii,
GoGoFuryu;2017-12-02 07:06;0;0;"カラオケボックスで態度を注意して睨みかえしてスマホ弄ってる姿に腹立ててリモコンで殴れば地味でなくなりますよ( ˊ̱˂˃ˋ̱ )";;;;"936929593251917825";https://twitter.com/GoGoFuryu/status/936929593251917825;;ホビーショップふりゅ,Hawaii,
GoGoFuryu;2017-12-02 06:59;0;0;"リモコンで殴ったのでわ？(¬_¬)";;;;"936927816037285888";https://twitter.com/GoGoFuryu/status/936927816037285888;;ホビーショップふりゅ,Hawaii,
GoGoFuryu;2017-12-02 06:18;0;1;"自分への労いとしてクリスマスプレゼントとして買ってしまうのも手ですね。 更に私なんて11月だけで11万吹き飛ばしてますからソレと比べたら安いものですｗ";;;;"936917374141267973";https://twitter.com/GoGoFuryu/status/936917374141267973;;ホビーショップふりゅ,Hawaii,
GoGoFuryu;2017-12-02 06:01;0;1;"今日は１時には寝て日曜は10時には起きる努力してみます！ｗ 昨夜はNTRブンドドしましたから～次もNTRブンドドでいきますかね？（そもそもアレがNTRと言えるのかは謎ですがｗ）";;;;"936913163873689601";https://twitter.com/GoGoFuryu/status/936913163873689601;;ホビーショップふりゅ,Hawaii,
GoGoFuryu;2017-12-02 05:58;0;0;"レビューサイトは基本素組で出来や可動とかの評価をしてますからね。それをゲート処理が下手、合せ目消しも塗装もしてないのにレビューは意味がないとか抜かしてる方もいまして（汗 FGのザクを１ヶ月かけて制作過程のレビューしていくのですね！タノシミニシテマス！ フレズに武具ないですからねｗ";;;;"936912517841936384";https://twitter.com/GoGoFuryu/status/936912517841936384;;ホビーショップふりゅ,Hawaii,
GoGoFuryu;2017-12-02 05:50;0;1;"不動嫁なんですね＾＾ 禁書目録３期の後に超電磁砲３期が放送決定が理想ですね。 ・・・禁書目録３期が決定した途端に中古屋の円盤価格が跳ね上がりましたorz 比較したらミサカは禁書目録より超電磁砲の方が好きですねw";;;;"936910453405446144";https://twitter.com/GoGoFuryu/status/936910453405446144;;ホビーショップふりゅ,Hawaii,
GoGoFuryu;2017-12-02 05:48;0;1;"いえいえドリームテックのガルパン２人は買わなくて全然良いので 此方のドリームテックのヨハネを買っちゃいましょうYO！ｗ http:// amzn.to/2AOgypE";;;;"936909872976629760";https://twitter.com/GoGoFuryu/status/936909872976629760;;ホビーショップふりゅ,Hawaii,
GoGoFuryu;2017-12-02 05:44;0;1;"この際ですからリー先生を手に入れてみては如何でしょう？ｗ ブンドドの幅が広がりますよー＾＾ スポーンは大昔見たような・・・って感じで私もよく覚えてないですｗ 艦娘大活躍ですね！ pic.twitter.com/Q05soaBqS7";;;;"936909003887599616";https://twitter.com/GoGoFuryu/status/936909003887599616;;ホビーショップふりゅ,Hawaii,
GoGoFuryu;2017-12-02 05:42;0;1;"この御方は聞いたことありますね＾＾ オブでも可愛いと言うので・・・次も出番あるんでしょうか・・ pic.twitter.com/Qh5T4YfUKP";;;;"936908341577580544";https://twitter.com/GoGoFuryu/status/936908341577580544;;ホビーショップふりゅ,Hawaii,
GoGoFuryu;2017-12-02 05:29;0;1;"先週東京、先々週大洗行ってたので今週はのんびりしようと思ってましたが何でこんなにも後悔してるんでしょうね（＾＾； 今はまだ二度寝出来ないですねｗ";;;;"936905057051729926";https://twitter.com/GoGoFuryu/status/936905057051729926;;ホビーショップふりゅ,Hawaii,
GoGoFuryu;2017-12-02 05:16;0;0;"アルトリアさんが外されジャンヌさんに切り替わりましたが他の嫁は変わってないのは安心ですｗ レールガン３期の方が美琴さんの出番は多いですからね＾＾ pic.twitter.com/f1z7uwHV4G";;;;"936901986686873601";https://twitter.com/GoGoFuryu/status/936901986686873601;;ホビーショップふりゅ,Hawaii,
GoGoFuryu;2017-12-02 05:14;0;1;"連れション！？（同じく難聴ｗ） pic.twitter.com/cva3BjnE5N";;;;"936901461920833536";https://twitter.com/GoGoFuryu/status/936901461920833536;;ホビーショップふりゅ,Hawaii,
GoGoFuryu;2017-12-02 05:13;0;1;"おはようございます！ 夜寝られず朝６時頃まで起きてました！ 今、体だるくてなーんもヤル気しませんｗ";;;;"936901163315748864";https://twitter.com/GoGoFuryu/status/936901163315748864;;ホビーショップふりゅ,Hawaii,
GoGoFuryu;2017-12-02 05:10;0;1;"うせろやですか！(T_T)";;;;"936900292217528321";https://twitter.com/GoGoFuryu/status/936900292217528321;;ホビーショップふりゅ,Hawaii,
GoGoFuryu;2017-12-02 05:08;0;2;"ウェーブのDream Techシリーズですと私もガルパンで持ってますねー。 出来いいですし更に首を少し動かす事が出来ますよー＾＾ You！買っちゃいなYO！ｗ pic.twitter.com/1F97UUjBl8";;;;"936899840780288001";https://twitter.com/GoGoFuryu/status/936899840780288001;;ホビーショップふりゅ,Hawaii,
GoGoFuryu;2017-12-02 02:59;0;1;"開封しようと思うと予約したのが届いたりして阻害されたりもしますねｗ セール品の殆どが気になってた程度で安かったから買ったですからねぇ・・・・。";;;;"936867302972071936";https://twitter.com/GoGoFuryu/status/936867302972071936;;ホビーショップふりゅ,Hawaii,
GoGoFuryu;2017-12-02 02:55;0;1;"今日は片付けようと思ったら起きたら15:30過ぎてましたｗ 日々のストレス等で疲れてたようですorz で、ダルーくて今日も片付けせず終わります（いつものことｗ） と言いながらもブキヤのもセールになれば私も危険デスｗ で、アスナさんって此方のですか？ pic.twitter.com/Gb1XlRCb5f";;;;"936866456100208641";https://twitter.com/GoGoFuryu/status/936866456100208641;;ホビーショップふりゅ,Hawaii,
GoGoFuryu;2017-12-02 02:17;0;1;"困り顔→制服verをお買い上げに更にfigmaセイバーリリィまでも！！ あれ？そういえば↓此方は持ってましたっけ？（悪魔ｗ） http:// amzn.to/2APkTJ5";;;;"936856850363854848";https://twitter.com/GoGoFuryu/status/936856850363854848;;ホビーショップふりゅ,Hawaii,
GoGoFuryu;2017-12-02 01:22;0;9;"おはようございます_:(´ཀ`」 ∠): pic.twitter.com/9QTX9UUPOa";;;;"936842930253324289";https://twitter.com/GoGoFuryu/status/936842930253324289;;ホビーショップふりゅ,Hawaii,
GoGoFuryu;2017-12-01 14:53;3;18;"NTRをワイがやるとこうなる(๑╹ω╹๑ ) #ふりゅ劇場 pic.twitter.com/xvzI3Em1gg";;;#;"936684714080944128";https://twitter.com/GoGoFuryu/status/936684714080944128;;ホビーショップふりゅ,Hawaii,
GoGoFuryu;2017-12-01 14:30;0;0;"見つかった！_:(´ཀ`」 ∠):";;;;"936678954991104000";https://twitter.com/GoGoFuryu/status/936678954991104000;;ホビーショップふりゅ,Hawaii,
GoGoFuryu;2017-12-01 14:30;0;0;"こそっ(¬_¬) #フォロワーさんからもらったお題でフィギュア・ブンドド写真撮るよ";;;#;"936678794802356224";https://twitter.com/GoGoFuryu/status/936678794802356224;;ホビーショップふりゅ,Hawaii,
GoGoFuryu;2017-12-01 11:04;0;1;"ありがとうございます～ネタ的な事ばかりやってますｗ pic.twitter.com/3wvGqlSfXP";;;;"936627177260425217";https://twitter.com/GoGoFuryu/status/936627177260425217;;ホビーショップふりゅ,Hawaii,
GoGoFuryu;2017-12-01 11:01;1;1;"明日頑張りますｗ pic.twitter.com/HEKaoXMeeI";;;;"936626201770188800";https://twitter.com/GoGoFuryu/status/936626201770188800;;ホビーショップふりゅ,Hawaii,
GoGoFuryu;2017-12-01 11:00;0;1;"何か凄い性癖？な人いるんですねぇ～（＾＾； ダークウッディの貞操が・・・ 私的にはmodで踊らせるとかしか考えてなかったのですがmodの使い方次第で凄い事がデキちゃうんですねぇｗｗｗｗ MMDも見てみましたが此方も凄いですね。";;;;"936626064519868416";https://twitter.com/GoGoFuryu/status/936626064519868416;;ホビーショップふりゅ,Hawaii,
GoGoFuryu;2017-12-01 10:44;12;32;"フィギュア撮影したり普通のブンドドしたりしてます。 よろしくお願いします。 #12月なのでフォロワーさんに自己紹介しようぜ pic.twitter.com/7X9mEVCR4d";;;#12;"936621958564782087";https://twitter.com/GoGoFuryu/status/936621958564782087;;ホビーショップふりゅ,Hawaii,
GoGoFuryu;2017-12-01 10:28;0;0;"つまりアルトリアさんはもう推しではなくなったのですね・・・。 とある３期楽しみですねぇ～(*´Д`)ﾊｧﾊｧ pic.twitter.com/kopwRZZDwZ";;;;"936618063528542208";https://twitter.com/GoGoFuryu/status/936618063528542208;;ホビーショップふりゅ,Hawaii,
GoGoFuryu;2017-12-01 10:21;0;0;"魔窟と呼んでる物置部屋に未開封品や空箱やガンプラを放り込んでますが自室も侵略されてて何とかしないと思って時間だけが経過してますorz WAVEのスケールミカですね。来月発売予定です～♪ ブキヤのはジャージ着てないですからね。物足りなさはありましたね。 pic.twitter.com/803RYiX0Sj";;;;"936616206244519936";https://twitter.com/GoGoFuryu/status/936616206244519936;;ホビーショップふりゅ,Hawaii,
GoGoFuryu;2017-12-01 10:08;0;1;"なら某Jさんの真似しまして・・・・ You！買っちゃいなYO! pic.twitter.com/vfPaVajxgZ";;;;"936612867943546882";https://twitter.com/GoGoFuryu/status/936612867943546882;;ホビーショップふりゅ,Hawaii,
GoGoFuryu;2017-12-01 10:05;0;1;"メイド側を野郎にすればダークウッディが主人公でも・・・違う話になりますねｗ となりますとやっぱりダークウッディがメイド側ですね！ メイド姿で侵入したダークウッディ、でも一発でバレて主人公に尋問される・・・やっぱり違う方向の話になっちゃいますねｗ";;;;"936612257953226757";https://twitter.com/GoGoFuryu/status/936612257953226757;;ホビーショップふりゅ,Hawaii,
GoGoFuryu;2017-12-01 10:01;0;1;"ありがとうございますｍ(_ _)m pic.twitter.com/TPYlydB3vz";;;;"936611146756268032";https://twitter.com/GoGoFuryu/status/936611146756268032;;ホビーショップふりゅ,Hawaii,
GoGoFuryu;2017-12-01 09:54;0;5;"開封して感染させる気力が無い_:(´ཀ`」 ∠): pic.twitter.com/2O9s6zd0Bj";;;;"936609470569889792";https://twitter.com/GoGoFuryu/status/936609470569889792;;ホビーショップふりゅ,Hawaii,
GoGoFuryu;2017-12-01 08:45;0;1;"ついにリリカルさんが_:(´ཀ`」 ∠): pic.twitter.com/XexyrJMEpA";;;;"936592099801120769";https://twitter.com/GoGoFuryu/status/936592099801120769;;ホビーショップふりゅ,Hawaii,
GoGoFuryu;2017-12-01 08:06;0;5;"お、家、に、か、え、る！_:(´ཀ`」 ∠): マジで会社が苦痛で嫌だ！┌(┌՞ਊ՞)┐ｷｪｧｧｧｪｪｪｪｧｧｧ pic.twitter.com/tGE9xkx0A6";;;;"936582384610189312";https://twitter.com/GoGoFuryu/status/936582384610189312;;ホビーショップふりゅ,Hawaii,
GoGoFuryu;2017-12-01 02:39;0;1;"みくにゃんがお好きですか？…φ（。。ﾒﾓﾒﾓ pic.twitter.com/HXggOBnRQx";;;;"936499998421762048";https://twitter.com/GoGoFuryu/status/936499998421762048;;ホビーショップふりゅ,Hawaii,
GoGoFuryu;2017-12-01 02:23;0;1;"リボミニのスネークは結構良かったですぞｗ 名古屋は都会のイメージありましたがイベントはスルーされてしまうのですねorz ちなみに愛知県にチョットだけ住んでた事ありますよｗ pic.twitter.com/8T5m2FLyGm";;;;"936495900460957696";https://twitter.com/GoGoFuryu/status/936495900460957696;;ホビーショップふりゅ,Hawaii,
GoGoFuryu;2017-12-01 02:11;0;1;"プラモ作りは自由で他人に言われる筋合いはないですね。 それでも素組非難してくるアフォもいるので要注意です！ （特にガンプラレビューやってるサイトとかが被害を受けてます） 来週プラモ作るのですね！PGのフェネクスですか？MGのEx-sですか？ｗ リー先生も参加させてみます？ｗ pic.twitter.com/BB8OgkCnpa";;;;"936493002779803648";https://twitter.com/GoGoFuryu/status/936493002779803648;;ホビーショップふりゅ,Hawaii,
GoGoFuryu;2017-12-01 01:53;0;1;"·······('ω')······· (うわああああ) でもダークウッディを主人公にしたら目的達成しちゃいませんか？ｗ いつも直前に成敗されてますから（＾＾；";;;;"936488358997516288";https://twitter.com/GoGoFuryu/status/936488358997516288;;ホビーショップふりゅ,Hawaii,
GoGoFuryu;2017-12-01 00:51;0;1;"リボのはるるんは相当昔ですから出来は・・・・。 765以外でデレマスも止まってますからね。 サイドＭが出る可能性の方が今は高そうですねぇ～（汗） ジュピターならチャオですかねぇ？";;;;"936472792010129408";https://twitter.com/GoGoFuryu/status/936472792010129408;;ホビーショップふりゅ,Hawaii,
GoGoFuryu;2017-12-01 00:48;0;1;"お気になさらずにー＾＾ 後はダークウッディのmod作って踊らせた方のが版権キャラ躍らせるより面白そうなんですよね～（エロゲと言う意識全くなしｗ）";;;;"936472024146251776";https://twitter.com/GoGoFuryu/status/936472024146251776;;ホビーショップふりゅ,Hawaii,
GoGoFuryu;2017-12-01 00:24;0;0;"場所に限りがあってもう足の踏み場もない程になってきてますので片付けしないと厳しいです。後は空箱を潰す勇気があればスペースが一気に空くのですが・・・（売る売らない関係なく勿体無いデス） 大洗行った時に撮影した写真は既に目を付けてますｗ pic.twitter.com/2ODrllPDra";;;;"936465885048446976";https://twitter.com/GoGoFuryu/status/936465885048446976;;ホビーショップふりゅ,Hawaii,
GoGoFuryu;2017-12-01 00:13;0;1;"はるるんはfigmaで欲しいですね～ ただもう展開すら無いので千早、響、ミキミキで終わりそうな・・・（汗） そしてSide M（野郎）の方がキット化されそうデス";;;;"936463295741026307";https://twitter.com/GoGoFuryu/status/936463295741026307;;ホビーショップふりゅ,Hawaii,
GoGoFuryu;2017-11-30 21:35;0;1;"youtubeで「カスタムメイド MOD」で検索、うｐした人も「カスタムメイドでやってみた」とコメントを出してたのを観ました＾＾ MMDも引っ掛かりましたがｗ 此方の方も凄いですね。";;;;"936423495155695616";https://twitter.com/GoGoFuryu/status/936423495155695616;;ホビーショップふりゅ,Hawaii,
GoGoFuryu;2017-11-30 21:30;0;1;"アニメの専用ポーズを取らせる事が出来るけども可動で犠牲になる部分もあると言う可動方式ですねｗ 地域的な問題って非常に厄介ですよね。。。移動にお金も掛かりますしｗ";;;;"936422340937707521";https://twitter.com/GoGoFuryu/status/936422340937707521;;ホビーショップふりゅ,Hawaii,
GoGoFuryu;2017-11-30 21:27;0;2;"他ですと接着剤や塗装が必要で素組では様にならないのが多いですね。 その辺考えるとガンプラは優秀ですが一部からはプラモの品位が落ちたとか素組は邪道とか塗装してプラモだと言ってる人もいますが（＾＾； 確かにウッディばかりやられてますねｗ pic.twitter.com/jaczyi6NOI";;;;"936421372108029952";https://twitter.com/GoGoFuryu/status/936421372108029952;;ホビーショップふりゅ,Hawaii,
GoGoFuryu;2017-11-30 20:56;0;1;"４枚目の黒猫はかなり安かった割には出来も良かったですけどね（レポでは微妙な扱いされてましたが） セール品はまとめて買うので開封しきれないと言う問題もありますね。 後はタイミングですね、直ぐ開ければ使われますが後回しにすると９０％は未開封のままですから（汗）";;;;"936413692303876096";https://twitter.com/GoGoFuryu/status/936413692303876096;;ホビーショップふりゅ,Hawaii,
GoGoFuryu;2017-11-30 20:40;0;1;"ペパロニさん、おつむ弱いですｗ pic.twitter.com/wHKgzrvJuF";;;;"936409706012090368";https://twitter.com/GoGoFuryu/status/936409706012090368;;ホビーショップふりゅ,Hawaii,
GoGoFuryu;2017-11-30 20:25;0;1;"確かに今は資格、例え国家資格があっても実務経験が問われるので駄目ですね。 例：フォークリフト免許、但し実務経験３年以上 とか普通にありますからね。 TOEICが一番の近道かもしれませんね。。。";;;;"936405903477170181";https://twitter.com/GoGoFuryu/status/936405903477170181;;ホビーショップふりゅ,Hawaii,
