username;date;retweets;favorites;text;geo;mentions;hashtags;id;permalink;place_full_name;location;timezone;profile_location_name
GoGoFuryu;2017-12-04 09:52;0;4;"空き箱タワー pic.twitter.com/b0ZeF7ISRi";;;;"937696096863772673";https://twitter.com/GoGoFuryu/status/937696096863772673;;ホビーショップふりゅ,Hawaii,
GoGoFuryu;2017-12-04 09:51;0;1;"熊本まで行ったのは４人ぐらいで行ったようですので運転交代、交通費も人数で割れば安上がりになりますからね。 普段からの不摂生が祟り具合が悪くなりましたが今日１日休んだのでとりあえず復活してます。規則正しい生活も視野にいれていこうかとｗ";;;;"937695883977572352";https://twitter.com/GoGoFuryu/status/937695883977572352;;ホビーショップふりゅ,Hawaii,
GoGoFuryu;2017-12-04 09:46;0;1;"本棚に本と一緒に並べてありますね＾＾ エリチがいっぱい～あ、一番上のは西さん！ｗ 後、悪魔のリドル懐かしいです！（そっちかい！） 映画も良い所で続く・・・続き早く！！気になるYO！ってなりそうですｗ";;;;"937694570338402305";https://twitter.com/GoGoFuryu/status/937694570338402305;;ホビーショップふりゅ,Hawaii,
GoGoFuryu;2017-12-04 09:39;0;2;"ブキヤがオプションパーツを発売し続ける限りフレズは完成はしない！と言うパターンですね！かっこいい！ 私が現在作りかけで放置しているのはHGUCジムですね。ジム２体目なんですが塗装用の実験台にされてますｗ 後はフレズと同じ境遇で素体だけで完成品扱いとなったメガミデバイスWISMもいますｗ pic.twitter.com/I7pwQuRgsc";;;;"937692871737540608";https://twitter.com/GoGoFuryu/status/937692871737540608;;ホビーショップふりゅ,Hawaii,
GoGoFuryu;2017-12-04 08:56;0;3;"定価4500円の神崎蘭子が今でも1万越えです。鹿島さんも１万越えですが定価8800円と考えますと1万くらいなら？？と言う考え方もあります。 まぁ私も行き付けの中古屋でfigma神崎蘭子が新品未開封が5800円で売られてるのを見て即レジに行きましたけど後から1300円プレ値だったのを知りましたｗ pic.twitter.com/V3Vw0QhgqK";;;;"937681902009380864";https://twitter.com/GoGoFuryu/status/937681902009380864;;ホビーショップふりゅ,Hawaii,
GoGoFuryu;2017-12-04 08:50;0;1;"多分、キット化されて酷い目合わせるのは私だけではないと思いますよｗ ただ居たからこそ話が進んだのもありますけどね。 カミーユ→飛田展男さんですね。 今でも色んな役で出てますよね～おそ松さんのダヨーンｗ pic.twitter.com/MsayIkEzNs";;;;"937680505226461187";https://twitter.com/GoGoFuryu/status/937680505226461187;;ホビーショップふりゅ,Hawaii,
GoGoFuryu;2017-12-04 08:46;0;1;"箱があってもかすかな擦り傷、微妙な凹みがあっただけでマイナス査定してくる所もありますね。店で売る時は箱イタミ有と・・。 片付けても片付けても部屋が狭いまま・・・同じです。 それでも追加でフィギュアを予約したりお店行ってセールだ！で買ってしまうアホな自分がいますorz";;;;"937679542172360705";https://twitter.com/GoGoFuryu/status/937679542172360705;;ホビーショップふりゅ,Hawaii,
GoGoFuryu;2017-12-04 08:38;0;1;"百均ケースにfigma、ねんどろいど等を収納してブンドド時に取り出しやすく！とやった為に本棚が犠牲になりましたｗ 私の場合、ねんどろサターンは出ましたがドリキャスとメガドライブが出なかったと言う悲しさあります(T_T) では12月9日土曜上映でガルパン観てからマラソンに挑むはどうでしょう？ pic.twitter.com/JT5J3s9fCC";;;;"937677594559836160";https://twitter.com/GoGoFuryu/status/937677594559836160;;ホビーショップふりゅ,Hawaii,
GoGoFuryu;2017-12-04 08:29;0;0;"ありがとうございます。 百均のケースにアクションフィギュアをしまって積んで何時でも取り出せるようにしてたらこんな事になってしまいました・・・orz";;;;"937675174735785984";https://twitter.com/GoGoFuryu/status/937675174735785984;;ホビーショップふりゅ,Hawaii,
GoGoFuryu;2017-12-04 08:28;0;1;"ちょっと福岡から東京までルートを出してみました。 車ですと距離1000km以上、高速代だけで２万行きますねｗ そこでガス代とか考えるとはかた号や飛行機使った方のが楽で全然安上がりですｗ 私もヨハネでしたらfigmaを予約してますがーこの衣装のfigma出して欲しいですｗ pic.twitter.com/8MNR4qvJHv";;;;"937674911031496704";https://twitter.com/GoGoFuryu/status/937674911031496704;;ホビーショップふりゅ,Hawaii,
GoGoFuryu;2017-12-04 08:15;0;1;"本棚の奥にもありますよｗ 百均ケースにフィギュアを収納してブンドド時に取り出しやすく本棚にした結果がコレです（＾＾； もっと大きな本棚が必要ですね。。。";;;;"937671712874758146";https://twitter.com/GoGoFuryu/status/937671712874758146;;ホビーショップふりゅ,Hawaii,
GoGoFuryu;2017-12-04 08:13;0;1;"私的には完成で一切手を加えるつもりはないですが～コレらは完成品じゃないと言われるのはキッツいですねぇ(^_^;) 後は金ペカ轟雷や銀ペカアキ子も合せ目消ししてないので同様でしょう HGデュエルを捨てるんですか？ｗ pic.twitter.com/wCs5pvVKcs";;;;"937671082600828928";https://twitter.com/GoGoFuryu/status/937671082600828928;;ホビーショップふりゅ,Hawaii,
GoGoFuryu;2017-12-04 08:09;0;1;"後、寝落ちしてしまい中途半端な時間に目覚めて寝られず朝までって事もありますので寝落ち対策は夜十分に睡眠時間を取ることですよね。 土日になると気が緩んで１２時間以上寝てしまうのも普段からちゃんとしていれば防げ・・・ますかね？（＾＾；";;;;"937670164929167360";https://twitter.com/GoGoFuryu/status/937670164929167360;;ホビーショップふりゅ,Hawaii,
GoGoFuryu;2017-12-04 08:05;0;1;"米さんのブンドドはストーリー構成や加工に苦労してるのわかります～だからクオリティが非常に高く見てて楽しいです＾＾ ただ私の場合、どちらかと言えば一発芸ですからね（＾＾； 顔をすげ替えてるだけともｗｗ";;;;"937669176033865730";https://twitter.com/GoGoFuryu/status/937669176033865730;;ホビーショップふりゅ,Hawaii,
GoGoFuryu;2017-12-04 07:52;0;0;"百均ケースにしまって積み重ねて収納する事で場所の節約が出来ますね。 後はラベルでも貼って一目で何か分かるようにしたいのですが面倒くさ・・・（笑）";;;;"937665955647258624";https://twitter.com/GoGoFuryu/status/937665955647258624;;ホビーショップふりゅ,Hawaii,
GoGoFuryu;2017-12-04 07:46;0;1;"エッチな本は余裕で読めるのではないでしょうか？(*´Д`)ﾊｧﾊｧ 嫌がらせとは言え1200円+TAXは高いので古本屋で探してみて会社の社長やら役員やら課長やら居る所で読んでみます！(*´ω｀*)";;;;"937664490161573889";https://twitter.com/GoGoFuryu/status/937664490161573889;;ホビーショップふりゅ,Hawaii,
GoGoFuryu;2017-12-04 07:45;0;0;"休める時に心身ともに休み、目指せ！健康体ですね＾＾ 後は運動もして体を鍛えたいですね～。";;;;"937664121377402881";https://twitter.com/GoGoFuryu/status/937664121377402881;;ホビーショップふりゅ,Hawaii,
GoGoFuryu;2017-12-04 03:42;0;1;"え！「ちょっと」ですかｗ ちょっと過去のブログのですがご参考にどうぞー＾＾ http:// furyu.kazelog.jp/imfuryusa86/20 17/03/post-8351.html …";;;;"937603098763132930";https://twitter.com/GoGoFuryu/status/937603098763132930;;ホビーショップふりゅ,Hawaii,
GoGoFuryu;2017-12-04 03:41;0;1;"でもこの手の本も読んでるだけでも面白いですけどね(*´Д`)ﾊｧﾊｧ";;;;"937602798853677056";https://twitter.com/GoGoFuryu/status/937602798853677056;;ホビーショップふりゅ,Hawaii,
GoGoFuryu;2017-12-04 03:38;0;1;"開封したフィギュアの一部を百均の箱に入れて本棚に積んで何時でも簡単に取り出せてブンドド出来るようにしているのですが置ききれず本棚の前まで場所を支配してきてます┌(┌՞ਊ՞)┐ｷｪｧｧｧｪｪｪｪｧｧｧ";;;;"937601940791312384";https://twitter.com/GoGoFuryu/status/937601940791312384;;ホビーショップふりゅ,Hawaii,
GoGoFuryu;2017-12-04 03:36;0;1;"年内再会ですね！期待しております（死亡フラグ） 私もストーリー系やろうかなーっと思うとネタに走ってしまいネタ系は意外と長続きしないんですよね・・・ｗ";;;;"937601574938992640";https://twitter.com/GoGoFuryu/status/937601574938992640;;ホビーショップふりゅ,Hawaii,
GoGoFuryu;2017-12-04 03:36;0;1;"こんばんわー！ 今の私の環境ですと10体一気に買うと開封よりも置き場問題にぶち当たりますねｗ 人気作品でも一部キット化して後は知らん顔する傾向がありますからね。 シリカ出ても絶対売れるのに・・・ マラソン大会！42.195kmを走るのですか！？って、その後に映画だと確実に寝落ちますねｗ";;;;"937601390221828096";https://twitter.com/GoGoFuryu/status/937601390221828096;;ホビーショップふりゅ,Hawaii,
GoGoFuryu;2017-12-04 03:30;0;1;"では車で東京まで来ちゃいましょう！ｗ 高速代が往復で幾らになるんでしょうね・・・ｗ 堕天使ヨハネが大好きなら私生活も犠牲にして手に入れると思ってました。 でも可愛いのが出てると悩みますよね～";;;;"937599995334635520";https://twitter.com/GoGoFuryu/status/937599995334635520;;ホビーショップふりゅ,Hawaii,
GoGoFuryu;2017-12-04 03:23;0;0;"もう私は若くないデスｗ 多分、そういう不摂生な生活が学生の頃からずーっと続いてるので去年にぶっ倒れて入院・手術になったんでしょうね。。。そこで気がつくべきでした。";;;;"937598182401253376";https://twitter.com/GoGoFuryu/status/937598182401253376;;ホビーショップふりゅ,Hawaii,
GoGoFuryu;2017-12-04 03:21;0;1;"会社のバカ達の前でこの本を読んでたとしても役職付いてるので逆に俺の方が利口と思ってバカと気がつかない可能性もありますね（汗） その方が美味しいのですけどねｗ で、チョット立ち読みしたのですが自分もバカに該当してる部分が一部ありました(*´Д`)ﾊｧﾊｧ";;;;"937597831220625408";https://twitter.com/GoGoFuryu/status/937597831220625408;;ホビーショップふりゅ,Hawaii,
GoGoFuryu;2017-12-04 03:18;0;2;"寝不足による不摂生ですねorz 休んだら楽になりました。 つまり↓になってるのが現状ですが休みになると一気に気が抜けてとんでもないことに・・・ pic.twitter.com/WMfI2D1Jcf";;;;"937596892925460482";https://twitter.com/GoGoFuryu/status/937596892925460482;;ホビーショップふりゅ,Hawaii,
GoGoFuryu;2017-12-04 03:16;0;0;"ありがとうございます。とりあえず復活しました。 普段からの不摂生（寝不足）で体が悲鳴を上げてたようです。。 と言っても中々規則正しい生活って出来ないですねorz";;;;"937596531560955904";https://twitter.com/GoGoFuryu/status/937596531560955904;;ホビーショップふりゅ,Hawaii,
GoGoFuryu;2017-12-04 03:11;6;49;"フィギュアが置ききれない・・・ pic.twitter.com/dHCr3th10e";;;;"937595194941124608";https://twitter.com/GoGoFuryu/status/937595194941124608;;ホビーショップふりゅ,Hawaii,
GoGoFuryu;2017-12-04 02:59;0;4;"ちょい復活。";;;;"937592071824617472";https://twitter.com/GoGoFuryu/status/937592071824617472;;ホビーショップふりゅ,Hawaii,
GoGoFuryu;2017-12-03 18:06;0;1;"Lightningケーブルも断線してたみたいで充電出来てなかった、また余計な出費が。。。_:(´ཀ`」 ∠):";;;;"937457991720173568";https://twitter.com/GoGoFuryu/status/937457991720173568;;ホビーショップふりゅ,Hawaii,
GoGoFuryu;2017-12-03 18:03;0;11;"体調悪い_:(´ཀ`」 ∠): 普段の不摂生が祟ったみたいだ！ pic.twitter.com/PiLvL5to1b";;;;"937457337723363328";https://twitter.com/GoGoFuryu/status/937457337723363328;;ホビーショップふりゅ,Hawaii,
GoGoFuryu;2017-12-03 15:16;0;0;"頭痛い_:(´ཀ`」 ∠):";;;;"937415174582968320";https://twitter.com/GoGoFuryu/status/937415174582968320;;ホビーショップふりゅ,Hawaii,
GoGoFuryu;2017-12-03 14:39;0;1;"メガトロンを海に沈めた時は。。。復活するな！と思ってましたが。。。続編でやっぱりーでした（笑）";;;;"937405898502184960";https://twitter.com/GoGoFuryu/status/937405898502184960;;ホビーショップふりゅ,Hawaii,
GoGoFuryu;2017-12-03 14:29;0;1;"余裕のある時で再開楽しみにしてます(*^ω^*) ダークウッディ軍団に新キャラも増えてそうですしねー";;;;"937403398252404737";https://twitter.com/GoGoFuryu/status/937403398252404737;;ホビーショップふりゅ,Hawaii,
GoGoFuryu;2017-12-03 14:28;0;1;"もはやエロゲですね(・ω・) pic.twitter.com/52n81LciCB";;;;"937403128734871552";https://twitter.com/GoGoFuryu/status/937403128734871552;;ホビーショップふりゅ,Hawaii,
GoGoFuryu;2017-12-03 14:22;0;3;"寝られない_:(´ཀ`」 ∠): pic.twitter.com/9psQdO6SB6";;;;"937401740739014656";https://twitter.com/GoGoFuryu/status/937401740739014656;;ホビーショップふりゅ,Hawaii,
GoGoFuryu;2017-12-03 13:58;0;6;"1時間しか寝れないけどお休ミカ( ˘ω˘ )ｽﾔｧ… pic.twitter.com/nOlP8gBgnB";;;;"937395711838117888";https://twitter.com/GoGoFuryu/status/937395711838117888;;ホビーショップふりゅ,Hawaii,
GoGoFuryu;2017-12-03 13:14;1;1;"深夜なのでOKでしょうねｗ pic.twitter.com/RIViPtdkOl";;;;"937384448487702528";https://twitter.com/GoGoFuryu/status/937384448487702528;;ホビーショップふりゅ,Hawaii,
GoGoFuryu;2017-12-03 13:05;0;1;"此方こそありがとうございます～♪ 今年も僅かですがー来年以降もご贔屓にお願いします～m(_ _)m pic.twitter.com/QpsvsHNzXS";;;;"937382211749335040";https://twitter.com/GoGoFuryu/status/937382211749335040;;ホビーショップふりゅ,Hawaii,
GoGoFuryu;2017-12-03 13:03;0;1;"なるほど雪泉ちゃんでしたか・・・（あえて脱衣KOのうｐはしない方向でｗ） pic.twitter.com/4nugXOCUg0";;;;"937381855254298624";https://twitter.com/GoGoFuryu/status/937381855254298624;;ホビーショップふりゅ,Hawaii,
GoGoFuryu;2017-12-03 13:01;0;1;"ブンドド手帳にアイデアをメモしておかないと忘れちゃいそうですねｗ";;;;"937381259067637760";https://twitter.com/GoGoFuryu/status/937381259067637760;;ホビーショップふりゅ,Hawaii,
GoGoFuryu;2017-12-03 12:30;0;1;"実は何かの目的があって利用するためにダークウッディに近づいて恋人になった！が王道ですかね？ 早く話がみたいですね～ｗ";;;;"937373515740692482";https://twitter.com/GoGoFuryu/status/937373515740692482;;ホビーショップふりゅ,Hawaii,
GoGoFuryu;2017-12-03 12:27;0;1;"閃乱カグラでリリカルさんの推しが誰になるのか超期待です(*´ω｀*)";;;;"937372805246599168";https://twitter.com/GoGoFuryu/status/937372805246599168;;ホビーショップふりゅ,Hawaii,
GoGoFuryu;2017-12-03 12:15;0;1;"そいえば艦これ・・・・１ヶ月ぐらいログインしてない・・・";;;;"937369737868087297";https://twitter.com/GoGoFuryu/status/937369737868087297;;ホビーショップふりゅ,Hawaii,
GoGoFuryu;2017-12-03 12:13;0;1;"同じくつなげようとするといつもメンテ中でゲームが出来ないです";;;;"937369200783343616";https://twitter.com/GoGoFuryu/status/937369200783343616;;ホビーショップふりゅ,Hawaii,
GoGoFuryu;2017-12-03 12:11;0;1;"勝手な想像ですが自分に寄り添ってくる女は逆にダークウッディは苦手そう～ 目的を達成するためには女は不要！とも考えたのですが恋人が出来ることで似たような目標達成になるのでOUTですねｗ";;;;"937368728269864960";https://twitter.com/GoGoFuryu/status/937368728269864960;;ホビーショップふりゅ,Hawaii,
GoGoFuryu;2017-12-03 11:59;0;1;"ただ交通費もバカにならないですからね（＾＾； それが原因でヨハネに手が出せなくなってしまっては私としては罪の意識がありますのでヨハネを手に入れてからのスケジュールでヨイデスよ＾＾ そちらのヨハネはおいくらですか？？？";;;;"937365752218238976";https://twitter.com/GoGoFuryu/status/937365752218238976;;ホビーショップふりゅ,Hawaii,
GoGoFuryu;2017-12-03 11:54;0;1;"一気に10体お迎えして・・・私は一部が未開封になってしまったりもｗ キリト、アスナ、シノンがキット化してシリカやユウキがねんどろ化しなかったのに疑問がありますね(^_^;) そういえば、いよいよ来週土曜日にガルパン最終章上映ですね！＾＾";;;;"937364512918847488";https://twitter.com/GoGoFuryu/status/937364512918847488;;ホビーショップふりゅ,Hawaii,
GoGoFuryu;2017-12-03 11:42;0;1;"ダークウッディに恋人が出来るストーリーも面白そうですね。 それでもダークウッディにハッピーエンドがあるとは思えませんがｗ 逆に使い方次第ではかっこいい話になっちゃいそう～（フラグｗ）";;;;"937361348463173632";https://twitter.com/GoGoFuryu/status/937361348463173632;;ホビーショップふりゅ,Hawaii,
GoGoFuryu;2017-12-03 11:35;0;1;"オプティマスプラムはガンガン喋ってましたけど・・・（＾＾；";;;;"937359728480436224";https://twitter.com/GoGoFuryu/status/937359728480436224;;ホビーショップふりゅ,Hawaii,
GoGoFuryu;2017-12-03 11:31;0;12;"ふみふみ作戦です！(*^ω^*) pic.twitter.com/ASZShmnd7y";;;;"937358643447570432";https://twitter.com/GoGoFuryu/status/937358643447570432;;ホビーショップふりゅ,Hawaii,
GoGoFuryu;2017-12-03 11:24;0;12;"デカールは後で貼ろう_:(´ཀ`」 ∠): pic.twitter.com/W5xUrTs33O";;;;"937356977222565888";https://twitter.com/GoGoFuryu/status/937356977222565888;;ホビーショップふりゅ,Hawaii,
GoGoFuryu;2017-12-03 11:08;0;6;"コンビニで見かけたんだけどこの本を会社の休み時間にでもクソ連中の前で読もうと思ったんだけど1200円+TAXは痛い_:(´ཀ`」 ∠): pic.twitter.com/hqMWa4W5ou";;;;"937352895548108800";https://twitter.com/GoGoFuryu/status/937352895548108800;;ホビーショップふりゅ,Hawaii,
GoGoFuryu;2017-12-03 11:07;0;4;"ニンテンドープリカ買ってシノビリフレの雪泉を所望。 あとはワールドヒーローズパーフェクトでも買おうかな？(*^ω^*) pic.twitter.com/HJKZ3klwY3";;;;"937352613711851521";https://twitter.com/GoGoFuryu/status/937352613711851521;;ホビーショップふりゅ,Hawaii,
GoGoFuryu;2017-12-03 10:55;0;1;"12/15金曜18:50発のはかた号にLilyさんが乗ります。 12/16土曜9:25にバスタ新宿着。そこからお台場まで電車で1時間弱。 お台場や秋葉に行ってヨハネ買って満喫してバスタ新宿に戻って21:00発のはかた号に乗って12/17日曜11:17には福岡に帰れますよｗ";;;;"937349669385940992";https://twitter.com/GoGoFuryu/status/937349669385940992;;ホビーショップふりゅ,Hawaii,
GoGoFuryu;2017-12-03 10:49;0;1;"クリスマスセールと正月セールと控えてますからねｗ リーファ派ですがシリカやユウキも勿論アスナも好きですよ！ えりちも好きですよ。（ラブライブキャラ殆ど好きですがｗ） ラストワンまで残り１０は悩みますねぇ・・・(*´ω｀*) pic.twitter.com/1eqcu5Zthn";;;;"937347971661774848";https://twitter.com/GoGoFuryu/status/937347971661774848;;ホビーショップふりゅ,Hawaii,
GoGoFuryu;2017-12-03 10:41;0;1;"可愛い馬にはダークウッディを掘った悪影響ないのですか？ 感染してダークウッディの移動用の馬になったりとか？ 片方イチャイチャ、片方は馬に・・・ダークウッディも中々、目的の達成が出来ないですね（そこが良いのですがｗ） pic.twitter.com/jKXKK3DEks";;;;"937345937864667136";https://twitter.com/GoGoFuryu/status/937345937864667136;;ホビーショップふりゅ,Hawaii,
GoGoFuryu;2017-12-03 10:36;0;1;"ありがとうございます！ バンブルビーは最初から頑張ってましたね＾＾";;;;"937344741791772672";https://twitter.com/GoGoFuryu/status/937344741791772672;;ホビーショップふりゅ,Hawaii,
GoGoFuryu;2017-12-03 10:07;0;1;"後ウッディにもブチ込もうとするのありました！ｗ ダークウッディ可愛い馬に掘られてますねｗｗｗｗ その前に手前の方でリア充が・・・(T_T) pic.twitter.com/M1FhA1aieN";;;;"937337488246325248";https://twitter.com/GoGoFuryu/status/937337488246325248;;ホビーショップふりゅ,Hawaii,
GoGoFuryu;2017-12-03 10:05;0;1;"買ってみたら高い！→出来がよくて安いに変わるかもですよ？ｗ じっくりと検討して判断ですね＾＾ 車ですね。友人がバーザムクリアカラーが欲しいと言い出したのでｗ え？Lilyさん来るんですか？";;;;"937336926125752320";https://twitter.com/GoGoFuryu/status/937336926125752320;;ホビーショップふりゅ,Hawaii,
GoGoFuryu;2017-12-03 10:02;0;1;"私ですとネタに走ってしまいますｗ";;;;"937336321479266304";https://twitter.com/GoGoFuryu/status/937336321479266304;;ホビーショップふりゅ,Hawaii,
GoGoFuryu;2017-12-03 10:02;0;1;"クリスマスセールが始まるまではまだ出てこないでしょうね（汗 今日はニンテンドープリカ3000円分とナナコチャージしたのでそれなりにお金が飛びましたｗ アスナがベスト３に入るのですね！ 実は私はリーファが大好きなんですが友人達からはアスナ大好きだと思われてます。好きですけどねｗ pic.twitter.com/l3RAyfy1dU";;;;"937336257377591298";https://twitter.com/GoGoFuryu/status/937336257377591298;;ホビーショップふりゅ,Hawaii,
GoGoFuryu;2017-12-03 09:53;0;1;"更に調べてみたのですがウッディを掘ったりウッディに掘られたりもしてたのでお相子なんですよね。。。ｗ 過去のを見てたら弾薬で掘られそうな写真が出てきましたｗ pic.twitter.com/p4eCoxnifP";;;;"937334097973731329";https://twitter.com/GoGoFuryu/status/937334097973731329;;ホビーショップふりゅ,Hawaii,
GoGoFuryu;2017-12-03 09:47;0;1;"「次の一手で決まる勝負」でお願いします～♪";;;;"937332450157457409";https://twitter.com/GoGoFuryu/status/937332450157457409;;ホビーショップふりゅ,Hawaii,
GoGoFuryu;2017-12-03 09:42;0;4;"今日出かけたついでにニンテンドープリペ買ってシノビリフレで雪泉を買ってみたんだけどね。3MBと言う容量は間違いなくアンロックだ・・・・ pic.twitter.com/mQtpeVsiX1";;;;"937331151403806720";https://twitter.com/GoGoFuryu/status/937331151403806720;;ホビーショップふりゅ,Hawaii,
GoGoFuryu;2017-12-03 09:33;0;1;"探してみたのですがリー先生がセクハラした事例が殆どなかったです（＾＾； ウッディ掘ったり掘られたりは出てきましたがｗ pic.twitter.com/Ca67ibiqit";;;;"937328939076165632";https://twitter.com/GoGoFuryu/status/937328939076165632;;ホビーショップふりゅ,Hawaii,
GoGoFuryu;2017-12-03 09:31;0;2;"Twitterでプラモを素組ですが作りました！でうｐするとソレは作ったと言わないと絡んでくる事例もあるようですので気を付けましょうｗ ザク作ってジムスナ作って・・・次は？ ウッディをリー先生が掘ってリー先生をリー先生が掘る・・・ｗ pic.twitter.com/p7zJ4OcvE4";;;;"937328407863422977";https://twitter.com/GoGoFuryu/status/937328407863422977;;ホビーショップふりゅ,Hawaii,
GoGoFuryu;2017-12-03 09:26;0;1;"リー先生は新品で５千円ぐらいですね。。。 figma鹿島は定価8800円ですが今やプレ値で1万円～が相場ですね・・・。 ちなみに那珂ちゃんは私は４千円の時に買いましたｗ まさかソレ以上に下がるとは思いませんでしたがｗｗｗｗ pic.twitter.com/gj1NSJQvuF";;;;"937327298902142977";https://twitter.com/GoGoFuryu/status/937327298902142977;;ホビーショップふりゅ,Hawaii,
GoGoFuryu;2017-12-03 09:25;0;1;"モブでしたらこの人達をキット化してくれないかなーとｗ 左の方のキャラはウッディやリー先生以上に酷い目に合わせる可能性大ですｗ pic.twitter.com/bvQYMLtf1C";;;;"937326898517917696";https://twitter.com/GoGoFuryu/status/937326898517917696;;ホビーショップふりゅ,Hawaii,
GoGoFuryu;2017-12-03 09:23;0;1;"どうぞ！見てみたいです＾＾";;;;"937326413958356993";https://twitter.com/GoGoFuryu/status/937326413958356993;;ホビーショップふりゅ,Hawaii,
