username;date;retweets;favorites;text;geo;mentions;hashtags;id;permalink;place_full_name;location;timezone;profile_location_name
GoGoFuryu;2017-12-07 04:06;0;1;"ライダーとアサシンが弱いのもあるんだよねー。再資材なくて再臨も出来ないし。。。_:(´ཀ`」 ∠):";;;;"938696239138217984";https://twitter.com/GoGoFuryu/status/938696239138217984;;ホビーショップふりゅ,Hawaii,
GoGoFuryu;2017-12-07 03:42;0;1;"私もリリカルさんホイホイやりたいんですが。。。ネタが。。。(´ω｀)";;;;"938690077512810497";https://twitter.com/GoGoFuryu/status/938690077512810497;;ホビーショップふりゅ,Hawaii,
GoGoFuryu;2017-12-07 02:31;0;0;"ホビーショップと言っても店舗型にしないでネット通販型にしますけどねｗ FGO VRはマシュ編をクリアするとアルトリア編が出てきますね。 マシュ編はエロい、アルトリア編は戦闘シーンが凄いｗ SKYRIM、DOOM！？";;;;"938672328652623872";https://twitter.com/GoGoFuryu/status/938672328652623872;;ホビーショップふりゅ,Hawaii,
GoGoFuryu;2017-12-07 00:56;0;0;"このすばスタンプ所望。 pic.twitter.com/FFtUlAPBdD";;;;"938648335124008965";https://twitter.com/GoGoFuryu/status/938648335124008965;;ホビーショップふりゅ,Hawaii,
GoGoFuryu;2017-12-07 00:51;0;1;"カッコ良くも出来ます!としたかったのですがリー先生をカッコ良く撮るのがストレスで途中から悪ふざけを盛り込みましたｗ 逆に混乱させてしまいすみませんm(_ _)m やっぱりリー先生はDon't think Feel！でやらないと駄目ですね（教訓）";;;;"938647133418283009";https://twitter.com/GoGoFuryu/status/938647133418283009;;ホビーショップふりゅ,Hawaii,
GoGoFuryu;2017-12-07 00:40;0;0;"色々と見てますが「僕らはみんな河合荘」「キルミーベイベー」「このすば」辺りをオススメしてます＾＾ ・・・ギャグ系？ばっかです 海楽フェスタも前日からホビーショーやってますよ。私も今年３月参加してます＾＾ http:// furyu.kazelog.jp/imfuryusa86/20 17/03/post-ccef.html …";;;;"938644438548541445";https://twitter.com/GoGoFuryu/status/938644438548541445;;ホビーショップふりゅ,Hawaii,
GoGoFuryu;2017-12-07 00:15;0;0;"格ゲーやる場合はPS4のコントローラーよりレバーじゃないと私は本領発揮できないんですよ！（嘘です、下手なのを隠したいが為に見苦しい言い訳してますｗ） 旧SNKが潰れた影響で餓狼MOWの話の続きがもう出ないのは悲しいですよね。つД｀）";;;;"938638125621854214";https://twitter.com/GoGoFuryu/status/938638125621854214;;ホビーショップふりゅ,Hawaii,
GoGoFuryu;2017-12-07 00:02;0;0;"こうちちほー！カツオ食べたいですなぁ・・・ 後は四国八十八ヶ所お遍路も出来ますね！（水曜どうでしょうの影響） AGP高雄はプレバン専用でしたからね。どうしても値段は高くなりますよね。 艦これも間もなく（既に？）下火になってきてるので再販はなさそうですね。。。";;;;"938634761555210240";https://twitter.com/GoGoFuryu/status/938634761555210240;;ホビーショップふりゅ,Hawaii,
GoGoFuryu;2017-12-06 23:37;0;0;"他の方も同様に悩んでいるか部屋が広い、物置を持ってるとかですかね？ 後は断捨離なんですが断の段階でＯＵＴなんですよねｗ （断⇒入ってくる物を断つ） スペースを作るのも大変ですがソレを維持するのがもっと大変ですよね（汗）";;;;"938628519529037825";https://twitter.com/GoGoFuryu/status/938628519529037825;;ホビーショップふりゅ,Hawaii,
GoGoFuryu;2017-12-06 23:32;0;1;"宝くじを買いつつLoto6、Loto7とかも買ったりしてますけどね。 全部当って20億以上得られればホビーショップ立ち上げますよｗ figmaの戦車を買って良い写真やブンドドをやりながらも邪魔と言ってる方を私は良く知ってますｗ 洋ゲーVRってエロいのですか？（ぉぃ）";;;;"938627328275398656";https://twitter.com/GoGoFuryu/status/938627328275398656;;ホビーショップふりゅ,Hawaii,
GoGoFuryu;2017-12-06 21:50;0;1;"FGOはキャメロットで停滞中～。";;;;"938601538561257473";https://twitter.com/GoGoFuryu/status/938601538561257473;;ホビーショップふりゅ,Hawaii,
GoGoFuryu;2017-12-06 21:27;1;19;"アクションフィギュア系 1枚目・・・2013年頃 2枚目・・・2014年頃 3枚目・・・2015年頃 4枚目・・・2016年頃 なんだ今とやってる事は変わってないね。 pic.twitter.com/0NS0dXqhwh";;;;"938595876905271297";https://twitter.com/GoGoFuryu/status/938595876905271297;;ホビーショップふりゅ,Hawaii,
GoGoFuryu;2017-12-06 19:29;0;1;"準役が人気出すぎて主役を食うガンダ●SEED DESTINYが真っ先に思い浮かびましたｗ ゲキガンガー3の歌は今でも行けますｗ ナデシコの時は18時のアニメが盛んな時期でスレイヤーズを代表とするあかほり作品がガンガン放送してたようですね。エヴァもそこからですよね。";;;;"938566106167439360";https://twitter.com/GoGoFuryu/status/938566106167439360;;ホビーショップふりゅ,Hawaii,
GoGoFuryu;2017-12-06 19:23;0;1;"年末ジャンボでバラ10枚、連番10枚で夢を託してみます～！ ねんぷちですね～次はfigmaの戦車ですか？ マシュ編よりアルトリア編の方に力入れてるような感じが・・・ｗ";;;;"938564536063336448";https://twitter.com/GoGoFuryu/status/938564536063336448;;ホビーショップふりゅ,Hawaii,
GoGoFuryu;2017-12-06 19:15;0;1;"アンツィオ戦は唯一、録画や円盤で持ってないガルパンの作品です（＾＾； なのでアマゾンビデオでガンガン観てますｗ 今年はあんこう祭前日際に参加しましたが渋滞も何もなくスムーズに行き来できましたよ～＾＾ そこから車中泊して当日挑むと言う手段もありますねｗ";;;;"938562662773882880";https://twitter.com/GoGoFuryu/status/938562662773882880;;ホビーショップふりゅ,Hawaii,
GoGoFuryu;2017-12-06 09:53;0;1;"そのネタに困らないのがリー先生です！ 後はカッコいいリー先生の紹介して購買欲促進もしておきますね(*^ω^*) pic.twitter.com/FUhuutc3Q1";;;;"938421063309918210";https://twitter.com/GoGoFuryu/status/938421063309918210;;ホビーショップふりゅ,Hawaii,
GoGoFuryu;2017-12-06 09:23;0;1;"Don't think Feel！（笑） pic.twitter.com/piSKSSNzkc";;;;"938413676628815872";https://twitter.com/GoGoFuryu/status/938413676628815872;;ホビーショップふりゅ,Hawaii,
GoGoFuryu;2017-12-06 09:20;0;0;"なるほど！フレズを使えば良かったですね(*^ω^*) pic.twitter.com/gWWHfoGG6y";;;;"938412759330328576";https://twitter.com/GoGoFuryu/status/938412759330328576;;ホビーショップふりゅ,Hawaii,
GoGoFuryu;2017-12-06 09:16;0;1;"また悪魔のリドルを全話ぶっ通しでみようと思って・・・・アンツィオ戦をまた観てしまう失態やらかしてますｗ あんこう祭り（日曜）は激混みしますが休日の首都高ほど混まないですよ～。駐車場も広いですし渋滞に巻き込まれても全く動かないって訳ではないですよー（経験者は語る）";;;;"938411898554400769";https://twitter.com/GoGoFuryu/status/938411898554400769;;ホビーショップふりゅ,Hawaii,
GoGoFuryu;2017-12-06 09:11;0;1;"直感信じて買った結果がこーなる場合もｗ pic.twitter.com/Gkhn5JTNjI";;;;"938410604477300739";https://twitter.com/GoGoFuryu/status/938410604477300739;;ホビーショップふりゅ,Hawaii,
GoGoFuryu;2017-12-06 09:09;0;1;"PS4ですよー＾＾ そしてFGO VRの後にプレイしましたがテリーで凸してグラントでボコボコにされましたｗｗｗ";;;;"938410072748597250";https://twitter.com/GoGoFuryu/status/938410072748597250;;ホビーショップふりゅ,Hawaii,
GoGoFuryu;2017-12-06 09:08;0;0;"胸像の方はプラモの色を組み合わせて頑張ってます（コレやる意味がよく分からないですがｗｗｗ） FAガールのようにしたら負け！と財団Bも闘争心を？？？ 裸エプロンなFAガールって・・・・ 変態後輩君曰くチア、ナースが良いなぁーって言ってました( ͡° ͜ʖ ͡°) pic.twitter.com/nuhhQ8O0qC";;;;"938409825171521537";https://twitter.com/GoGoFuryu/status/938409825171521537;;ホビーショップふりゅ,Hawaii,
GoGoFuryu;2017-12-06 09:03;0;1;"3980円で開封美品でAGP武蔵売ってましたよ。ただ私は未開封品しか買わないのでスルーですが節約には良いかもですね。 グンマーから遠い・・・何処でしたっけ？ 愛宕は5～6千円ですね。高雄は未開封1万6千円。開封品7千円で悩みます・・。";;;;"938408570097319941";https://twitter.com/GoGoFuryu/status/938408570097319941;;ホビーショップふりゅ,Hawaii,
GoGoFuryu;2017-12-06 09:01;0;1;"実はショーケース用のスペース作ったんですよ。 それがですね。今はフィギュア空箱タワーとなってしまいましたｗ 困りました・・・ｗ";;;;"938408178525417472";https://twitter.com/GoGoFuryu/status/938408178525417472;;ホビーショップふりゅ,Hawaii,
GoGoFuryu;2017-12-06 09:01;0;0;"youtubeでアップしてる人はスマホで直接録画してましたね（＾＾； ただ全然VRの良さが伝わらないですがｗ";;;;"938408019129352192";https://twitter.com/GoGoFuryu/status/938408019129352192;;ホビーショップふりゅ,Hawaii,
GoGoFuryu;2017-12-06 08:58;0;1;"でも20枚買いますとー6人の野口英世を失うor1人の野口英世と1人の樋口一葉を失うことになります。 私もレムのスケールフィギュアを２体買ってますからヨハネ増えても良いのでわ？ｗ";;;;"938407194520719360";https://twitter.com/GoGoFuryu/status/938407194520719360;;ホビーショップふりゅ,Hawaii,
GoGoFuryu;2017-12-06 08:53;0;3;"FGO VRはスクショも動画も駄目か┌(┌՞ਊ՞)┐ｷｪｧｧｧｪｪｪｪｧｧｧ";;;;"938406055066853378";https://twitter.com/GoGoFuryu/status/938406055066853378;;ホビーショップふりゅ,Hawaii,
GoGoFuryu;2017-12-06 08:30;0;4;"FGO VR・・・目の前にマシュやアルトリアのおっぱ・・・おし・・・";;;;"938400133913309185";https://twitter.com/GoGoFuryu/status/938400133913309185;;ホビーショップふりゅ,Hawaii,
GoGoFuryu;2017-12-06 07:58;0;1;"マシュエロい";;;;"938392253390716928";https://twitter.com/GoGoFuryu/status/938392253390716928;;ホビーショップふりゅ,Hawaii,
GoGoFuryu;2017-12-06 07:56;0;1;"約束された勝利の剣をVRで観れる感動・・・";;;;"938391821486452736";https://twitter.com/GoGoFuryu/status/938391821486452736;;ホビーショップふりゅ,Hawaii,
GoGoFuryu;2017-12-06 07:56;0;1;"FGO VR・・・スクショ取れない┌(┌՞ਊ՞)┐ｷｪｧｧｧｪｪｪｪｧｧｧ";;;;"938391653441662978";https://twitter.com/GoGoFuryu/status/938391653441662978;;ホビーショップふりゅ,Hawaii,
GoGoFuryu;2017-12-06 07:15;0;9;"さて帰る_:(´ཀ`」 ∠): と言うか来年辺りから考えるかな。(・ω・) pic.twitter.com/K0n96kZAjb";;;;"938381426528886789";https://twitter.com/GoGoFuryu/status/938381426528886789;;ホビーショップふりゅ,Hawaii,
GoGoFuryu;2017-12-06 06:24;0;3;"ついでにタダだったからコレもダウンロードしておこう(*^ω^*) pic.twitter.com/UVgaiZyZOg";;;;"938368584471818240";https://twitter.com/GoGoFuryu/status/938368584471818240;;ホビーショップふりゅ,Hawaii,
GoGoFuryu;2017-12-06 06:14;0;4;"外にいても家のPS4にダウンロード出来るのは嬉しいね(*^ω^*) pic.twitter.com/k6D5z6GXdw";;;;"938366143957409793";https://twitter.com/GoGoFuryu/status/938366143957409793;;ホビーショップふりゅ,Hawaii,
GoGoFuryu;2017-12-06 02:18;0;1;"そっかFGO VRは配信されたのかー。試してみるかなー。";;;;"938306588141551616";https://twitter.com/GoGoFuryu/status/938306588141551616;;ホビーショップふりゅ,Hawaii,
GoGoFuryu;2017-12-05 23:51;1;5;"リリカルさんホイホイやってみたい（・_・）";;;;"938269544212193280";https://twitter.com/GoGoFuryu/status/938269544212193280;;ホビーショップふりゅ,Hawaii,
GoGoFuryu;2017-12-05 23:22;0;6;"みぽりんってこんなに大きかったっけ？ pic.twitter.com/LNrdCU1F22";;;;"938262391136980992";https://twitter.com/GoGoFuryu/status/938262391136980992;;ホビーショップふりゅ,Hawaii,
GoGoFuryu;2017-12-05 23:16;0;1;"ポスターのは劇場版のルリですね！ 劇場版になったら主人公にまで昇格する程の大人気っぷりですね。 ＴＶアニメ版の主題歌とホシノルリの歌とゲキガンガー３の曲は持ってますｗ";;;;"938260752292442113";https://twitter.com/GoGoFuryu/status/938260752292442113;;ホビーショップふりゅ,Hawaii,
GoGoFuryu;2017-12-05 23:12;0;1;"あれですよ。本家ブルース・リーの名言 「Don't think. feel」（考えるな感じるんだ！） で買いましょうｗ アーツのリー先生の方がイジってるだけでも楽しいですねｗ pic.twitter.com/g4Vb2xoazC";;;;"938259847430025216";https://twitter.com/GoGoFuryu/status/938259847430025216;;ホビーショップふりゅ,Hawaii,
GoGoFuryu;2017-12-05 21:27;0;0;"ふみなの目はFA:Gと同じにすればもっと安くなるような気がしますｗ フレズが出る時はスク水と言うので話題になりましたね！ バーゼがバニー、フレズがスク水・・・・次はなんでしょうねｗ";;;;"938233524343095297";https://twitter.com/GoGoFuryu/status/938233524343095297;;ホビーショップふりゅ,Hawaii,
GoGoFuryu;2017-12-05 21:13;0;2;"figmaリー先生も可動範囲はアーツに負けてないですぞ＾＾ やっぱり私の場合figmaリー先生もヤラレ役・・・ pic.twitter.com/JYt3wZvUwS";;;;"938229782310895616";https://twitter.com/GoGoFuryu/status/938229782310895616;;ホビーショップふりゅ,Hawaii,
GoGoFuryu;2017-12-05 21:09;0;1;"私も今週末に宝くじを買いに行きますです。連番10枚、バラ10枚で（最低600円は当たりますｗ） もしやレムにも惹かれました？ｗ ちなみにレムは此方になりますが～ヨハネは！？ http:// amzn.to/2Av1ufB";;;;"938228774377684992";https://twitter.com/GoGoFuryu/status/938228774377684992;;ホビーショップふりゅ,Hawaii,
GoGoFuryu;2017-12-05 21:00;0;0;"この様に巻き込まれ貧乏くじ引かされてます。。。orz";;;;"938226538620731394";https://twitter.com/GoGoFuryu/status/938226538620731394;;ホビーショップふりゅ,Hawaii,
GoGoFuryu;2017-12-05 18:22;0;3;"糞上司「課長以上の臨時会議を行う！だから課長以上に招集かけてね」 ワイ「はい」 糞上司「俺出れないから代わりに出て課長以上をまとめて進行しといて、やり方は任せるから」 底辺平の下っ端にやらせる仕事じゃないよね。";;;;"938186778552426499";https://twitter.com/GoGoFuryu/status/938186778552426499;;ホビーショップふりゅ,Hawaii,
GoGoFuryu;2017-12-05 10:04;0;2;"皆様のブンドド観てるとアーツのリー先生ガンガン使ってますよねｗ （私も一番使ってるのは此方のリー先生ですねぇ。。。） なので先ずは此方のリー先生をゲットしてみてからで如何でしょう？ pic.twitter.com/iVpY1iWIr9";;;;"938061459367399425";https://twitter.com/GoGoFuryu/status/938061459367399425;;ホビーショップふりゅ,Hawaii,
GoGoFuryu;2017-12-05 09:51;0;1;"録画＋OVAありましたが最終回だけいきなり見ましたね。いい話でした。 で、茶番アニメといえばBlood-cが思い浮かんだり。。。 今年３月の海楽フェスタは私も行ってますが全然大丈夫でしたよ～。 pic.twitter.com/Aaf3nXLbuL";;;;"938058307255668736";https://twitter.com/GoGoFuryu/status/938058307255668736;;ホビーショップふりゅ,Hawaii,
GoGoFuryu;2017-12-05 09:39;0;1;"バンダイのほうが規模が大きいですからね。 ガンプラのキット化も凄いのにAGPはfigmaよりも劣・・・・ で、凄いと思うのは ふみな３個分＝FAガール１個分 と言うバンダイの値段設定ですｗ";;;;"938055225973153792";https://twitter.com/GoGoFuryu/status/938055225973153792;;ホビーショップふりゅ,Hawaii,
GoGoFuryu;2017-12-05 09:30;0;1;"figmaリー先生はヤラレ役になって他の活用が微妙ですね。。。。アーツのリー先生もヤラレ役も出来ますし他にも色々と使えるのでアーツのリー先生は優秀すぎなのを実感しますねｗ pic.twitter.com/6FEzb1T3j3";;;;"938053057325043713";https://twitter.com/GoGoFuryu/status/938053057325043713;;ホビーショップふりゅ,Hawaii,
GoGoFuryu;2017-12-05 08:40;0;1;"久しぶりに最終回１２話をチョット観ました晴の肋骨にチタンが仕込まれてると言うのも見事に忘れてましたｗ 渋滞が得意な人はいないですね（＾＾； 先月の大洗あんこう祭り前日祭に参加しましたが道も駐車場もスムーズでした！（駐車場も無料です） pic.twitter.com/VJc6AN5AIy";;;;"938040384118145024";https://twitter.com/GoGoFuryu/status/938040384118145024;;ホビーショップふりゅ,Hawaii,
GoGoFuryu;2017-12-05 08:28;0;1;"スケール飾るためにショーケース欲しいんですけどね。 飾る為の場所がないから困ってます・・・。 後は売るのも検討してます・・・・・";;;;"938037331197509634";https://twitter.com/GoGoFuryu/status/938037331197509634;;ホビーショップふりゅ,Hawaii,
GoGoFuryu;2017-12-05 08:24;0;1;"アーツのリー先生のインパクトがすごすぎてfigmaの方はマイナーな扱いになっちゃってますね（＾＾； 米さんがリー先生を入手なさるとドチラ側になるんでしょうか・・・ｗ pic.twitter.com/TIiOkIbCNw";;;;"938036445549228032";https://twitter.com/GoGoFuryu/status/938036445549228032;;ホビーショップふりゅ,Hawaii,
GoGoFuryu;2017-12-05 08:15;0;1;"じゃあ10億当たったら2億下さい。私が10億あったら2億差し上げますんでｗ みくにゃんの困り顔はソソりますね(*´Д`)ﾊｧﾊｧ ウェーブのヨハネも26%オフですねぇ～逝くですか？ pic.twitter.com/fQF0hQwuB6";;;;"938033980305113088";https://twitter.com/GoGoFuryu/status/938033980305113088;;ホビーショップふりゅ,Hawaii,
GoGoFuryu;2017-12-05 08:11;0;2;"私もグンマーなド田舎ですが～おバカ（褒め言葉）な中古屋のお陰で結構助かってますね。他にも未開封品でfigmaシノン5千円、figma大道寺知世GSC特典付き980円、figma本田未央ジャージ3980円でしたしｗ AGP武蔵３代目！？→開封美品で3980円で売ってマシた。。。";;;;"938032966873128960";https://twitter.com/GoGoFuryu/status/938032966873128960;;ホビーショップふりゅ,Hawaii,
GoGoFuryu;2017-12-05 08:04;0;2;"私はガノタなので飛田展男さんはカミーユ・・・機動戦艦ナデシコのウリバタケさんの方がイメージ強いですねｗｗｗ ただナデシコではメインヒロインのミスマル・ユリカよりもホシノ・ルリファンがすご～く多かったとか？ pic.twitter.com/SZmrropoxi";;;;"938031207794618368";https://twitter.com/GoGoFuryu/status/938031207794618368;;ホビーショップふりゅ,Hawaii,
GoGoFuryu;2017-12-05 07:57;0;1;"フィンキーさんもやってしまってましたか・・・( ͡° ͜ʖ ͡°) 仮組みして１回バラそうとするとそんなに力入れてないのに簡単に折れてしまうのでFAガールは一発勝負しないと駄目みたいですｗ ガンプラではこんな事、無かったのですがｗｗｗ";;;;"938029544581218304";https://twitter.com/GoGoFuryu/status/938029544581218304;;ホビーショップふりゅ,Hawaii,
GoGoFuryu;2017-12-05 07:53;0;1;"開封済みはあの棚だけではないですね。実はスケールフィギュアは飾る場所がないので別の場所にしまってありますｗ リストを見ると397個ですね。 ただガンプラは漏れが多いので一度棚卸ししないと正確な数字はわからないですねｗ";;;;"938028611470180353";https://twitter.com/GoGoFuryu/status/938028611470180353;;ホビーショップふりゅ,Hawaii,
GoGoFuryu;2017-12-05 07:44;0;2;"米さんもリー先生いかがですか？ｗ pic.twitter.com/PadfQlYcDG";;;;"938026271539281922";https://twitter.com/GoGoFuryu/status/938026271539281922;;ホビーショップふりゅ,Hawaii,
GoGoFuryu;2017-12-05 07:18;0;9;"ベティは買う・・・・だからペテルギウスも出すのDEATH！ pic.twitter.com/hQuH4CbZoc";;;;"938019858335199233";https://twitter.com/GoGoFuryu/status/938019858335199233;;ホビーショップふりゅ,Hawaii,
GoGoFuryu;2017-12-05 07:09;1;13;"帰りゅー_:(´ཀ`」 ∠): pic.twitter.com/BNnSeplE1u";;;;"938017486728962048";https://twitter.com/GoGoFuryu/status/938017486728962048;;ホビーショップふりゅ,Hawaii,
GoGoFuryu;2017-12-05 02:35;0;1;"そちらでしたらこの御方を出さざるを得ないですね。 撃ち込むのは鉛玉ではありませんがｗ pic.twitter.com/tSjAN8ghIi";;;;"937948629200801792";https://twitter.com/GoGoFuryu/status/937948629200801792;;ホビーショップふりゅ,Hawaii,
GoGoFuryu;2017-12-05 02:24;0;1;"雪 #ゆと打って出てきたものがお前に不足";;;#;"937945684862386176";https://twitter.com/GoGoFuryu/status/937945684862386176;;ホビーショップふりゅ,Hawaii,
GoGoFuryu;2017-12-05 01:57;0;1;"でも兎角さんはナイフ振り回してたのに暗殺処女とバレてしまいました。 大洗のイベントには何度も車で足を運んでますが意外と平気でしたよー＾＾";;;;"937938948550156288";https://twitter.com/GoGoFuryu/status/937938948550156288;;ホビーショップふりゅ,Hawaii,
GoGoFuryu;2017-12-05 01:32;0;1;"もしかしたらノイズが入っただけで後は心霊写真が撮れたのですかね？";;;;"937932684881358848";https://twitter.com/GoGoFuryu/status/937932684881358848;;ホビーショップふりゅ,Hawaii,
GoGoFuryu;2017-12-05 01:31;0;1;"先ずは当てないと駄目なので10枚3,000円で連番10枚、バラ10枚で勝負ですね（元手がそれほど出せないのでｗ） セイバーリリィはアニメでは出なかったような・・・（汗）";;;;"937932388050468865";https://twitter.com/GoGoFuryu/status/937932388050468865;;ホビーショップふりゅ,Hawaii,
GoGoFuryu;2017-12-05 01:25;0;1;"ありがとうございますm(_ _)m 秋山殿はぶち込むのが好きみたいですｗ pic.twitter.com/qzdiFZ33JG";;;;"937931031633526784";https://twitter.com/GoGoFuryu/status/937931031633526784;;ホビーショップふりゅ,Hawaii,
GoGoFuryu;2017-12-04 22:11;0;2;"ねんどろいど遠坂凛はver2.0って訳にはいかなかったのかなぁ。。。";;;;"937882014543355904";https://twitter.com/GoGoFuryu/status/937882014543355904;;ホビーショップふりゅ,Hawaii,
GoGoFuryu;2017-12-04 20:41;0;1;"年末ジャンボに賭けるしかないですねｗ １等７億、前後賞で１０億・・・ そして自堕落なホビー生活！ リリィさんは半人前で更に魔法とか使えませんですｗ 後ろ？ピンボケですよｗ";;;;"937859404891697153";https://twitter.com/GoGoFuryu/status/937859404891697153;;ホビーショップふりゅ,Hawaii,
GoGoFuryu;2017-12-04 20:29;0;0;"とりあえず歩く事から始めようかと思います～。 後はビリーズブートキャンプでもやってみますかね？ｗ";;;;"937856492065079297";https://twitter.com/GoGoFuryu/status/937856492065079297;;ホビーショップふりゅ,Hawaii,
GoGoFuryu;2017-12-04 20:01;0;1;"おはようございます。 悪魔のリドルはＴＶアニメで観て好きでしたよ。 何も知らされてない担任が哀れでしたｗｗｗ それまでは大洗は安泰ですね！ｗ 今も大洗でイベントあると凄いですけどね～。";;;;"937849346795520000";https://twitter.com/GoGoFuryu/status/937849346795520000;;ホビーショップふりゅ,Hawaii,
GoGoFuryu;2017-12-04 19:34;0;1;"重装備になりすぎてフレズが身動き取れなくなりそうですねｗ ２体目ジムは塗装の実験台なのでバラバラ状態なので組みあがる事はないと思われますorz 実はメガミデバイスも足首折ってますｗ 轟雷、マテリア、メガミデバイスと右足首やらかしてます。。。";;;;"937842697099911168";https://twitter.com/GoGoFuryu/status/937842697099911168;;ホビーショップふりゅ,Hawaii,
GoGoFuryu;2017-12-04 19:15;0;3;"会社に出た途端に具合が悪くなりましたｗ １日分の仕事量が・・・今日も早く帰れなさそうです。。。。 リリィは私は不具合にぶち当たりましたが結構良いですぞ～＾＾ pic.twitter.com/egvC3KqU00";;;;"937837688563970048";https://twitter.com/GoGoFuryu/status/937837688563970048;;ホビーショップふりゅ,Hawaii,
GoGoFuryu;2017-12-04 09:57;8;26;"怖い(・ω・) #目元より下で切り出すとエロいらしい pic.twitter.com/cdmGmmaKjX";;;#;"937697497438285830";https://twitter.com/GoGoFuryu/status/937697497438285830;;ホビーショップふりゅ,Hawaii,
