username;date;retweets;favorites;text;geo;mentions;hashtags;id;permalink;place_full_name;location;timezone;profile_location_name
hikmetbilici25;2017-12-06 14:42;0;3;"Ulen küfür yemekten bıkmadınmı?";;;;"938493928009011205";https://twitter.com/hikmetbilici25/status/938493928009011205;;İstanbul, Türkiye,Quito,İstanbul, Türkiye
hikmetbilici25;2017-12-06 14:37;0;1;"Turump kararına arap liginden tepki varmı acaba";;;;"938492677456265216";https://twitter.com/hikmetbilici25/status/938492677456265216;;İstanbul, Türkiye,Quito,İstanbul, Türkiye
hikmetbilici25;2017-12-06 14:27;0;0;"Filistin son noktayı koydu. Sonuna kadar savaşacağız";;;;"938489981282201601";https://twitter.com/hikmetbilici25/status/938489981282201601;;İstanbul, Türkiye,Quito,İstanbul, Türkiye
hikmetbilici25;2017-12-06 14:15;0;0;"#KudüseSahipÇık #KuduesBizimdir";;;#Kud #KuduesBizimdir;"938487072054218752";https://twitter.com/hikmetbilici25/status/938487072054218752;;İstanbul, Türkiye,Quito,İstanbul, Türkiye
hikmetbilici25;2017-12-06 14:07;0;1;"Ulen şerefsiz sen neden somaliye değilde ABD ye sığındın...";;;;"938485187922546688";https://twitter.com/hikmetbilici25/status/938485187922546688;;İstanbul, Türkiye,Quito,İstanbul, Türkiye
hikmetbilici25;2017-12-06 13:41;0;0;"Ne yapmamızı isterdin hain soytarı. Senin gibi Amerikan köpeği olmadık.";;;;"938478532212219905";https://twitter.com/hikmetbilici25/status/938478532212219905;;İstanbul, Türkiye,Quito,İstanbul, Türkiye
hikmetbilici25;2017-12-06 13:34;0;0;"Tüm müslümanlar adına ABD yi kınıyorum.";;;;"938476765030289408";https://twitter.com/hikmetbilici25/status/938476765030289408;;İstanbul, Türkiye,Quito,İstanbul, Türkiye
hikmetbilici25;2017-12-06 12:26;0;0;"Bir gazeteci ancak ölünce susar. Özgür basın susturulamaz. #AHaberSusturulamaz";;;#AHaberSusturulamaz;"938459559257165832";https://twitter.com/hikmetbilici25/status/938459559257165832;;İstanbul, Türkiye,Quito,İstanbul, Türkiye
hikmetbilici25;2017-12-06 12:20;0;0;""Yav ben eski maliyeciyim, eski hesap uzmanıyım. Ben mal'ın nasıl götürüleceğini senden iyi bilirim." @kilicdarogluk";;@kilicdarogluk;;"938458049882271749";https://twitter.com/hikmetbilici25/status/938458049882271749;;İstanbul, Türkiye,Quito,İstanbul, Türkiye
hikmetbilici25;2017-12-06 10:54;0;0;"Daha çok sayı sayarsın sen.";;;;"938436369952727040";https://twitter.com/hikmetbilici25/status/938436369952727040;;İstanbul, Türkiye,Quito,İstanbul, Türkiye
hikmetbilici25;2017-12-06 04:36;0;0;"ABD ninTeröre, teröriste yardım ettigi kanıtlanmıştır. 4 bin tır dolusu silâh vermistir. Derhal BM ye, uluslararası mahkemelere, lahey adalet divanına müracaat ederek suç duyurusunda bulunmalıyız.";;;;"938341266592542720";https://twitter.com/hikmetbilici25/status/938341266592542720;;İstanbul, Türkiye,Quito,İstanbul, Türkiye
hikmetbilici25;2017-12-05 13:10;0;2;"Bu hainlerin yurtdışına kaçmasına yanarım ki ne yanarım.";;;;"938108343335432192";https://twitter.com/hikmetbilici25/status/938108343335432192;;İstanbul, Türkiye,Quito,İstanbul, Türkiye
hikmetbilici25;2017-12-05 12:51;0;0;""O akşam oteller kapalı olduğu ve bizi otele almadıkları için Bakırköy Belediye Başkanımızın evine gittik" @kilicdarogluk";;@kilicdarogluk;;"938103661389144064";https://twitter.com/hikmetbilici25/status/938103661389144064;;İstanbul, Türkiye,Quito,İstanbul, Türkiye
hikmetbilici25;2017-12-05 12:21;0;0;"Amerika'da kumpas tiyatrosu devam ediyor.";;;;"938096048102309888";https://twitter.com/hikmetbilici25/status/938096048102309888;;İstanbul, Türkiye,Quito,İstanbul, Türkiye
hikmetbilici25;2017-12-05 12:18;0;0;"15 temmuz'da ahaber meydanlarda, halkla beraberdi. Ya sen neredeydin. (Bakırköy sahil)";;;;"938095352774881281";https://twitter.com/hikmetbilici25/status/938095352774881281;;İstanbul, Türkiye,Quito,İstanbul, Türkiye
hikmetbilici25;2017-12-05 12:14;0;0;"8 ve 9 Haziran'da ilk işimiz bu kirli gazetelerin tamamına el koymak olacaktır. Diyen kişiyi hatırlatırız. @Ahaber24";;@Ahaber24;;"938094294845575168";https://twitter.com/hikmetbilici25/status/938094294845575168;;İstanbul, Türkiye,Quito,İstanbul, Türkiye
hikmetbilici25;2017-12-05 12:06;0;0;"ABD deki dava hukukla, adaletle ilgisi olmayan cambaza bak, cambaza olayıdır.";;;;"938092217423613953";https://twitter.com/hikmetbilici25/status/938092217423613953;;İstanbul, Türkiye,Quito,İstanbul, Türkiye
hikmetbilici25;2017-12-05 12:01;0;0;"Senin gücün yermez ahaberi susturmaya @kilicdarogluk";;@kilicdarogluk;;"938091036408197120";https://twitter.com/hikmetbilici25/status/938091036408197120;;İstanbul, Türkiye,Quito,İstanbul, Türkiye
hikmetbilici25;2017-12-05 04:11;0;0;"Alçaklıkta sınır tanımıyorlar. pic.twitter.com/3QoGd6ma0P";;;;"937972668988641280";https://twitter.com/hikmetbilici25/status/937972668988641280;;İstanbul, Türkiye,Quito,İstanbul, Türkiye
hikmetbilici25;2017-12-04 15:38;0;0;"Unutma pic.twitter.com/33kuZfKMpa";;;;"937783254710652928";https://twitter.com/hikmetbilici25/status/937783254710652928;;İstanbul, Türkiye,Quito,İstanbul, Türkiye
hikmetbilici25;2017-12-03 16:29;0;0;"Ne istedin o sevimli kedicikten, yavrucaktan . Hayvan oğlu hayvan";;;;"937433609685880833";https://twitter.com/hikmetbilici25/status/937433609685880833;;İstanbul, Türkiye,Quito,İstanbul, Türkiye
hikmetbilici25;2017-12-03 16:25;0;0;"Amerika iki sebeple güçlüdür. Ülkesindeki vatan hainlerini bulur ve öldürür. Diğer ülkelerdeki vatan hainlerini bulur kullanır. ABD Eski Dışişleri Bakanı Henry Kissenger";;;;"937432737404850179";https://twitter.com/hikmetbilici25/status/937432737404850179;;İstanbul, Türkiye,Quito,İstanbul, Türkiye
hikmetbilici25;2017-12-03 14:50;0;1;"Sen şu an neredesin? Vatansız hain";;;;"937408796414144513";https://twitter.com/hikmetbilici25/status/937408796414144513;;İstanbul, Türkiye,Quito,İstanbul, Türkiye
hikmetbilici25;2017-12-03 14:45;0;0;"Türkiye'nin bu kadar meselesi varken, bir çelmede ben nasıl takarım moduna girmek. Elinde ne idüğü belli olmayan sahte paçavraları sallamak neyin nesidir. Senin amacın Ne? Ne yapmak istiyorsun?";;;;"937407566300221440";https://twitter.com/hikmetbilici25/status/937407566300221440;;İstanbul, Türkiye,Quito,İstanbul, Türkiye
hikmetbilici25;2017-12-03 13:19;0;0;"Sevgi varsa engel yoktur. 3 Aralık engelliler günü";;;;"937385877369651206";https://twitter.com/hikmetbilici25/status/937385877369651206;;İstanbul, Türkiye,Quito,İstanbul, Türkiye
hikmetbilici25;2017-12-03 13:08;0;0;"Yorumsuz pic.twitter.com/X3qssCGEBa";;;;"937382965310607360";https://twitter.com/hikmetbilici25/status/937382965310607360;;İstanbul, Türkiye,Quito,İstanbul, Türkiye
hikmetbilici25;2017-12-03 12:54;0;0;"#ABDTürkiyeyiYargılayamaz";;;#ABDT;"937379585628524544";https://twitter.com/hikmetbilici25/status/937379585628524544;;İstanbul, Türkiye,Quito,İstanbul, Türkiye
hikmetbilici25;2017-12-03 12:52;0;0;"Külliyenin tuvalet klozetleri altındı. Yalancı seni";;;;"937379075156512768";https://twitter.com/hikmetbilici25/status/937379075156512768;;İstanbul, Türkiye,Quito,İstanbul, Türkiye
hikmetbilici25;2017-12-03 12:45;0;0;"Devletin sahibi millettir.";;;;"937377195449831425";https://twitter.com/hikmetbilici25/status/937377195449831425;;İstanbul, Türkiye,Quito,İstanbul, Türkiye
hikmetbilici25;2017-12-03 12:43;0;0;"Bak kardeş pic.twitter.com/reQt7Pu3bj";;;;"937376698819121155";https://twitter.com/hikmetbilici25/status/937376698819121155;;İstanbul, Türkiye,Quito,İstanbul, Türkiye
hikmetbilici25;2017-12-03 12:37;0;0;"#loweErdoğan";;;#loweErdo;"937375147115335680";https://twitter.com/hikmetbilici25/status/937375147115335680;;İstanbul, Türkiye,Quito,İstanbul, Türkiye
hikmetbilici25;2017-12-03 12:26;0;0;"Ne yapalım senin booklu donunu?";;;;"937372556860018690";https://twitter.com/hikmetbilici25/status/937372556860018690;;İstanbul, Türkiye,Quito,İstanbul, Türkiye
hikmetbilici25;2017-12-02 16:28;0;0;"Süpersin gardaş.";;;;"937071033751830528";https://twitter.com/hikmetbilici25/status/937071033751830528;;İstanbul, Türkiye,Quito,İstanbul, Türkiye
hikmetbilici25;2017-12-02 16:22;0;1;"Süpersin gardaş";;;;"937069464390127616";https://twitter.com/hikmetbilici25/status/937069464390127616;;İstanbul, Türkiye,Quito,İstanbul, Türkiye
hikmetbilici25;2017-12-02 16:18;0;0;"Zarrab davası düzmece bir davadır. Haince planlanmış bir kumpastır.";;;;"937068445673377792";https://twitter.com/hikmetbilici25/status/937068445673377792;;İstanbul, Türkiye,Quito,İstanbul, Türkiye
hikmetbilici25;2017-12-02 16:16;0;0;"Iran'a ambargoyu delen asıl ABD dir. Türkiye'ye havlamsı bundandır.";;;;"937067973931622400";https://twitter.com/hikmetbilici25/status/937067973931622400;;İstanbul, Türkiye,Quito,İstanbul, Türkiye
hikmetbilici25;2017-12-02 16:13;0;0;"Hadi ordan gavat";;;;"937067128372498433";https://twitter.com/hikmetbilici25/status/937067128372498433;;İstanbul, Türkiye,Quito,İstanbul, Türkiye
hikmetbilici25;2017-12-02 06:17;0;0;"Cumhurbaşkanı Recep Tayyip Erdoğan "Kimisi hans'ın kulu kölesi oluyor.kimsi george'un kulu kölesi oluyor"";;;;"936917331220893696";https://twitter.com/hikmetbilici25/status/936917331220893696;;İstanbul, Türkiye,Quito,İstanbul, Türkiye
hikmetbilici25;2017-12-01 15:18;0;1;"Sahte belgeleri sallayarak. Bu işten kurtulamazsın. Baltayı taşa vurdun.";;;;"936691000310976512";https://twitter.com/hikmetbilici25/status/936691000310976512;;İstanbul, Türkiye,Quito,İstanbul, Türkiye
hikmetbilici25;2017-12-01 15:09;0;0;"Bu dava hukuki bir dava olmaktan çıkmıştır. Siyasi bir dava olmuştur. Kumpas ve iftiraya dönüşmüştür.";;;;"936688606202261506";https://twitter.com/hikmetbilici25/status/936688606202261506;;İstanbul, Türkiye,Quito,İstanbul, Türkiye
hikmetbilici25;2017-12-01 14:48;1;1;"Asıl ABD Iran'a uygulanan ambargoyu delmiştir. Hiç başka suçlu aramasın, çamura yatmasın.";;;;"936683422239600640";https://twitter.com/hikmetbilici25/status/936683422239600640;;İstanbul, Türkiye,Quito,İstanbul, Türkiye
hikmetbilici25;2017-12-01 04:09;0;0;"ABD Zarrab'i tehtidle, şantajla Türkiye aleyhine kullanıyor.";;;;"936522686590840832";https://twitter.com/hikmetbilici25/status/936522686590840832;;İstanbul, Türkiye,Quito,İstanbul, Türkiye
hikmetbilici25;2017-12-01 04:06;0;0;"Türkiye büyüyor, güçleniyor, emin adımlarla ilerliyor. ABD nin hazımsızlığı, bizimle uğraşması bundan ibarettir.";;;;"936521958988140544";https://twitter.com/hikmetbilici25/status/936521958988140544;;İstanbul, Türkiye,Quito,İstanbul, Türkiye
hikmetbilici25;2017-12-01 04:03;0;0;"ABD nin Iran'a ambargosu bizi bağlamaz. Hukuki olarak hiç bir sorumluluğumuz yoktur.";;;;"936521155103674368";https://twitter.com/hikmetbilici25/status/936521155103674368;;İstanbul, Türkiye,Quito,İstanbul, Türkiye
hikmetbilici25;2017-11-30 02:02;0;0;"Bir gazeteci köşesinde yazmış. "Zarrab konuştukça Türkiye utanıyor." diye Ey aklı evvel gazeteci neden Türkiye utansın, Türkiye'ye kurulan bu hain iftira ve kumpası sen hâlen görmüyormusun? Görmekte işine gelmiyor.";;;;"936128251084394496";https://twitter.com/hikmetbilici25/status/936128251084394496;;İstanbul, Türkiye,Quito,İstanbul, Türkiye
hikmetbilici25;2017-11-29 13:44;0;0;"Vatan haini seni Amerikan köpeği";;;;"935942595506819072";https://twitter.com/hikmetbilici25/status/935942595506819072;;İstanbul, Türkiye,Quito,İstanbul, Türkiye
hikmetbilici25;2017-11-28 12:44;0;0;"Cumhurbaşkanlıgı külliyesi tuvalet klozet leri altın kaplama dedi fos çıktı.";;;;"935565172588113921";https://twitter.com/hikmetbilici25/status/935565172588113921;;İstanbul, Türkiye,Quito,İstanbul, Türkiye
hikmetbilici25;2017-11-28 12:24;0;0;"Ya arkadaşlar bu ABD yi ciddiye almayın. ABD nin Türkiye'ye kurduğu kumpas elinde patlayacak.";;;;"935560151544881152";https://twitter.com/hikmetbilici25/status/935560151544881152;;İstanbul, Türkiye,Quito,İstanbul, Türkiye
hikmetbilici25;2017-11-28 12:14;0;0;"Dağ fare doğurdu. @kilicdarogluk hani belge nerede? Göstersene.";;@kilicdarogluk;;"935557405714321410";https://twitter.com/hikmetbilici25/status/935557405714321410;;İstanbul, Türkiye,Quito,İstanbul, Türkiye
hikmetbilici25;2017-11-28 11:37;0;0;"Çamur at tutmazsa izi kalsın.";;;;"935548281471553537";https://twitter.com/hikmetbilici25/status/935548281471553537;;İstanbul, Türkiye,Quito,İstanbul, Türkiye
hikmetbilici25;2017-11-28 11:19;0;0;"Amerika'nın iran ambargosu, Türkiye'yi bağlamaz.";;;;"935543802391130114";https://twitter.com/hikmetbilici25/status/935543802391130114;;İstanbul, Türkiye,Quito,İstanbul, Türkiye
hikmetbilici25;2017-11-28 11:14;0;0;"Yine belge açıklayacağım dedi. Sonra fos çıktı.";;;;"935542338553896961";https://twitter.com/hikmetbilici25/status/935542338553896961;;İstanbul, Türkiye,Quito,İstanbul, Türkiye