username;date;retweets;favorites;text;geo;mentions;hashtags;id;permalink;place_full_name;location;timezone;profile_location_name
janner1918;2017-12-03 19:08;1;3;"THIS ... STRONTIUM +++ BARIUM +++ ALUMINUM pic.twitter.com/I0RkwkelaD";;;;"937473617243275264";https://twitter.com/janner1918/status/937473617243275264;;England, United Kingdom,Pacific Time (US & Canada),England, United Kingdom
janner1918;2017-12-03 19:04;0;0;"I wonder how many civilians were killed in the raids ?";;;;"937472529249243136";https://twitter.com/janner1918/status/937472529249243136;;England, United Kingdom,Pacific Time (US & Canada),England, United Kingdom
janner1918;2017-12-03 18:51;1;3;"Goodnight brothers & sisters, may the Lord's blessed light shine upon you as you reveal the truth to the masses. Thank you for following me and liking my tweets. I will say Au revoir tll we meet again. pic.twitter.com/wrg2FsdeA5";;;;"937469329192472576";https://twitter.com/janner1918/status/937469329192472576;;England, United Kingdom,Pacific Time (US & Canada),England, United Kingdom
janner1918;2017-12-03 18:41;0;1;"I voted NO and I'll tell you why. Whatever politician is in power, no matter what party. They are just puppets for the Satan and his Lucerian elite. They just do what the elite tells them. pic.twitter.com/C1QB2NGLCB";;;;"937466732901433344";https://twitter.com/janner1918/status/937466732901433344;;England, United Kingdom,Pacific Time (US & Canada),England, United Kingdom
janner1918;2017-12-03 18:33;4;2;"IS THE PENTAGON EARMARKED AS THE HEAD QUARTERS OF THE NEW ILLUMINATI ? pic.twitter.com/jvGlyLIrr1";;;;"937464757824651264";https://twitter.com/janner1918/status/937464757824651264;;England, United Kingdom,Pacific Time (US & Canada),England, United Kingdom
janner1918;2017-12-03 18:27;6;3;"WHAT MAKES YOU THINK C.E.R.N. IS SATANIC ?? pic.twitter.com/cKfK9wGrXM";;;;"937463434236579840";https://twitter.com/janner1918/status/937463434236579840;;England, United Kingdom,Pacific Time (US & Canada),England, United Kingdom
janner1918;2017-12-03 18:17;1;0;""MAKE A JOYFUL NOISE UNTO THE LORD " lol...My voice is like Les playing the piano lol...But I know God doesn't mind, I was born tone deaf ! https://www. youtube.com/watch?v=9nNGla iVypU …";;;;"937460748007149568";https://twitter.com/janner1918/status/937460748007149568;;England, United Kingdom,Pacific Time (US & Canada),England, United Kingdom
janner1918;2017-12-03 18:09;1;3;"No, They are in Hell and CERN are trying ..(.It's possible they have succeeded already ) to release them . So we will just have to wait and see what happens next. Though the bible will give you some idea. Just read Revelations and see. pic.twitter.com/GmOK4tnDyx";;;;"937458793256013826";https://twitter.com/janner1918/status/937458793256013826;;England, United Kingdom,Pacific Time (US & Canada),England, United Kingdom
janner1918;2017-12-03 17:50;0;1;"I think we ought to ask the cows how it works lol...don't you ! pic.twitter.com/FpV3ymcqdZ";;;;"937454013699756034";https://twitter.com/janner1918/status/937454013699756034;;England, United Kingdom,Pacific Time (US & Canada),England, United Kingdom
janner1918;2017-12-03 17:16;0;0;"Yeah, He must be right then lol pic.twitter.com/fIiQMETudm";;;;"937445571018838017";https://twitter.com/janner1918/status/937445571018838017;;England, United Kingdom,Pacific Time (US & Canada),England, United Kingdom
janner1918;2017-12-03 16:03;3;1;"I believe that the more that whistle blowers disclose and the more people that know , then the more the whistle blowers are safe...";;;;"937427185241088000";https://twitter.com/janner1918/status/937427185241088000;;England, United Kingdom,Pacific Time (US & Canada),England, United Kingdom
janner1918;2017-12-03 15:56;0;0;"pic.twitter.com/XSTacGubx8";;;;"937425449029906432";https://twitter.com/janner1918/status/937425449029906432;;England, United Kingdom,Pacific Time (US & Canada),England, United Kingdom
janner1918;2017-12-03 15:41;1;1;"You must remember my friend, we were indoctrinated once. Remember that and be gentle when you tell people the truth. It is hard I know, but they listen more then...peace & love in Jesus ....janner 1918 pic.twitter.com/QT47pi4UDr";;;;"937421630434881537";https://twitter.com/janner1918/status/937421630434881537;;England, United Kingdom,Pacific Time (US & Canada),England, United Kingdom
janner1918;2017-12-03 15:28;1;0;"THANK YOU LORD pic.twitter.com/wBEHkait7c";;;;"937418351999102976";https://twitter.com/janner1918/status/937418351999102976;;England, United Kingdom,Pacific Time (US & Canada),England, United Kingdom
janner1918;2017-12-03 15:00;1;7;"" YES I KNOW IT'S HARD TO BELIEVE MUM & YOU DAD....BUT WHETHER YOU LIKE IT OR NOT >>>> THE *** EARTH *** IS *** FLAT ! " pic.twitter.com/CWc2eSqhmt";;;;"937411315882254336";https://twitter.com/janner1918/status/937411315882254336;;England, United Kingdom,Pacific Time (US & Canada),England, United Kingdom
janner1918;2017-12-03 14:51;1;1;"YOU REMEMBER TO BRUSH YOUR TEETH IN THE MORNING....YOU REMEMBER TO HAVE A SHOWER>>> YOU REMEMBER YOUR BUS PASS **** BEFORE YOU DO ANY OF THAT YOU SHOULD THANK GOD FOR THE NEW DAY pic.twitter.com/TJqo9h8pJc";;;;"937408872536510464";https://twitter.com/janner1918/status/937408872536510464;;England, United Kingdom,Pacific Time (US & Canada),England, United Kingdom
janner1918;2017-12-03 14:35;1;1;"I SEE......ALL THIS BEAUTY HAPPENED BY CHANCE ?? pic.twitter.com/7CuETxaS7G";;;;"937405067812069377";https://twitter.com/janner1918/status/937405067812069377;;England, United Kingdom,Pacific Time (US & Canada),England, United Kingdom
janner1918;2017-12-03 14:20;0;0;"THIS LOVELY GIRL SHOULD BE FREE >>> IF THERE IS ANY JUSTICE LEFT IN THIS WORLD !";;;;"937401051640197122";https://twitter.com/janner1918/status/937401051640197122;;England, United Kingdom,Pacific Time (US & Canada),England, United Kingdom
janner1918;2017-12-03 14:17;0;0;"IS THIS LOVELY YOUNG WOMAN FREE YET ? >>> SHE SHOULD BE";;;;"937400424981770241";https://twitter.com/janner1918/status/937400424981770241;;England, United Kingdom,Pacific Time (US & Canada),England, United Kingdom
janner1918;2017-12-03 14:11;3;16;"NOT FOR OUR BENEFIT I KNOW !! pic.twitter.com/UKtRnpntoE";;;;"937398797646352384";https://twitter.com/janner1918/status/937398797646352384;;England, United Kingdom,Pacific Time (US & Canada),England, United Kingdom
janner1918;2017-12-03 14:04;0;0;"OH ! THEY KNOW ALL RIGHT !! pic.twitter.com/5sCFERBpF1";;;;"937397180201041920";https://twitter.com/janner1918/status/937397180201041920;;England, United Kingdom,Pacific Time (US & Canada),England, United Kingdom
janner1918;2017-12-03 13:51;6;4;"REMEMBER CHRISTMAS IS A TIME FOR GIVING >>> IT'S NICE TO RECEIVE BUT IT'S EVEN BETTER TO GIVE pic.twitter.com/JsFxnoTeCs";;;;"937393903757615104";https://twitter.com/janner1918/status/937393903757615104;;England, United Kingdom,Pacific Time (US & Canada),England, United Kingdom
janner1918;2017-12-03 13:37;5;7;"Because it is my love....They call it scare tactics, they are trying to frighten us into believing these false flag attacks are real...but they are not. pic.twitter.com/fcBsdrKSK8";;;;"937390296685522944";https://twitter.com/janner1918/status/937390296685522944;;England, United Kingdom,Pacific Time (US & Canada),England, United Kingdom
janner1918;2017-12-03 13:25;1;0;"They shall be lovers of self, not lovers of God......How True";;;;"937387236508696578";https://twitter.com/janner1918/status/937387236508696578;;England, United Kingdom,Pacific Time (US & Canada),England, United Kingdom
janner1918;2017-12-03 13:02;0;1;"WELL DONE TAMMY";;;;"937381603902451712";https://twitter.com/janner1918/status/937381603902451712;;England, United Kingdom,Pacific Time (US & Canada),England, United Kingdom
janner1918;2017-12-03 10:58;0;0;"WINDOWS SPYWARE SERVICE CURE RUN "UNHACKME " IT WORKS !!...J JUST FOLLOW INSTRUCTIONS";;;;"937350369851727872";https://twitter.com/janner1918/status/937350369851727872;;England, United Kingdom,Pacific Time (US & Canada),England, United Kingdom
janner1918;2017-12-03 10:43;0;0;"My neighbor said this earlier, and he's right. He isn't a Christian but he said " you only have one birthday, all the rest are anniversaries " and I thought yeah, we praise ourselves on those days and not God. That's why it's satanic !";;;;"937346562761658368";https://twitter.com/janner1918/status/937346562761658368;;England, United Kingdom,Pacific Time (US & Canada),England, United Kingdom
janner1918;2017-12-02 20:02;0;1;"Soon,very soon...justice will be done ! pic.twitter.com/ap8ANYwV6b";;;;"937124799436021760";https://twitter.com/janner1918/status/937124799436021760;;England, United Kingdom,Pacific Time (US & Canada),England, United Kingdom
janner1918;2017-12-02 19:39;1;0;"ONLY WORKS ON A FE pic.twitter.com/YK46ydORMC";;;;"937119032632926208";https://twitter.com/janner1918/status/937119032632926208;;England, United Kingdom,Pacific Time (US & Canada),England, United Kingdom
janner1918;2017-12-02 18:41;1;3;"To think, this isn't perfect !....What will perfection be like then ?";;;;"937104501613518848";https://twitter.com/janner1918/status/937104501613518848;;England, United Kingdom,Pacific Time (US & Canada),England, United Kingdom
janner1918;2017-12-02 18:30;0;1;"This is absolute proof that man did not go to the Moon.....How can you phone on a landline if NASA says the Moon is nearly 389,000 miles away HA Ha Ha ...It would have to be one hell of a long piece of wire !! pic.twitter.com/2pBmnKmFae";;;;"937101796853604352";https://twitter.com/janner1918/status/937101796853604352;;England, United Kingdom,Pacific Time (US & Canada),England, United Kingdom
janner1918;2017-12-02 18:00;0;0;"Chris, she is more beautiful now then you ever could have imagined. My friend, she is where we all want to be....As the bride of Christ. Hang in there Chris for you shall see her as she truly is, and you will behold her beauty once more.";;;;"937094238726172672";https://twitter.com/janner1918/status/937094238726172672;;England, United Kingdom,Pacific Time (US & Canada),England, United Kingdom
janner1918;2017-12-02 12:18;0;1;"ILLUMINATI PRINCESS OF THE SATANIC ORDER pic.twitter.com/eGK3q5QuNX";;;;"937008153564151808";https://twitter.com/janner1918/status/937008153564151808;;England, United Kingdom,Pacific Time (US & Canada),England, United Kingdom
janner1918;2017-12-02 12:13;1;4;"LIED ABOUT EVERYTHING !";;;;"937006807595220992";https://twitter.com/janner1918/status/937006807595220992;;England, United Kingdom,Pacific Time (US & Canada),England, United Kingdom
janner1918;2017-12-02 12:12;0;2;"Nice spot there Stacey";;;;"937006472357085184";https://twitter.com/janner1918/status/937006472357085184;;England, United Kingdom,Pacific Time (US & Canada),England, United Kingdom
janner1918;2017-12-02 12:09;1;0;"Super Reds .....Brighton & Hove Albion 1 v Liverpool F.C. 5 pic.twitter.com/xIoAWc0L80";;;;"937005707399966721";https://twitter.com/janner1918/status/937005707399966721;;England, United Kingdom,Pacific Time (US & Canada),England, United Kingdom
janner1918;2017-12-02 06:22;1;1;"HOORAY !....Finally got rid of that pesky malware ! Downloaded a little pro gramme called " UNHACKME ".. Here's the site in case anybody needs it http:// greatis.com/unhackme/downl oad.htm?pk_campaign=blog&pk_kwd=end …";;;;"936918566523215875";https://twitter.com/janner1918/status/936918566523215875;;England, United Kingdom,Pacific Time (US & Canada),England, United Kingdom
janner1918;2017-12-01 22:53;1;0;"Hi, Thought I was O.K. with my system, but no they raised their heads again and Microsoft didn't help me at all. Tried Malwarebytes ans Spybot S&D 2 but still no joy. Left a message on the Spybot Forum now, hope they can come up with something...not happy chappie";;;;"936805553812029440";https://twitter.com/janner1918/status/936805553812029440;;England, United Kingdom,Pacific Time (US & Canada),England, United Kingdom
janner1918;2017-12-01 17:39;0;2;"Hi guys, I#m back. Had a lot of bother with the windows spy service, had to restore my old windows...blinking spy service was taking all my CPU's power all 100% of it, everythings fine again now though...God is Good";;;#m;"936726525470298112";https://twitter.com/janner1918/status/936726525470298112;;England, United Kingdom,Pacific Time (US & Canada),England, United Kingdom
janner1918;2017-12-01 12:45;0;0;"Amen";;;;"936652503533457409";https://twitter.com/janner1918/status/936652503533457409;;England, United Kingdom,Pacific Time (US & Canada),England, United Kingdom
janner1918;2017-12-01 12:44;0;1;"pic.twitter.com/cbxtDCkuof";;;;"936652140952674304";https://twitter.com/janner1918/status/936652140952674304;;England, United Kingdom,Pacific Time (US & Canada),England, United Kingdom
janner1918;2017-12-01 12:40;0;2;"More like this I think,...snow in space lol pic.twitter.com/qlKRPDo7id";;;;"936651104896634882";https://twitter.com/janner1918/status/936651104896634882;;England, United Kingdom,Pacific Time (US & Canada),England, United Kingdom
janner1918;2017-12-01 12:34;0;4;"God will give her justice, she will not be forgotten.";;;;"936649789634117634";https://twitter.com/janner1918/status/936649789634117634;;England, United Kingdom,Pacific Time (US & Canada),England, United Kingdom
janner1918;2017-12-01 12:20;0;1;"Hi,, Guys....a bit late today, had shopping & chores to do";;;;"936646170021126146";https://twitter.com/janner1918/status/936646170021126146;;England, United Kingdom,Pacific Time (US & Canada),England, United Kingdom
janner1918;2017-11-30 19:32;0;0;"After you click it click the box with zero beside ( 0 ) it then click ok and delete it ,I have done five so far, it seems to work. The bloody things were taking all my processor power !!";;;;"936392429904781312";https://twitter.com/janner1918/status/936392429904781312;;England, United Kingdom,Pacific Time (US & Canada),England, United Kingdom
janner1918;2017-11-30 19:24;0;0;"I think I have found a way to destroy it, but you got to have patience. When it is at the top of your task manager,right click it with your mouse ,click on details it will take you to details then right click it again and you will see a line of ticks, go to the top one click it .";;;;"936390628862255108";https://twitter.com/janner1918/status/936390628862255108;;England, United Kingdom,Pacific Time (US & Canada),England, United Kingdom
janner1918;2017-11-30 18:04;0;0;"Do a little bit of research and you will find your answer, I do not see why I should waste my valuable time talking to someone who has never researched about anything he wants to know. If you cannot be bothered to do a little research then I'm sorry, I'm finished with you...G'bye";;;;"936370420831440897";https://twitter.com/janner1918/status/936370420831440897;;England, United Kingdom,Pacific Time (US & Canada),England, United Kingdom
janner1918;2017-11-30 09:01;0;1;"@zizousboots Y.N.W.A. pic.twitter.com/UT4fxydUhN";;@zizousboots;;"936233746281435137";https://twitter.com/janner1918/status/936233746281435137;;England, United Kingdom,Pacific Time (US & Canada),England, United Kingdom
janner1918;2017-11-30 08:50;0;0;"@VWhote Mr Green is following Mr White ! Wasn't it the other way round in Reservoir Dogs lol";;@VWhote;;"936231000522321920";https://twitter.com/janner1918/status/936231000522321920;;England, United Kingdom,Pacific Time (US & Canada),England, United Kingdom
janner1918;2017-11-30 08:12;0;0;"All about power,and if they have all the money they have the power !.Satan uses them as puppets to get what he wants. That's supreme power over everyone that will be left on the earth ...One religion ,his which must be obeyed, One Government, One world currency, and one bank pic.twitter.com/2gXNxuiWex";;;;"936221356928184322";https://twitter.com/janner1918/status/936221356928184322;;England, United Kingdom,Pacific Time (US & Canada),England, United Kingdom
janner1918;2017-11-30 07:41;0;0;"The 1% that own this world, Rockefellers, Rothchilds and Royalty plus a few hangers on such as Presidents and top merchant bankers.";;;;"936213659419889664";https://twitter.com/janner1918/status/936213659419889664;;England, United Kingdom,Pacific Time (US & Canada),England, United Kingdom
janner1918;2017-11-30 07:38;0;0;"Illuminati Masters 33 degree Freemasons of the highest Order. In other words second only to Satan himself. As evil and deceiving as he is.";;;;"936212745225203712";https://twitter.com/janner1918/status/936212745225203712;;England, United Kingdom,Pacific Time (US & Canada),England, United Kingdom
janner1918;2017-11-30 07:30;0;0;"Apart from Trillions of pounds, they gain power with their New World Order. Also it keeps the masses as slaves, but most of all it denies God exists. That we are just a mere speck in the cosmos, that we are insignificant not special. But God says we are special and loved by him pic.twitter.com/xMBqW3dbWj";;;;"936210928001052672";https://twitter.com/janner1918/status/936210928001052672;;England, United Kingdom,Pacific Time (US & Canada),England, United Kingdom
janner1918;2017-11-30 07:21;0;0;"Here's my answer to your evolution ... pic.twitter.com/rbbys5Ndkq";;;;"936208561432158208";https://twitter.com/janner1918/status/936208561432158208;;England, United Kingdom,Pacific Time (US & Canada),England, United Kingdom
janner1918;2017-11-30 03:02;0;0;"MAN- MADE OF COURSE lol";;;;"936143359743283200";https://twitter.com/janner1918/status/936143359743283200;;England, United Kingdom,Pacific Time (US & Canada),England, United Kingdom
janner1918;2017-11-30 02:57;1;1;"I reckon I am a few feet below that waterline now lol I have been researching so much over the past few years since I had to retire.";;;;"936142130636120065";https://twitter.com/janner1918/status/936142130636120065;;England, United Kingdom,Pacific Time (US & Canada),England, United Kingdom
janner1918;2017-11-30 02:46;0;1;"The top part represents what we know about this world and everything in it....The bottom part resembles what we do not know ! pic.twitter.com/nf9av2XiJy";;;;"936139339318419456";https://twitter.com/janner1918/status/936139339318419456;;England, United Kingdom,Pacific Time (US & Canada),England, United Kingdom
janner1918;2017-11-30 02:00;1;1;"They are very clear seeing as the Moon is nearly 3,900 miles Ian lol...How wrong can NASA get !....They take us all for fools. I'm wide awake to http:// Ian.lol";;;;"936127845017051136";https://twitter.com/janner1918/status/936127845017051136;;England, United Kingdom,Pacific Time (US & Canada),England, United Kingdom
janner1918;2017-11-30 01:53;0;0;"So please tell me why I can see the Plymouth Hoe foreshore when I am out fishing by the Eddystone Lighthouse which is 15 miles from the Hoe ! By your globe calculator I should not see any of it !!";;;;"936126094763229184";https://twitter.com/janner1918/status/936126094763229184;;England, United Kingdom,Pacific Time (US & Canada),England, United Kingdom
janner1918;2017-11-30 01:47;0;0;"Where's Tasmania ! .... They have lost Tasmania, Oh ! http:// dear.lol";;;;"936124511006666752";https://twitter.com/janner1918/status/936124511006666752;;England, United Kingdom,Pacific Time (US & Canada),England, United Kingdom
janner1918;2017-11-28 14:36;0;1;"@FlatearthBo Hi Papa, had to block Mike ,he was getting, shall we say a little overheated lol";;@FlatearthBo;;"935593347216965633";https://twitter.com/janner1918/status/935593347216965633;;England, United Kingdom,Pacific Time (US & Canada),England, United Kingdom
janner1918;2017-11-28 14:30;0;1;"And those who refuse to research before damning anything are damned already. Goodnight Mike.";;;;"935591691595239425";https://twitter.com/janner1918/status/935591691595239425;;England, United Kingdom,Pacific Time (US & Canada),England, United Kingdom
janner1918;2017-11-28 14:26;1;2;"I watched a film last night called "THE CIRCLE " . Quite a good film, has anybody seen it ? I think it was made by an anti- Illuminati film director. As the story line was along those lines. I won't say any more about the film, just say it is worth a watch. pic.twitter.com/7Z9rlOAS81";;;;"935590777631182853";https://twitter.com/janner1918/status/935590777631182853;;England, United Kingdom,Pacific Time (US & Canada),England, United Kingdom
janner1918;2017-11-28 14:17;0;0;"@DiegoU I say the same to you as I said to Mike. How can you dismiss something that is a theory not fact. I know the Creation story looks far fetched to, but it makes more sense then something coming from nothing, doesn't it ?";;@DiegoU;;"935588375091957763";https://twitter.com/janner1918/status/935588375091957763;;England, United Kingdom,Pacific Time (US & Canada),England, United Kingdom
janner1918;2017-11-28 14:12;2;3;"Mike, you seem like a rational man. Why don't you just do a little research. Research if evolution is real then why if we evolved from fish or monkeys, why are there still fish and monkeys ?? Doesn't make sense if we evolved from them. There shouldn't be any...should there ?";;;;"935587314914463746";https://twitter.com/janner1918/status/935587314914463746;;England, United Kingdom,Pacific Time (US & Canada),England, United Kingdom
janner1918;2017-11-28 14:03;0;1;"Papa, they are all owned by the CIA. They know and have records of every citizen on the internet. The why is easy, the who is easy. What is not easy is the when and how. Just keep praying.. .God is in control.";;;;"935584878070034434";https://twitter.com/janner1918/status/935584878070034434;;England, United Kingdom,Pacific Time (US & Canada),England, United Kingdom
janner1918;2017-11-28 13:43;1;1;"When you put your trust in Jesus, no matter what the devil throws at you will miss. Jesus is the one who deflects all the missiles away from you. There is nothing the devil can do that Jesus can't repel. When your Born Again you will be like Him, His Word is a double edged sword pic.twitter.com/aQ4oPqkkOR";;;;"935579984122515457";https://twitter.com/janner1918/status/935579984122515457;;England, United Kingdom,Pacific Time (US & Canada),England, United Kingdom
janner1918;2017-11-28 12:51;0;1;"There is still so much we do not know. I don't even know how big ,what shape, and what size the earth is. Besides not knowing how the Sun and Moon rises and sets, and how the tides really work. I just put my trust in the Lord, because everything works.";;;;"935566869007880192";https://twitter.com/janner1918/status/935566869007880192;;England, United Kingdom,Pacific Time (US & Canada),England, United Kingdom
janner1918;2017-11-28 12:28;0;0;"The Moon has nothing to do with the tides, and there is no such thing as gravity. I think the tides are caused by atmospheric or water pressure deep down in the oceans which somehow cause the tides to ebb and flow.There could be inlets maybe in the ocean floor as well.";;;;"935561034194178050";https://twitter.com/janner1918/status/935561034194178050;;England, United Kingdom,Pacific Time (US & Canada),England, United Kingdom
janner1918;2017-11-28 12:19;1;1;"I was told something new that I never heard before. Maybe some of you know but I didn't. That is there is a Sumerian word for the Garden Of Eden and that word is Edin....and it phrases to " flat plane " interesting yes ?";;;;"935558859095199744";https://twitter.com/janner1918/status/935558859095199744;;England, United Kingdom,Pacific Time (US & Canada),England, United Kingdom
janner1918;2017-11-28 12:09;0;1;"Ah ! GRAVITY !! ....Their God lol";;;;"935556176489730052";https://twitter.com/janner1918/status/935556176489730052;;England, United Kingdom,Pacific Time (US & Canada),England, United Kingdom
janner1918;2017-11-28 06:34;0;0;"@waynemerritt Paul, I wasn't talking to you mate. I was talking to Doctor "know it all" D.....It is he who should get an education, maybe we can teach him together Paul lol";;@waynemerritt;;"935471834857865217";https://twitter.com/janner1918/status/935471834857865217;;England, United Kingdom,Pacific Time (US & Canada),England, United Kingdom
janner1918;2017-11-28 06:25;0;0;"I thought this was a joke, until I read it. ... Our poor kids haven't got a chance have they ?....By the way,,, where's straight on that list ! ??";;;;"935469685629489152";https://twitter.com/janner1918/status/935469685629489152;;England, United Kingdom,Pacific Time (US & Canada),England, United Kingdom
janner1918;2017-11-28 05:44;1;1;"I think it's you that needs to be educated my friend lol";;;;"935459285148020737";https://twitter.com/janner1918/status/935459285148020737;;England, United Kingdom,Pacific Time (US & Canada),England, United Kingdom
janner1918;2017-11-28 05:41;2;1;"So why are there still apes and monkeys today ? Are you trying to say they will turn into human beings one day ? lol";;;;"935458550435991553";https://twitter.com/janner1918/status/935458550435991553;;England, United Kingdom,Pacific Time (US & Canada),England, United Kingdom
janner1918;2017-11-28 05:12;24;27;"RAIL GUNS PROVE A FLAT EARTH......PROJECTILE GOES OVER 5,000 MPH DEAD STRAIGHT TO IT#S TARGET OVER 100 MILES AWAY !! https://www. youtube.com/watch?v=8UKk84 wjBw0 … pic.twitter.com/fL2Kf1QR2b";;;#S;"935451336862203904";https://twitter.com/janner1918/status/935451336862203904;;England, United Kingdom,Pacific Time (US & Canada),England, United Kingdom
janner1918;2017-11-27 18:39;4;7;"pic.twitter.com/7a8jHDfnE7";;;;"935291937371971585";https://twitter.com/janner1918/status/935291937371971585;;England, United Kingdom,Pacific Time (US & Canada),England, United Kingdom