username;date;retweets;favorites;text;geo;mentions;hashtags;id;permalink;place_full_name;location;timezone;profile_location_name
janner1918;2017-12-05 18:38;0;0;"Maybe so, but what I said still stands";;;;"938190901712695296";https://twitter.com/janner1918/status/938190901712695296;;England, United Kingdom,Pacific Time (US & Canada),England, United Kingdom
janner1918;2017-12-05 18:36;0;0;"Oh sorry, I thought you meant it lol";;;;"938190369090662402";https://twitter.com/janner1918/status/938190369090662402;;England, United Kingdom,Pacific Time (US & Canada),England, United Kingdom
janner1918;2017-12-05 18:35;0;0;"Were you being sarcastic ?...I certainly wasn't";;;;"938190079746551808";https://twitter.com/janner1918/status/938190079746551808;;England, United Kingdom,Pacific Time (US & Canada),England, United Kingdom
janner1918;2017-12-05 18:32;0;1;"It's not outside that counts, it's what's inside that matters";;;;"938189382917476352";https://twitter.com/janner1918/status/938189382917476352;;England, United Kingdom,Pacific Time (US & Canada),England, United Kingdom
janner1918;2017-12-05 18:30;0;3;"Well, this has been fun...thanks again to all who follow me, and all those people who have replied and communicated their thoughts to me.....God bless you all and a wish you all a fond Goodnight, till tomorrow pic.twitter.com/WI1FsQMYAI";;;;"938188792535617537";https://twitter.com/janner1918/status/938188792535617537;;England, United Kingdom,Pacific Time (US & Canada),England, United Kingdom
janner1918;2017-12-05 18:26;0;0;"I think you better moderate your language when Jesus comes though lol Colossians 3:8-10 - But now ye also put off all these; anger, wrath, malice, blasphemy, filthy communication out of your mouth.";;;;"938187808669405184";https://twitter.com/janner1918/status/938187808669405184;;England, United Kingdom,Pacific Time (US & Canada),England, United Kingdom
janner1918;2017-12-05 18:21;0;1;"Thanks";;;;"938186536121765889";https://twitter.com/janner1918/status/938186536121765889;;England, United Kingdom,Pacific Time (US & Canada),England, United Kingdom
janner1918;2017-12-05 18:20;0;1;"Don't forget who runs the show in this world....Only for a short time though. pic.twitter.com/OcJq3SBMx4";;;;"938186290494885889";https://twitter.com/janner1918/status/938186290494885889;;England, United Kingdom,Pacific Time (US & Canada),England, United Kingdom
janner1918;2017-12-05 18:16;1;1;"By the way....what do you think of mine ? ..I love it !";;;;"938185259207811077";https://twitter.com/janner1918/status/938185259207811077;;England, United Kingdom,Pacific Time (US & Canada),England, United Kingdom
janner1918;2017-12-05 18:12;0;0;"Yes, we should, after all God made us in His Image and Jesus is man as well as God...I do like it very much.";;;;"938184367582609409";https://twitter.com/janner1918/status/938184367582609409;;England, United Kingdom,Pacific Time (US & Canada),England, United Kingdom
janner1918;2017-12-05 18:10;0;0;"sorry, Freudian slip, that should be could not called lol";;;;"938183850987008000";https://twitter.com/janner1918/status/938183850987008000;;England, United Kingdom,Pacific Time (US & Canada),England, United Kingdom
janner1918;2017-12-05 18:08;1;1;"Great...love it, it shows all the things that are good in this world, maybe you called photo shop the word TRUTH above their hands ,that would look good .";;;;"938183209480871936";https://twitter.com/janner1918/status/938183209480871936;;England, United Kingdom,Pacific Time (US & Canada),England, United Kingdom
janner1918;2017-12-05 18:02;0;0;"I like that";;;;"938181818641272833";https://twitter.com/janner1918/status/938181818641272833;;England, United Kingdom,Pacific Time (US & Canada),England, United Kingdom
janner1918;2017-12-05 17:52;0;0;"Because the original was taken from a science channel. I used Tin Eye to check it. https:// de.sott.net/category/14-sc ience%20 … &?page=1 This was the original pic.twitter.com/8EuJL40bZl";;;;"938179392961998848";https://twitter.com/janner1918/status/938179392961998848;;England, United Kingdom,Pacific Time (US & Canada),England, United Kingdom
janner1918;2017-12-05 17:28;0;1;"Too much like the Hippie signs of " FREE LOVE "from the nineteen sixties, you want something unique, something that will catch people's eyes and give the right message. I fear this could give people the wrong message.";;;;"938173261615124481";https://twitter.com/janner1918/status/938173261615124481;;England, United Kingdom,Pacific Time (US & Canada),England, United Kingdom
janner1918;2017-12-05 17:20;2;2;"It's about time the land that was stolen from these people was returned to them. They were never treated right by any nation that invaded their lands, decimated their ancestors and their buffalo herds. I for one ,feel ashamed of my forefathers who sailed from Plymouth to America.";;;;"938171177545105409";https://twitter.com/janner1918/status/938171177545105409;;England, United Kingdom,Pacific Time (US & Canada),England, United Kingdom
janner1918;2017-12-05 17:12;1;0;"The truth is majority of people on this earth follow Satan. Some knowingly , the majority unknowingly. These are the people that are at risk to Satan's follies. These are the people who believe in God but not the way they should. As Born Again believers we have to educate them. pic.twitter.com/6emGWMYG1p";;;;"938169328427520001";https://twitter.com/janner1918/status/938169328427520001;;England, United Kingdom,Pacific Time (US & Canada),England, United Kingdom
janner1918;2017-12-05 16:45;0;0;"Yes I know Lucy love, it could well have been September the 11th, and we all know what happened then. Coincidence, or did Satan plan it that way so September 11th would be remembered for the atrocities that took place and not our Lord's birth. I believe he planned it that way.";;;;"938162461869568001";https://twitter.com/janner1918/status/938162461869568001;;England, United Kingdom,Pacific Time (US & Canada),England, United Kingdom
janner1918;2017-12-05 15:48;0;1;"pic.twitter.com/8VIDY62ATs";;;;"938148002400821248";https://twitter.com/janner1918/status/938148002400821248;;England, United Kingdom,Pacific Time (US & Canada),England, United Kingdom
janner1918;2017-12-05 15:37;0;1;"I only eat REAL food lol pic.twitter.com/jbp0QT5fa2";;;;"938145273532112896";https://twitter.com/janner1918/status/938145273532112896;;England, United Kingdom,Pacific Time (US & Canada),England, United Kingdom
janner1918;2017-12-05 14:30;1;4;"First it was Global warming, then it was Climate Change ...what ,I wonder will be the next false hypothesis for this worldly lie to frighten the masses be ? !";;;;"938128520290750464";https://twitter.com/janner1918/status/938128520290750464;;England, United Kingdom,Pacific Time (US & Canada),England, United Kingdom
janner1918;2017-12-05 14:11;0;3;"Brilliant Deejay...I love it Ha Ha Ha";;;;"938123663806816256";https://twitter.com/janner1918/status/938123663806816256;;England, United Kingdom,Pacific Time (US & Canada),England, United Kingdom
janner1918;2017-12-05 14:06;0;0;"Isn't that Terry Griffith s of snooker fame lol";;;;"938122403867250688";https://twitter.com/janner1918/status/938122403867250688;;England, United Kingdom,Pacific Time (US & Canada),England, United Kingdom
janner1918;2017-12-05 13:56;0;0;"They are all demons love...not aliens, there are no such beings as aliens. We are alone in this created dome...only God is with us.";;;;"938119790161547264";https://twitter.com/janner1918/status/938119790161547264;;England, United Kingdom,Pacific Time (US & Canada),England, United Kingdom
janner1918;2017-12-05 13:50;0;0;"This is all nonsense, they are only asking for a cake to be baked there is no sin being committed here. It's just a cake, bake it.And I have been a Born Again Christian for over 40 years, things like this silly behavior give Christians a bad press.";;;;"938118399531548672";https://twitter.com/janner1918/status/938118399531548672;;England, United Kingdom,Pacific Time (US & Canada),England, United Kingdom
janner1918;2017-12-05 13:39;0;1;"You will never find one !...People are too greedy, they always want more !";;;;"938115684776796161";https://twitter.com/janner1918/status/938115684776796161;;England, United Kingdom,Pacific Time (US & Canada),England, United Kingdom
janner1918;2017-12-05 13:37;1;6;"Nah, water is always level, so it cannot be that shape it has to be flat.";;;;"938115206252847110";https://twitter.com/janner1918/status/938115206252847110;;England, United Kingdom,Pacific Time (US & Canada),England, United Kingdom
janner1918;2017-12-05 13:24;0;1;"Will The Real Image Please Stand Up ! pic.twitter.com/jiEw5mXE3s";;;;"938111882476564482";https://twitter.com/janner1918/status/938111882476564482;;England, United Kingdom,Pacific Time (US & Canada),England, United Kingdom
janner1918;2017-12-05 12:52;1;1;"Love not hate this Christmas. Treat everybody like you want to be treated, walk with a smile on your face and love in your heart. Celebrate the love within you that is Jesus Christ, and rejoice in the favor of our Lord. pic.twitter.com/7VmiyupvZ8";;;;"938103900174987265";https://twitter.com/janner1918/status/938103900174987265;;England, United Kingdom,Pacific Time (US & Canada),England, United Kingdom
janner1918;2017-12-05 12:47;1;1;"THE ONLY GIFT WORTH HAVING FOR LIFE.. pic.twitter.com/3crV2HKX0C";;;;"938102496597303296";https://twitter.com/janner1918/status/938102496597303296;;England, United Kingdom,Pacific Time (US & Canada),England, United Kingdom
janner1918;2017-12-05 12:45;2;2;"JESUS IS ALIVE AND WAITING TO GIVE YOU ETERNAL LIFE.. pic.twitter.com/A2W2O1obdH";;;;"938102129969041408";https://twitter.com/janner1918/status/938102129969041408;;England, United Kingdom,Pacific Time (US & Canada),England, United Kingdom
janner1918;2017-12-05 12:28;3;4;"IF ONLY PEOPLE REALIZED HOW GREAT A GIFT THIS IS ... pic.twitter.com/372b1B5qYR";;;;"938097671469977601";https://twitter.com/janner1918/status/938097671469977601;;England, United Kingdom,Pacific Time (US & Canada),England, United Kingdom
janner1918;2017-12-05 12:05;6;3;"TIME to get real folks..TIME is nearly up. TIME is coming to an end. TIME to find the TRUTH. And the TRUTH will set you FREE. JESUS is the WAY, the TRUTH and the LIFE.Find him while you still can. HE is coming SOON. pic.twitter.com/de0HS7IWFI";;;;"938091984136306690";https://twitter.com/janner1918/status/938091984136306690;;England, United Kingdom,Pacific Time (US & Canada),England, United Kingdom
janner1918;2017-12-05 11:18;2;3;"What we are doing is right. Keep telling the truth and people will start to listen. It may seem pointless as no body seems to listen, but eventually they will see the truth for themselves. So persevere my friends, we know God wins in the end. All we got to do is run the race. pic.twitter.com/Tatpm2uGSS";;;;"938080213686251520";https://twitter.com/janner1918/status/938080213686251520;;England, United Kingdom,Pacific Time (US & Canada),England, United Kingdom
janner1918;2017-12-05 11:04;1;2;"THE LOVE OF MONEY IS THE ROOT OF ALL EVIL";;;;"938076619595542529";https://twitter.com/janner1918/status/938076619595542529;;England, United Kingdom,Pacific Time (US & Canada),England, United Kingdom
janner1918;2017-12-05 11:02;0;1;"pic.twitter.com/W17kXLf8CC";;;;"938076020623757312";https://twitter.com/janner1918/status/938076020623757312;;England, United Kingdom,Pacific Time (US & Canada),England, United Kingdom
janner1918;2017-12-05 10:53;4;4;"Sounds a bit like Vatican City, I wonder if there are satanic relics there from Babylon. We now a lot goes on which the general public are not aware of. We also know the Freemasons designed it in Luciferian symbols, so could this be where Satan resides ?, Just a thought. pic.twitter.com/4v8A57ppca";;;;"938073743213191169";https://twitter.com/janner1918/status/938073743213191169;;England, United Kingdom,Pacific Time (US & Canada),England, United Kingdom
janner1918;2017-12-04 22:56;0;0;"People got short memories these days must be all the poison their feeding us. That, and those 5G microwave towers frying our brains. So I can understand why our memories are so short.";;;;"937893455732396032";https://twitter.com/janner1918/status/937893455732396032;;England, United Kingdom,Pacific Time (US & Canada),England, United Kingdom
janner1918;2017-12-04 22:11;0;1;"I suppose it is John, but as you know my friend...the truth always hurts.";;;;"937881977000165376";https://twitter.com/janner1918/status/937881977000165376;;England, United Kingdom,Pacific Time (US & Canada),England, United Kingdom
janner1918;2017-12-04 22:09;0;0;"I'll have that cup of coffee now lol";;;;"937881506365825030";https://twitter.com/janner1918/status/937881506365825030;;England, United Kingdom,Pacific Time (US & Canada),England, United Kingdom
janner1918;2017-12-04 21:57;1;0;"Yes, The End Times are definitely here ! https:// twitter.com/janner1918/sta tus/931712389438898176 …";;;;"937878456297238539";https://twitter.com/janner1918/status/937878456297238539;;England, United Kingdom,Pacific Time (US & Canada),England, United Kingdom
janner1918;2017-12-04 21:48;1;0;"I do hope this poor girl is home for Christmas https:// twitter.com/KimKardashian/ status/933001503123554304 …";;;;"937876310696845313";https://twitter.com/janner1918/status/937876310696845313;;England, United Kingdom,Pacific Time (US & Canada),England, United Kingdom
janner1918;2017-12-04 21:43;0;1;"Yes, my friend must have other interests besides truth. You could go insane else, and I am not joking. Your going to laugh at this, especially me being a 65 year old man, but when I am not concentrating on our Lord's truth then I play computer games lol. It relaxes me completely";;;;"937874948810518529";https://twitter.com/janner1918/status/937874948810518529;;England, United Kingdom,Pacific Time (US & Canada),England, United Kingdom
janner1918;2017-12-04 13:23;0;1;"pic.twitter.com/H1IKgxpXQa";;;;"937749177404219393";https://twitter.com/janner1918/status/937749177404219393;;England, United Kingdom,Pacific Time (US & Canada),England, United Kingdom
janner1918;2017-12-04 13:17;1;1;"To be honest ,I'm not sure really, firms would lie just to get business. There is no way of knowing whether they are telling the truth or not.";;;;"937747697485873154";https://twitter.com/janner1918/status/937747697485873154;;England, United Kingdom,Pacific Time (US & Canada),England, United Kingdom
janner1918;2017-12-04 12:48;0;0;"Nah, Not a patch on the real thing man lol THAT WILL NEVER CATCH ON lol";;;;"937740300663033857";https://twitter.com/janner1918/status/937740300663033857;;England, United Kingdom,Pacific Time (US & Canada),England, United Kingdom
janner1918;2017-12-04 12:43;1;1;"Nope !...They go in a dead straight line to their target at over 5,000 miles per hour. I don't think they would have time to curl do you ? lol";;;;"937739159355224065";https://twitter.com/janner1918/status/937739159355224065;;England, United Kingdom,Pacific Time (US & Canada),England, United Kingdom
janner1918;2017-12-04 12:40;0;1;"He would like nice in a prison uniform as well pic.twitter.com/7GA3hHUYjT";;;;"937738281961345024";https://twitter.com/janner1918/status/937738281961345024;;England, United Kingdom,Pacific Time (US & Canada),England, United Kingdom
janner1918;2017-12-04 12:20;2;4;"It's a beautiful world.....If you can afford to live in it ! Help The Homeless This Christmas...Give 'em a treat pic.twitter.com/QwDKpWQ6M1";;;;"937733319034318854";https://twitter.com/janner1918/status/937733319034318854;;England, United Kingdom,Pacific Time (US & Canada),England, United Kingdom
janner1918;2017-12-04 12:08;1;2;"IS SHE WHERE SHE BELONGS YET ? pic.twitter.com/nHBCL6xjch";;;;"937730229749022720";https://twitter.com/janner1918/status/937730229749022720;;England, United Kingdom,Pacific Time (US & Canada),England, United Kingdom
janner1918;2017-12-04 11:43;1;2;"I believe we are living in the most immoral time in history. Even worse then Sodom & Gomorrah ! ..God will not stand for this immorality much longer ! pic.twitter.com/bzj2N3NhkP";;;;"937723956781617153";https://twitter.com/janner1918/status/937723956781617153;;England, United Kingdom,Pacific Time (US & Canada),England, United Kingdom
janner1918;2017-12-04 11:35;1;1;"Don't think this helps...do you ? pic.twitter.com/Ov0l9Ypgn1";;;;"937722009869578240";https://twitter.com/janner1918/status/937722009869578240;;England, United Kingdom,Pacific Time (US & Canada),England, United Kingdom
janner1918;2017-12-04 11:14;0;1;"I don't use language like that, and I prefer not to see so...Goodbye have a nice life.";;;;"937716864112832512";https://twitter.com/janner1918/status/937716864112832512;;England, United Kingdom,Pacific Time (US & Canada),England, United Kingdom
janner1918;2017-12-04 10:54;0;0;"I would call this sluttish behavior, an insult to beauty and feminism";;;;"937711792243003393";https://twitter.com/janner1918/status/937711792243003393;;England, United Kingdom,Pacific Time (US & Canada),England, United Kingdom
janner1918;2017-12-04 09:57;0;0;"Seems like Jared has lost his pen guys....he hasn't replied to me";;;;"937697325492920320";https://twitter.com/janner1918/status/937697325492920320;;England, United Kingdom,Pacific Time (US & Canada),England, United Kingdom
janner1918;2017-12-04 09:43;0;0;"Sorry about the caps my caps lock key got stuck, I have managed to free it now. But why did you use a different picture for your explanation ?. NASA said that first picture was real , so why did you use another picture please ?";;;;"937693809684729857";https://twitter.com/janner1918/status/937693809684729857;;England, United Kingdom,Pacific Time (US & Canada),England, United Kingdom
janner1918;2017-12-04 09:01;0;4;"You didn't use the same picture anyway...what are you afraid of ?? ...Are you afraid we might be right .";;;;"937683185474957313";https://twitter.com/janner1918/status/937683185474957313;;England, United Kingdom,Pacific Time (US & Canada),England, United Kingdom
janner1918;2017-12-04 08:58;2;5;"IF THE EARTH IS AS BIG AS SCIENTISTS SAY IT IS THEN THIS CURVE IS WAY OUT . IT WOULD BE HARDLY NOTICEABLE AT ALL...IF THIS WAS REAL OF COURSE pic.twitter.com/6MdHEIFmgD";;;;"937682632762159104";https://twitter.com/janner1918/status/937682632762159104;;England, United Kingdom,Pacific Time (US & Canada),England, United Kingdom
janner1918;2017-12-04 07:19;0;0;"WHY MAKE A FLAT EARTH MAP IF THE EARTH IS NOT FLAT !!....MAKES NO SENSE !";;;;"937657492275900417";https://twitter.com/janner1918/status/937657492275900417;;England, United Kingdom,Pacific Time (US & Canada),England, United Kingdom
janner1918;2017-12-04 06:51;0;1;"pic.twitter.com/vm7WiCGi2W";;;;"937650623662710784";https://twitter.com/janner1918/status/937650623662710784;;England, United Kingdom,Pacific Time (US & Canada),England, United Kingdom
janner1918;2017-12-04 06:47;1;1;"REMEMBER THIS ?.....NO FALSE FLAG HERE, JUST MUD AND GRIEF I WILL NEVER FORGET IT pic.twitter.com/vae95XtBQ5";;;;"937649610302029824";https://twitter.com/janner1918/status/937649610302029824;;England, United Kingdom,Pacific Time (US & Canada),England, United Kingdom
janner1918;2017-12-04 06:39;0;2;"IT'S A CERTAINTY !...AND I WOULDN'T BE SURPRISED IF IT'S A BIG ONE PROJECT BLUE BEAM PERHAPS ? pic.twitter.com/oMej2sLcvz";;;;"937647452823478272";https://twitter.com/janner1918/status/937647452823478272;;England, United Kingdom,Pacific Time (US & Canada),England, United Kingdom
janner1918;2017-12-04 06:22;3;2;"Start off easy , find out about NASA . There is enough information there to keep you going for years. Facts not fiction my friend, just let your mind be open to the truth. It's gonna hurt but all real truth does.";;;;"937643334432182272";https://twitter.com/janner1918/status/937643334432182272;;England, United Kingdom,Pacific Time (US & Canada),England, United Kingdom
janner1918;2017-12-04 06:07;3;11;"Before you start making bold statements like that, do a little research, I was fooled for over 60 years. I couldn't believe that my education was false and all lies, but it was. You see, I tried to debunk the flat earth, and I couldn't. Let me see you try ? https:// twitter.com/rickygervais/s tatus/937038641184067584 …";;;;"937639411570954240";https://twitter.com/janner1918/status/937639411570954240;;England, United Kingdom,Pacific Time (US & Canada),England, United Kingdom
janner1918;2017-12-04 04:21;3;3;"HA !...I THOUGHT THIS LOOKED FAMILIAR !! pic.twitter.com/ZQNkYNbZwA";;;;"937612893897576448";https://twitter.com/janner1918/status/937612893897576448;;England, United Kingdom,Pacific Time (US & Canada),England, United Kingdom
janner1918;2017-12-04 04:15;0;3;"And a partridge in a pear tree";;;;"937611357641469952";https://twitter.com/janner1918/status/937611357641469952;;England, United Kingdom,Pacific Time (US & Canada),England, United Kingdom
janner1918;2017-12-04 04:08;0;2;"Hello,Hello,Hello...What's goin' on 'ere then ?";;;;"937609650236739584";https://twitter.com/janner1918/status/937609650236739584;;England, United Kingdom,Pacific Time (US & Canada),England, United Kingdom
janner1918;2017-12-04 04:05;1;4;"DON'T PUT ALL THE BLAME ON THIS GUY. HE'S JUST ANOTHER PATSY...HERE'S THE REAL CULPRIT ! pic.twitter.com/3zoDNCoFkU";;;;"937608886793719809";https://twitter.com/janner1918/status/937608886793719809;;England, United Kingdom,Pacific Time (US & Canada),England, United Kingdom
janner1918;2017-12-04 03:37;0;0;"I wasn't referring to Wings, on reflection maybe I should have made it clearer that I was referring to the SNP and not Wings. My apologies for that I didn't mean to put any slur on Wings at all. I know he just tweeted it";;;;"937601720573747202";https://twitter.com/janner1918/status/937601720573747202;;England, United Kingdom,Pacific Time (US & Canada),England, United Kingdom
janner1918;2017-12-04 03:25;1;0;"GOD WILL NOT BE HAPPY ! pic.twitter.com/46F5y9JvDJ";;;;"937598769834659841";https://twitter.com/janner1918/status/937598769834659841;;England, United Kingdom,Pacific Time (US & Canada),England, United Kingdom
janner1918;2017-12-04 03:16;0;0;"Aye, but don't forget the Sabbath is on Saturday and not Sunday !";;;;"937596526850842625";https://twitter.com/janner1918/status/937596526850842625;;England, United Kingdom,Pacific Time (US & Canada),England, United Kingdom
janner1918;2017-12-04 03:13;0;0;"If you cannot see where I'm going with this then you cannot be reading the KJV bible. Aye, that's the one sponsored by your King James IV. By allowing gay marriages in the church you are condoning sodomy which is a sin and should not be allowed in the house of God.";;;;"937595816713256961";https://twitter.com/janner1918/status/937595816713256961;;England, United Kingdom,Pacific Time (US & Canada),England, United Kingdom
janner1918;2017-12-04 02:30;2;7;"IS THE EARTH ALL WATER NOW !....I KNOW IT'S 71% WATER....BUT SURELY THERE MUST BE SOME LAND SHOWING ? ...THAT'S IF THIS IS REAL OF COURSE. NASA WOULDN'T FAKE IT , WOULD THEY ?? lol";;;;"937584960952602624";https://twitter.com/janner1918/status/937584960952602624;;England, United Kingdom,Pacific Time (US & Canada),England, United Kingdom
janner1918;2017-12-04 01:38;1;0;"AT THE NAME OF JESUS EVERY KNEE SHALL BOW LET EVERY TONGUE CONFESS HIM KING OF GLORY NOW pic.twitter.com/0YIozdazVI";;;;"937571726153658368";https://twitter.com/janner1918/status/937571726153658368;;England, United Kingdom,Pacific Time (US & Canada),England, United Kingdom
janner1918;2017-12-04 01:32;1;0;"pic.twitter.com/DBsYy789a4";;;;"937570377320009733";https://twitter.com/janner1918/status/937570377320009733;;England, United Kingdom,Pacific Time (US & Canada),England, United Kingdom
janner1918;2017-12-04 01:30;1;1;"THE REAL REASON FOR CHRISTMAS pic.twitter.com/Wp0yF8h6o8";;;;"937569787751919617";https://twitter.com/janner1918/status/937569787751919617;;England, United Kingdom,Pacific Time (US & Canada),England, United Kingdom
janner1918;2017-12-04 00:56;2;1;"GO ON !.....MAKE SOME ONE'S CHRISTMAS A HAPPY ONE GIVE 'EM WATER FOR LIFE....ONLY £100 FOR FIVE OF THESE FILTERS YOU NEVER KNOW YOU COULD BE SAVING LIVES. pic.twitter.com/JEf61QAUhz";;;;"937561347600068608";https://twitter.com/janner1918/status/937561347600068608;;England, United Kingdom,Pacific Time (US & Canada),England, United Kingdom
janner1918;2017-12-04 00:25;2;0;"OF COURSE SHE IS ! pic.twitter.com/E5bB5QZRhh";;;;"937553342292791296";https://twitter.com/janner1918/status/937553342292791296;;England, United Kingdom,Pacific Time (US & Canada),England, United Kingdom
janner1918;2017-12-04 00:19;0;0;"Oh Dear....Now you have sold your soul to the devil as well. pic.twitter.com/TIG3xlLW1Y";;;;"937552010097909761";https://twitter.com/janner1918/status/937552010097909761;;England, United Kingdom,Pacific Time (US & Canada),England, United Kingdom
janner1918;2017-12-04 00:04;0;0;"They are only figureheads now, the Queen will not worry as she is part of the elite and she will either be one of the leaders for the New World Order one world government until she dies, if she lives it still will not matter as this one world system will be implemented soon pic.twitter.com/rRZIibDL0H";;;;"937548124280819712";https://twitter.com/janner1918/status/937548124280819712;;England, United Kingdom,Pacific Time (US & Canada),England, United Kingdom
janner1918;2017-12-03 23:55;0;0;"@susan_bell1212 Yeah, It's lovely isn't it Susan, one of the best memes I've found";;@susan_bell1212;;"937545921742753792";https://twitter.com/janner1918/status/937545921742753792;;England, United Kingdom,Pacific Time (US & Canada),England, United Kingdom
janner1918;2017-12-03 23:43;1;3;"I AM A SOLDIER FOR JESUS pic.twitter.com/KaN3cS1Xnl";;;;"937542946093748226";https://twitter.com/janner1918/status/937542946093748226;;England, United Kingdom,Pacific Time (US & Canada),England, United Kingdom
