username;date;retweets;favorites;text;geo;mentions;hashtags;id;permalink;place_full_name;location;timezone;profile_location_name
janner1918;2017-12-07 00:30;0;1;"This is scary, I think I would be driving the other way !";;;;"938641850247806976";https://twitter.com/janner1918/status/938641850247806976;;England, United Kingdom,Pacific Time (US & Canada),England, United Kingdom
janner1918;2017-12-07 00:27;1;0;"WHICH ONE ARE YOU SHAKING HANDS WITH ? pic.twitter.com/mrNyW02gE4";;;;"938641023265398784";https://twitter.com/janner1918/status/938641023265398784;;England, United Kingdom,Pacific Time (US & Canada),England, United Kingdom
janner1918;2017-12-07 00:17;0;0;"Why has it taken them this long to reveal these accusations ??";;;;"938638616133238784";https://twitter.com/janner1918/status/938638616133238784;;England, United Kingdom,Pacific Time (US & Canada),England, United Kingdom
janner1918;2017-12-07 00:10;0;1;"I see, so the river Nile goes uphill ? How can that happen when water is always flat ? pic.twitter.com/sXEVc9dkuT";;;;"938636760996868096";https://twitter.com/janner1918/status/938636760996868096;;England, United Kingdom,Pacific Time (US & Canada),England, United Kingdom
janner1918;2017-12-07 00:02;0;0;"Get fit soon Alberto, you have been a real asset this season. You have proved how good you are, and we want you back as soon as possible....Y.N.W.A. pic.twitter.com/HAu72HfZ7r";;;;"938634837778460672";https://twitter.com/janner1918/status/938634837778460672;;England, United Kingdom,Pacific Time (US & Canada),England, United Kingdom
janner1918;2017-12-06 23:47;0;0;"By the way it's the plane not the planet, the earth is flat";;;;"938631135638315008";https://twitter.com/janner1918/status/938631135638315008;;England, United Kingdom,Pacific Time (US & Canada),England, United Kingdom
janner1918;2017-12-06 23:44;0;0;"Your absolutely right, they don't care . They have no conscious. They serve the devil knowingly and without question. Greed is their motive and power their goal, absolute power for their master.";;;;"938630335880925184";https://twitter.com/janner1918/status/938630335880925184;;England, United Kingdom,Pacific Time (US & Canada),England, United Kingdom
janner1918;2017-12-06 23:10;1;3;"This is where the world is at this moment in time, will it go over the brink or will it jump over the gap and recognize Jesus as the Son of God. Only time will tell, as God pours out His Spirit upon the earth. pic.twitter.com/QWFaDZ14fx";;;;"938621678237704192";https://twitter.com/janner1918/status/938621678237704192;;England, United Kingdom,Pacific Time (US & Canada),England, United Kingdom
janner1918;2017-12-06 20:12;0;2;"Good night my brothers & sisters and friends. Been a good day...but a long one. Looking forward to some rest now ...God bless, keep serving the Lord by dishing out truth...till later bye. pic.twitter.com/z7xm4bviVi";;;;"938576929384550406";https://twitter.com/janner1918/status/938576929384550406;;England, United Kingdom,Pacific Time (US & Canada),England, United Kingdom
janner1918;2017-12-06 17:51;0;0;"Thank you Kathy, I could do with a hug at this moment, ...been a long day";;;;"938541441315459075";https://twitter.com/janner1918/status/938541441315459075;;England, United Kingdom,Pacific Time (US & Canada),England, United Kingdom
janner1918;2017-12-06 17:45;0;0;"Watch out for the Shills & Trolls Stacey love, there is loads about";;;;"938539846716534786";https://twitter.com/janner1918/status/938539846716534786;;England, United Kingdom,Pacific Time (US & Canada),England, United Kingdom
janner1918;2017-12-06 17:41;0;0;"ESPECIALLY THE REDS ..... Y.N.W.A. pic.twitter.com/jsXobMf0qc";;;;"938538985852489728";https://twitter.com/janner1918/status/938538985852489728;;England, United Kingdom,Pacific Time (US & Canada),England, United Kingdom
janner1918;2017-12-06 17:40;0;0;"WELL +++ DONE +++ YOU +++ LADS pic.twitter.com/2Wm1TaORKz";;;;"938538607501037568";https://twitter.com/janner1918/status/938538607501037568;;England, United Kingdom,Pacific Time (US & Canada),England, United Kingdom
janner1918;2017-12-06 17:32;0;0;"GREAT. 5 ENGLISH TEAMS STILL IN THE CHAMPIONS LEAGUE DOING WELL LADS, LETS HAVE TWO ENGLISH TEAMS IN THE FINAL THAT WOULD BE FANTASTIC !";;;;"938536618650210304";https://twitter.com/janner1918/status/938536618650210304;;England, United Kingdom,Pacific Time (US & Canada),England, United Kingdom
janner1918;2017-12-06 17:17;0;0;"We don't owe them a penny ! We have paid a fortune to them since 1978 and received little back. Let's just leave with our heads held high and our money in our pockets. The European leaders are acting like spoiled brats who have tossed their toys out of the pram. Let's just go...";;;;"938532777938571266";https://twitter.com/janner1918/status/938532777938571266;;England, United Kingdom,Pacific Time (US & Canada),England, United Kingdom
janner1918;2017-12-06 17:08;1;1;"That's lovely, thanks for making my day complete";;;;"938530515254202373";https://twitter.com/janner1918/status/938530515254202373;;England, United Kingdom,Pacific Time (US & Canada),England, United Kingdom
janner1918;2017-12-06 16:58;2;1;"That's interesting, Putin is on the phone talking to the Palestinians. Yeah, it's all happening now, the s**t is just about to hit the fan. We are on the precipice of World War III . pic.twitter.com/fjSXZhrhFx";;;;"938528132931481602";https://twitter.com/janner1918/status/938528132931481602;;England, United Kingdom,Pacific Time (US & Canada),England, United Kingdom
janner1918;2017-12-06 16:36;0;1;"I believe this is referring to the tower of Babel, where God dispersed the nations under different languages and there was not enough workers left to finish building the tower. There is a similar tower in Europe the European Union H.Q. could it be that more nations will leave ?";;;;"938522509233844224";https://twitter.com/janner1918/status/938522509233844224;;England, United Kingdom,Pacific Time (US & Canada),England, United Kingdom
janner1918;2017-12-06 16:30;0;0;"Liverpool F. C. 7 Spartak Moscow 0 what a massacre !";;;;"938520999489875968";https://twitter.com/janner1918/status/938520999489875968;;England, United Kingdom,Pacific Time (US & Canada),England, United Kingdom
janner1918;2017-12-06 16:24;0;0;"Liverpool F.C. 6 v Sparta k Moscow 0....Great Stuff Reds..Coutinho Hat Trick...still 10 mins to go";;;;"938519515398328320";https://twitter.com/janner1918/status/938519515398328320;;England, United Kingdom,Pacific Time (US & Canada),England, United Kingdom
janner1918;2017-12-06 16:20;0;1;"From what I can gather from history Assyria is in either Northern Iraq or Iran, so it could well be Iran or the Kurds, but it looks like he will die in a great battle possibly with Israel. Sorry I cannot be more precise, but history or scripture isn't very clear about this topic";;;;"938518584275472384";https://twitter.com/janner1918/status/938518584275472384;;England, United Kingdom,Pacific Time (US & Canada),England, United Kingdom
janner1918;2017-12-06 16:13;0;1;"Good question, let me do some research and I'll get back to you on that.";;;;"938516798168797187";https://twitter.com/janner1918/status/938516798168797187;;England, United Kingdom,Pacific Time (US & Canada),England, United Kingdom
janner1918;2017-12-06 16:09;0;0;"Hi, I'm not sure, according to the book of Revelations there is three and a half years of peace then three and a half years of great tribulation. The site of the original temple is outside the city. I am wondering if this is where the new American Embassy will be. All speculation";;;;"938515736502374400";https://twitter.com/janner1918/status/938515736502374400;;England, United Kingdom,Pacific Time (US & Canada),England, United Kingdom
janner1918;2017-12-06 15:52;2;4;"Hi Guys, Expect things to escalate now. Russia will be first to condemn the recognized state , then expect the Arab Nations to follow suit. There could be a coalition or pact between all these nations to attack Israel. Not sure how Trump will react, he may reject Israel who knows pic.twitter.com/k5OplkD3q3";;;;"938511516466327565";https://twitter.com/janner1918/status/938511516466327565;;England, United Kingdom,Pacific Time (US & Canada),England, United Kingdom
janner1918;2017-12-06 14:59;11;11;"Donald Trump has set the book of Revelations into overdrive. Expect things to happen fast now. There will be a great deal of condemnation because of the recognition of Jerusalem as the capital of Israel. Forces will be formed to come against Israel, how long , I don't know pic.twitter.com/a4Lz1fx5Ns";;;;"938498249794707456";https://twitter.com/janner1918/status/938498249794707456;;England, United Kingdom,Pacific Time (US & Canada),England, United Kingdom
janner1918;2017-12-06 14:37;0;1;"Hey calm down ..Don't you realize this has to happen before Jesus comes back again. That's why He wept ,He could see the future, that's why He went and died for us, so those who believe can be free from this terrible time which is yet to come. Trust God He knows what He's doing.";;;;"938492577254379521";https://twitter.com/janner1918/status/938492577254379521;;England, United Kingdom,Pacific Time (US & Canada),England, United Kingdom
janner1918;2017-12-06 14:10;0;2;"I just bought my Grand son a football like that for Christmas ! lol........Shh don't tell him, he thinks santa is delivering it lol";;;;"938485902942359552";https://twitter.com/janner1918/status/938485902942359552;;England, United Kingdom,Pacific Time (US & Canada),England, United Kingdom
janner1918;2017-12-06 14:06;2;2;"Donald Trump fulfills bible prophecy ! Wait for s**t to hit the fan now pic.twitter.com/XPndVyNEv9";;;;"938484768894799872";https://twitter.com/janner1918/status/938484768894799872;;England, United Kingdom,Pacific Time (US & Canada),England, United Kingdom
janner1918;2017-12-06 13:30;1;0;"Ha Ha I like you Chelsea.";;;;"938475640684273664";https://twitter.com/janner1918/status/938475640684273664;;England, United Kingdom,Pacific Time (US & Canada),England, United Kingdom
janner1918;2017-12-06 13:26;1;0;"I love the people Chelsea, they are lovely, it's the evil powers behind the military and government I hate. I knew all about the true Jews Chelsea, I have done a great deal of research into all so called conspiracies.";;;;"938474728859332608";https://twitter.com/janner1918/status/938474728859332608;;England, United Kingdom,Pacific Time (US & Canada),England, United Kingdom
janner1918;2017-12-06 13:19;1;0;"I know the feeling....al the hairs on my body are standing on end, and I am not joking";;;;"938472863539126272";https://twitter.com/janner1918/status/938472863539126272;;England, United Kingdom,Pacific Time (US & Canada),England, United Kingdom
janner1918;2017-12-06 13:16;1;0;"I think your as excited as I am lol...calm down girl";;;;"938472129653297154";https://twitter.com/janner1918/status/938472129653297154;;England, United Kingdom,Pacific Time (US & Canada),England, United Kingdom
janner1918;2017-12-06 12:33;0;1;"pic.twitter.com/rzDqvjbS2R";;;;"938461395917721603";https://twitter.com/janner1918/status/938461395917721603;;England, United Kingdom,Pacific Time (US & Canada),England, United Kingdom
janner1918;2017-12-06 12:27;1;0;"Go away Paul...Your just trolling";;;;"938459863075704833";https://twitter.com/janner1918/status/938459863075704833;;England, United Kingdom,Pacific Time (US & Canada),England, United Kingdom
janner1918;2017-12-06 12:22;1;0;"Duh !...How much proof do you need ?? pic.twitter.com/j6BdsLwmPE";;;;"938458587910860800";https://twitter.com/janner1918/status/938458587910860800;;England, United Kingdom,Pacific Time (US & Canada),England, United Kingdom
janner1918;2017-12-06 12:17;0;1;"The Truth is God made woman to be man's partner to marry, to have children , and to populate the earth. Without discrimination of any kind to race , color or culture . God made the human race for love to take care of this earth, and to love Him as He loves us, without fear.";;;;"938457426789064704";https://twitter.com/janner1918/status/938457426789064704;;England, United Kingdom,Pacific Time (US & Canada),England, United Kingdom
janner1918;2017-12-06 12:08;3;2;"What is Transgender ? Transgender was instigated by the devil to impersonate the truth of God's creation. God made man, then took a rib from man and made woman. God made woman to be a helper for mankind. God said it was good, if it's good enough for God it's good enough for me pic.twitter.com/xHoBqXQIDt";;;;"938455147541417984";https://twitter.com/janner1918/status/938455147541417984;;England, United Kingdom,Pacific Time (US & Canada),England, United Kingdom
janner1918;2017-12-06 11:55;3;5;"Please , please before you condemn anybody for their beliefs do some research. I am not saying believe what I say, what I am saying is have an open mind, research, see if you can find the curve by experimentation and that the earth moves. You try to debunk it, I tried and failed.";;;;"938451888277778432";https://twitter.com/janner1918/status/938451888277778432;;England, United Kingdom,Pacific Time (US & Canada),England, United Kingdom
janner1918;2017-12-06 11:49;2;1;"It's easy friend. The Sun is local not 93,000,000 miles away. All they need to do is make some clouds spray the atmosphere with Strontium ,Barium and Aluminum and hide the Sun, no problem...If you believe the Sun is 93,000,000 miles away, then you have a problem my friend.";;;;"938450231980634112";https://twitter.com/janner1918/status/938450231980634112;;England, United Kingdom,Pacific Time (US & Canada),England, United Kingdom
janner1918;2017-12-06 10:58;0;1;"pic.twitter.com/dmeZeYWqVK";;;;"938437545112850433";https://twitter.com/janner1918/status/938437545112850433;;England, United Kingdom,Pacific Time (US & Canada),England, United Kingdom
janner1918;2017-12-06 10:44;1;3;"@FlatEarthCity My treasure is where there are no thieves to steal it, it is looked after by the best protector in the Heavens. And He and only He has the keys to life and death.";;@FlatEarthCity;;"938433926468685824";https://twitter.com/janner1918/status/938433926468685824;;England, United Kingdom,Pacific Time (US & Canada),England, United Kingdom
janner1918;2017-12-06 10:34;1;1;"Very nice Wina, thank you.";;;;"938431392127574021";https://twitter.com/janner1918/status/938431392127574021;;England, United Kingdom,Pacific Time (US & Canada),England, United Kingdom
janner1918;2017-12-06 10:27;1;1;"If we stop thinking, we stop feeling..we need both.";;;;"938429621648936960";https://twitter.com/janner1918/status/938429621648936960;;England, United Kingdom,Pacific Time (US & Canada),England, United Kingdom
janner1918;2017-12-06 10:23;0;1;"Look, we all can't agree about everything, that's humanly impossible lol As long as we agree about the fundamentals. That is the important thing.";;;;"938428662822658048";https://twitter.com/janner1918/status/938428662822658048;;England, United Kingdom,Pacific Time (US & Canada),England, United Kingdom
janner1918;2017-12-06 10:18;0;1;"I beg to differ there, but as you have said, you only have a limited field so I forgive you lol";;;;"938427543476211712";https://twitter.com/janner1918/status/938427543476211712;;England, United Kingdom,Pacific Time (US & Canada),England, United Kingdom
janner1918;2017-12-06 10:16;1;0;"Chelsea my girl, you know quite a lot, I am impressed ,how long have you been researching ?";;;;"938426944051449857";https://twitter.com/janner1918/status/938426944051449857;;England, United Kingdom,Pacific Time (US & Canada),England, United Kingdom
janner1918;2017-12-06 10:13;0;0;"Nice ,but don't forget punctuation , people like punctuation. There should be a full stop after belief. Obviously the next truth would be a capital " T ". I still think you should slip in " all " before " our " it;s up to you, but I think it looks better";;;;"938426225059614722";https://twitter.com/janner1918/status/938426225059614722;;England, United Kingdom,Pacific Time (US & Canada),England, United Kingdom
janner1918;2017-12-06 10:08;1;0;"Did you know Chelsea they consider the Arabs girls the most beautiful girls in the world, because of their beautiful soft, shiny olive complexion.";;;;"938424862607073280";https://twitter.com/janner1918/status/938424862607073280;;England, United Kingdom,Pacific Time (US & Canada),England, United Kingdom
janner1918;2017-12-06 10:02;1;1;"Maybe not black Chelsea, more olive skinned then black I would think. One things for sure, He certainly wasn't white !";;;;"938423381439008770";https://twitter.com/janner1918/status/938423381439008770;;England, United Kingdom,Pacific Time (US & Canada),England, United Kingdom
janner1918;2017-12-06 09:59;1;1;"Brilliant !...that other word was " for " by the way. No, that is superb, I feel humbled by you taking my suggestions on board. Thank you . This description says it all, well done.";;;;"938422740993929216";https://twitter.com/janner1918/status/938422740993929216;;England, United Kingdom,Pacific Time (US & Canada),England, United Kingdom
janner1918;2017-12-06 09:55;0;1;"look again I added an " all" as well lol ans something else can't remember what. But that was a tiny word as well lol";;;;"938421681848233986";https://twitter.com/janner1918/status/938421681848233986;;England, United Kingdom,Pacific Time (US & Canada),England, United Kingdom
janner1918;2017-12-06 09:52;1;1;"We are not political, we stand united in our belief for the #truth : Truth as in salvation. Truth as freedom. Truth as the solution to all our problems." (I changed it slightly, hope you like it )";;;#truth;"938420942765772800";https://twitter.com/janner1918/status/938420942765772800;;England, United Kingdom,Pacific Time (US & Canada),England, United Kingdom
janner1918;2017-12-06 09:49;1;1;"Yes, there are also other tribes from Africa who were taken for slaves, so really the original Jews were from Africa.";;;;"938420018030792705";https://twitter.com/janner1918/status/938420018030792705;;England, United Kingdom,Pacific Time (US & Canada),England, United Kingdom
janner1918;2017-12-06 09:47;1;1;"That's a lot better, I like that.";;;;"938419508171157505";https://twitter.com/janner1918/status/938419508171157505;;England, United Kingdom,Pacific Time (US & Canada),England, United Kingdom
janner1918;2017-12-06 09:45;1;1;"Do you know Chelsea that's so true. There are no white Jews, they would all have skin like Arabs, also did you know that where the city of Jerusalem is now, is not the site of the true temple. There is a mount outside the city walls where the true temple was. google it and see.";;;;"938419153194684417";https://twitter.com/janner1918/status/938419153194684417;;England, United Kingdom,Pacific Time (US & Canada),England, United Kingdom
janner1918;2017-12-06 09:40;0;1;"Too complicated, people are so dumbed down now they need simple explanations. Try again, but see if you can use common language ( and I don't mean swearwords lol ) so that people can understand it straight away....Sorry to be a pain but you do like our opinions lol";;;;"938417774363398144";https://twitter.com/janner1918/status/938417774363398144;;England, United Kingdom,Pacific Time (US & Canada),England, United Kingdom
janner1918;2017-12-06 00:43;0;0;"Me to.....Y.N.W.A. pic.twitter.com/oBhqNGWnPs";;;;"938282691555885059";https://twitter.com/janner1918/status/938282691555885059;;England, United Kingdom,Pacific Time (US & Canada),England, United Kingdom
janner1918;2017-12-06 00:38;1;2;"pic.twitter.com/0SNajtcCWq";;;;"938281500990164992";https://twitter.com/janner1918/status/938281500990164992;;England, United Kingdom,Pacific Time (US & Canada),England, United Kingdom
janner1918;2017-12-06 00:35;1;3;"For all you globe believers out there. Put your best suit on, sit down with a half pint of water in a pint glass, then turn it upside down. Let's see if gravity stops it ruining your best suit...The earth is flat, WATER is always LEVEL. pic.twitter.com/pyLegAsfoU";;;;"938280673433018368";https://twitter.com/janner1918/status/938280673433018368;;England, United Kingdom,Pacific Time (US & Canada),England, United Kingdom
janner1918;2017-12-06 00:22;0;1;"Well you go to bed then sister, don't forget to say your prayers lol...And I'll speak to you later, sweet dreams & God bless.";;;;"938277471757242368";https://twitter.com/janner1918/status/938277471757242368;;England, United Kingdom,Pacific Time (US & Canada),England, United Kingdom
janner1918;2017-12-06 00:15;0;0;"Janette, may I ask you a personal question ? Are you Born Again ?";;;;"938275609800773632";https://twitter.com/janner1918/status/938275609800773632;;England, United Kingdom,Pacific Time (US & Canada),England, United Kingdom
janner1918;2017-12-06 00:07;1;0;"Yes I know my dear, I have researched this diligently , they mean to kill us off by any means possible..";;;;"938273690772475905";https://twitter.com/janner1918/status/938273690772475905;;England, United Kingdom,Pacific Time (US & Canada),England, United Kingdom
janner1918;2017-12-06 00:04;0;0;"These little ones are with our Lord ...No more pain, no more suffering....just peace & love, for ever and ever... https:// twitter.com/janner1918/sta tus/937649610302029824 …";;;;"938272802490257408";https://twitter.com/janner1918/status/938272802490257408;;England, United Kingdom,Pacific Time (US & Canada),England, United Kingdom
janner1918;2017-12-05 23:54;0;0;"@pansflorawood Looks like I need another box of tissues before I watch this";;@pansflorawood;;"938270432293203968";https://twitter.com/janner1918/status/938270432293203968;;England, United Kingdom,Pacific Time (US & Canada),England, United Kingdom
janner1918;2017-12-05 23:51;0;2;"Thank you , that's so kind";;;;"938269555784372225";https://twitter.com/janner1918/status/938269555784372225;;England, United Kingdom,Pacific Time (US & Canada),England, United Kingdom
janner1918;2017-12-05 23:47;0;1;"Amen";;;;"938268512824516608";https://twitter.com/janner1918/status/938268512824516608;;England, United Kingdom,Pacific Time (US & Canada),England, United Kingdom
janner1918;2017-12-05 23:43;1;0;"YEP, And I know of 2 people that would be happy...That's me & Chelsea lol";;;;"938267644154834945";https://twitter.com/janner1918/status/938267644154834945;;England, United Kingdom,Pacific Time (US & Canada),England, United Kingdom
janner1918;2017-12-05 23:41;1;0;"Blinkin Heck Chelsea,! I never knew coke was so useful..thanks for this But what it does to your insides, I don't wanna know lol";;;;"938267175227396097";https://twitter.com/janner1918/status/938267175227396097;;England, United Kingdom,Pacific Time (US & Canada),England, United Kingdom
janner1918;2017-12-05 23:36;0;1;"I love trees....With these Chem trails about , I am not sure how long we will have them.";;;;"938265783335051264";https://twitter.com/janner1918/status/938265783335051264;;England, United Kingdom,Pacific Time (US & Canada),England, United Kingdom
janner1918;2017-12-05 23:23;1;0;"I'm ready as well Chelsea love, as soon as He calls me...I'm gone";;;;"938262592849575936";https://twitter.com/janner1918/status/938262592849575936;;England, United Kingdom,Pacific Time (US & Canada),England, United Kingdom
janner1918;2017-12-05 23:19;0;0;"GIVE YOUR HEART TO JESUS....GUARANTEED SUCCESS TRAIT";;;;"938261679992922112";https://twitter.com/janner1918/status/938261679992922112;;England, United Kingdom,Pacific Time (US & Canada),England, United Kingdom
janner1918;2017-12-05 23:14;0;0;"I never met my Grand dad on my mother's side. He died in his early 40's of Tuberculoses. But you know the saddest thing , he lived through 2 horrendous world wars came back home and within a couple of months was dead . Life can be cruel can it....I just hope he's in Heaven.";;;;"938260322024087552";https://twitter.com/janner1918/status/938260322024087552;;England, United Kingdom,Pacific Time (US & Canada),England, United Kingdom
janner1918;2017-12-05 23:06;2;1;"When I received my works pension ....it was taxed ! Taxed on my lump sum I received My Monthly works pension is taxed I now receive my State pension, guess what ? Yeah, your right that's taxed to. Now when I die, you know what happens....my Dependants have to pay death tax to. pic.twitter.com/dhm42ihnkA";;;;"938258428220370945";https://twitter.com/janner1918/status/938258428220370945;;England, United Kingdom,Pacific Time (US & Canada),England, United Kingdom
janner1918;2017-12-05 22:54;0;6;"Yeah, and my Grand dad lived to 101 and he smoked from the age 8 till he died, drank a glass of Whiskey every day as well & loved fry up's...didn't do him any harm did it !";;;;"938255365841588224";https://twitter.com/janner1918/status/938255365841588224;;England, United Kingdom,Pacific Time (US & Canada),England, United Kingdom
janner1918;2017-12-05 22:49;0;0;"Right !..I'll make that cup of coffee now....maybe 2, or 3 perhaps even 4 lol";;;;"938254123790675968";https://twitter.com/janner1918/status/938254123790675968;;England, United Kingdom,Pacific Time (US & Canada),England, United Kingdom
janner1918;2017-12-05 22:41;0;0;"You know and I know this aint going to happen.....nice thought though ! https:// twitter.com/janner1918/sta tus/931204084820074496 …";;;;"938252051628347392";https://twitter.com/janner1918/status/938252051628347392;;England, United Kingdom,Pacific Time (US & Canada),England, United Kingdom
janner1918;2017-12-05 22:23;0;0;"@BookishNeptune We may not agree with everything ,but I have seen enough to know You are genuine. I have been trying and in some cases succeeding in getting the truth out there. I had my doubts about Sergent not sure about others ,but you have made my mind up about Sergent.";;@BookishNeptune;;"938247393329516552";https://twitter.com/janner1918/status/938247393329516552;;England, United Kingdom,Pacific Time (US & Canada),England, United Kingdom
janner1918;2017-12-05 18:42;0;0;"Thank You Kimberly";;;;"938191930818809856";https://twitter.com/janner1918/status/938191930818809856;;England, United Kingdom,Pacific Time (US & Canada),England, United Kingdom
