username;date;retweets;favorites;text;geo;mentions;hashtags;id;permalink;place_full_name;location;timezone;profile_location_name
lightnorth11;2017-12-06 16:18;0;0;"ايش هادا؟ اعتبره تكفير ذنوب الله يعينك";;;;"938517963572961280";https://twitter.com/lightnorth11/status/938517963572961280;;في العدم,Pacific Time (US & Canada),
lightnorth11;2017-12-06 16:08;0;0;"#القدس_عاصمه_فلسطين_الابديه للأسف دون التاريخ الكثير من الخيبات للعرب. صفحات مليئه بالدماء والخيانات ستنحرج من ذكر هذا الحاضر الذي سيصبح ماضي للأجيال القادمه.";;;#;"938515537629536256";https://twitter.com/lightnorth11/status/938515537629536256;;في العدم,Pacific Time (US & Canada),
lightnorth11;2017-12-05 16:08;0;0;"لست أدري..";;;;"938153134215651329";https://twitter.com/lightnorth11/status/938153134215651329;;في العدم,Pacific Time (US & Canada),
lightnorth11;2017-12-05 16:01;2;0;"الحياه تأخذ بيدي نحو ماتريد نادراً استطعت ان آخذ بيدها الى ماأريد عندما اتأمل نمط سير حياتنا ارى اننا نشبه أشخاص في روايه يؤدون ادوارهم المكتوبه الى ان يلقى كل شخص حتفه ولا احد يستطيع ان يفر من قدره المكتوب.";;;;"938151291368431617";https://twitter.com/lightnorth11/status/938151291368431617;;في العدم,Pacific Time (US & Canada),
lightnorth11;2017-12-05 15:49;0;1;"لا تهرب منها بل صادقها وافهمها وغذها بكل ماهو جميل";;;;"938148401073541120";https://twitter.com/lightnorth11/status/938148401073541120;;في العدم,Pacific Time (US & Canada),
lightnorth11;2017-12-05 14:53;0;0;"+١";;;;"938134343595315207";https://twitter.com/lightnorth11/status/938134343595315207;;في العدم,Pacific Time (US & Canada),
lightnorth11;2017-12-05 12:01;0;0;"عقبال مانشوف الجنس اللطيف يشارك في مثل هذه المسيرات. https:// twitter.com/najranriders1/ status/938090141222129664 …";;;;"938090956783603712";https://twitter.com/lightnorth11/status/938090956783603712;;في العدم,Pacific Time (US & Canada),
lightnorth11;2017-12-05 10:43;0;0;"#صورة_ملف_شخصي_جديدة pic.twitter.com/Ae6CkDqDGd";;;#;"938071444159856640";https://twitter.com/lightnorth11/status/938071444159856640;;في العدم,Pacific Time (US & Canada),
lightnorth11;2017-12-05 10:36;0;0;"طيب حطيت خيار رابع وهو لدي رأي آخر وقلت اذكر رأيك اذا كان مختلف عن الخيارات";;;;"938069581033287680";https://twitter.com/lightnorth11/status/938069581033287680;;في العدم,Pacific Time (US & Canada),
lightnorth11;2017-12-05 10:35;0;0;"وهو كذلك";;;;"938069386707030017";https://twitter.com/lightnorth11/status/938069386707030017;;في العدم,Pacific Time (US & Canada),
lightnorth11;2017-12-05 10:17;0;0;"ان كان عندك رأي فاذكره او اسلمنا الإستهزاء اللي ماله داعي https:// twitter.com/7nii0/status/9 38063978487574528 …";;;;"938064896545247232";https://twitter.com/lightnorth11/status/938064896545247232;;في العدم,Pacific Time (US & Canada),
lightnorth11;2017-12-05 10:02;0;1;"صح الموضوع صعب جداً ولكن الرأفه والرحمه قد تجبرك ان تتحدى كل شيء لطفل بريء قد يتحمل ذنب خطيئة من انجبوه طوال حياته";;;;"938060923549437953";https://twitter.com/lightnorth11/status/938060923549437953;;في العدم,Pacific Time (US & Canada),
lightnorth11;2017-12-05 09:51;0;0;"ايه جاتني ودفعتني لطرح الموضوع نشوف كيف نظرة المجتمع لهذا الأمر";;;;"938058291804073984";https://twitter.com/lightnorth11/status/938058291804073984;;في العدم,Pacific Time (US & Canada),
lightnorth11;2017-12-05 09:48;0;0;"وش الخيارات؟";;;;"938057450724495360";https://twitter.com/lightnorth11/status/938057450724495360;;في العدم,Pacific Time (US & Canada),
lightnorth11;2017-12-05 09:44;1;0;"سبحانه عادها حظوظ ذا الدنيا ! حد حظه ردي ويروح في شقاء وحد في سعاده";;;;"938056561561427970";https://twitter.com/lightnorth11/status/938056561561427970;;في العدم,Pacific Time (US & Canada),
lightnorth11;2017-12-05 09:32;0;0;"جميله الفكره ولكن هل بتضمن ان معاملتهم له زينه ؟ وبتقعد تنتظر من بعيد لين ياخذون ذا الغرير المسكين اللي تشحطط عند بيبان خلق الله !؟";;;;"938053380425048064";https://twitter.com/lightnorth11/status/938053380425048064;;في العدم,Pacific Time (US & Canada),
lightnorth11;2017-12-05 09:28;0;0;"ماأظن ان عنايتهم زينه غالب المراكز والرعايات عندنا مبانيهم كئيبه ونسمع شكاوي عنها";;;;"938052403911364609";https://twitter.com/lightnorth11/status/938052403911364609;;في العدم,Pacific Time (US & Canada),
lightnorth11;2017-12-05 08:05;0;0;"مهما جذبت الإنسان مدينه معينه الا انه يحن لمكان مسقط رأسه ويفضل البقاء فيه دائما ويزور الأماكن الأخرى للإكتشاف او لأمور مختلفه. https:// twitter.com/7eda2/status/9 38009215054045186 …";;;;"938031573068369920";https://twitter.com/lightnorth11/status/938031573068369920;;في العدم,Pacific Time (US & Canada),
lightnorth11;2017-12-05 07:59;0;0;"ليت اللي عندنا يتحركون ويحلون جميع مشاكل ذوي الإحتياجات الخاصه ويوفرون كل مايلزمهم ويحتاجونه https:// twitter.com/spagov/status/ 938025728842633216 …";;;;"938030070291103744";https://twitter.com/lightnorth11/status/938030070291103744;;في العدم,Pacific Time (US & Canada),
lightnorth11;2017-12-05 07:22;0;0;"توني اعرف انه انتشر لأنهم هم شخصياً علمونا وايش اللي صار معهم";;;;"938020633862131712";https://twitter.com/lightnorth11/status/938020633862131712;;في العدم,Pacific Time (US & Canada),
lightnorth11;2017-12-05 07:18;0;0;"لا اللي خلاني اكتب ذا التغريده انه ناس نعرفهم لقو عند بيتهم طفله بيضاء وهم سمران وفكرت في مستقبلها كيف راح يكون وهي في ذا المجتمع!";;;;"938019634791567360";https://twitter.com/lightnorth11/status/938019634791567360;;في العدم,Pacific Time (US & Canada),
lightnorth11;2017-12-05 07:07;4;2;"لو وجدت طفل رضيع عند باب منزلك ولا أحد معه وشكله ولون بشرته مختلف عنك ماذا ستفعل؟ اذكر رأيك اذا كان مختلف عن الخيارات الموجوده";;;;"938017086521118720";https://twitter.com/lightnorth11/status/938017086521118720;;في العدم,Pacific Time (US & Canada),
lightnorth11;2017-12-05 06:48;1;1;"صوره فخمه وكلام جميل";;;;"938012080371830784";https://twitter.com/lightnorth11/status/938012080371830784;;في العدم,Pacific Time (US & Canada),
lightnorth11;2017-12-04 14:52;0;0;"تعبث بغروزنا خربتي الخيال الله يصلحش قولي تداعب خصلات شعرنا";;;;"937771540019630080";https://twitter.com/lightnorth11/status/937771540019630080;;في العدم,Pacific Time (US & Canada),
lightnorth11;2017-12-04 14:50;0;1;"فقدان عزيز https:// twitter.com/HabilKhaled/st atus/937416004740804609 …";;;;"937771038728998912";https://twitter.com/lightnorth11/status/937771038728998912;;في العدم,Pacific Time (US & Canada),
lightnorth11;2017-12-04 14:49;0;0;"ودش انحن ياثنتين في ذا الطريق نمشي وحن راكبين خيل";;;;"937770857514131456";https://twitter.com/lightnorth11/status/937770857514131456;;في العدم,Pacific Time (US & Canada),
lightnorth11;2017-12-04 14:43;0;0;"لعاد تعود رح معادهي بزاينه";;;;"937769352178397184";https://twitter.com/lightnorth11/status/937769352178397184;;في العدم,Pacific Time (US & Canada),
lightnorth11;2017-12-04 14:38;0;0;"ليه كذا خرب التسلسل";;;;"937768097473355776";https://twitter.com/lightnorth11/status/937768097473355776;;في العدم,Pacific Time (US & Canada),
lightnorth11;2017-12-04 14:17;0;0;"يعرفونها هل الرياضيات والاقسام العلميه";;;;"937762704248508417";https://twitter.com/lightnorth11/status/937762704248508417;;في العدم,Pacific Time (US & Canada),
lightnorth11;2017-12-04 14:12;0;0;"لا صديق في السياسه";;;;"937761589201162240";https://twitter.com/lightnorth11/status/937761589201162240;;في العدم,Pacific Time (US & Canada),
lightnorth11;2017-12-04 13:47;0;0;"خليش معي حن خُلف مانتأثر الا لما خلص كل شيء";;;;"937755229172486146";https://twitter.com/lightnorth11/status/937755229172486146;;في العدم,Pacific Time (US & Canada),
lightnorth11;2017-12-04 13:43;0;0;"تأثير القمر العملاق على العالم جميع";;;;"937754283646291968";https://twitter.com/lightnorth11/status/937754283646291968;;في العدم,Pacific Time (US & Canada),
lightnorth11;2017-12-04 13:36;0;0;"رهيبه https:// twitter.com/youssefalbanay /status/937737852372307968 …";;;;"937752456083267585";https://twitter.com/lightnorth11/status/937752456083267585;;في العدم,Pacific Time (US & Canada),
lightnorth11;2017-12-04 13:28;0;0;"ايوه شفته ذلحين";;;;"937750540464861184";https://twitter.com/lightnorth11/status/937750540464861184;;في العدم,Pacific Time (US & Canada),
lightnorth11;2017-12-04 13:27;0;0;"وين ابداع بيسه ماشفته";;;;"937750250219073536";https://twitter.com/lightnorth11/status/937750250219073536;;في العدم,Pacific Time (US & Canada),
lightnorth11;2017-12-04 13:27;0;0;"";;;;"937750146095484928";https://twitter.com/lightnorth11/status/937750146095484928;;في العدم,Pacific Time (US & Canada),
lightnorth11;2017-12-04 10:59;0;0;"كنت بقول الله يحفظهم من عيونا ذلحين لا يجيهم بلاء على ذا الصوره";;;;"937712976894857216";https://twitter.com/lightnorth11/status/937712976894857216;;في العدم,Pacific Time (US & Canada),
lightnorth11;2017-12-04 10:43;1;0;"اي والله حتى اللي مستلقيه مكانها استراتيجي الله يهنيهم ماشاءالله";;;;"937709002343018502";https://twitter.com/lightnorth11/status/937709002343018502;;في العدم,Pacific Time (US & Canada),
lightnorth11;2017-12-04 09:59;0;2;"تم حفظها والعمل على تنفيذها";;;;"937697752162717707";https://twitter.com/lightnorth11/status/937697752162717707;;في العدم,Pacific Time (US & Canada),
lightnorth11;2017-12-04 09:54;1;0;"النفسيه محتاجه المكان اللي في الصوره";;;;"937696706367492097";https://twitter.com/lightnorth11/status/937696706367492097;;في العدم,Pacific Time (US & Canada),
lightnorth11;2017-12-03 13:46;0;0;"إن الأنانية تثير قدرًا من الرعب؛ بحيث إننا اخترعنا السياسة لإخفائها، ولكنها تخترق كل النقب وتفضح نفسها لدى كل مصادف -آرثر شوبنهاور";;;;"937392659223625728";https://twitter.com/lightnorth11/status/937392659223625728;;في العدم,Pacific Time (US & Canada),
lightnorth11;2017-12-02 02:05;0;1;"الله";;;;"936853872017997824";https://twitter.com/lightnorth11/status/936853872017997824;;في العدم,Pacific Time (US & Canada),
lightnorth11;2017-12-02 02:03;0;1;"ربما، كل مايمر به الإنسان ويعاني منه هو الذي يرسم خريطة حياته إما اكتشاف جديد من عزلته او مرض وتعب";;;;"936853275483152384";https://twitter.com/lightnorth11/status/936853275483152384;;في العدم,Pacific Time (US & Canada),
lightnorth11;2017-12-02 01:37;0;0;"ايوه هذا ماقصدته يكون له مزاجيات مختلفه";;;;"936846864741163008";https://twitter.com/lightnorth11/status/936846864741163008;;في العدم,Pacific Time (US & Canada),
lightnorth11;2017-12-02 01:35;0;0;"تقصدين الشخص الواعي ولا الغير واعي؟";;;;"936846345079361539";https://twitter.com/lightnorth11/status/936846345079361539;;في العدم,Pacific Time (US & Canada),
lightnorth11;2017-12-01 15:10;0;2;"اكتشفت انه كلما زاد وعي الشخص زادت تقلباته النفسيه عكس اللي مايفكر الا في بطنه حالته النفسيه مستقره غالباً";;;;"936688985585389568";https://twitter.com/lightnorth11/status/936688985585389568;;في العدم,Pacific Time (US & Canada),
lightnorth11;2017-12-01 15:05;0;0;"بعض الناس محظظوظ من حيث لا يحتسب الله يهنيهم";;;;"936687596381593600";https://twitter.com/lightnorth11/status/936687596381593600;;في العدم,Pacific Time (US & Canada),
lightnorth11;2017-12-01 13:18;0;4;"pic.twitter.com/IlY6vKtWrX";;;;"936660752689135616";https://twitter.com/lightnorth11/status/936660752689135616;;في العدم,Pacific Time (US & Canada),
lightnorth11;2017-12-01 12:21;1;0;"حقيقه اي نص اشوفه يذكرني بمعاناتنا او شيء كذا اتعداه معاد اتحمل";;;;"936646550482190336";https://twitter.com/lightnorth11/status/936646550482190336;;في العدم,Pacific Time (US & Canada),
lightnorth11;2017-12-01 12:11;0;0;"وهل شفيت منها؟ هل تغذت روحك وعقلك وانتفعت بما قرأت؟";;;;"936643954388471810";https://twitter.com/lightnorth11/status/936643954388471810;;في العدم,Pacific Time (US & Canada),
lightnorth11;2017-12-01 12:11;0;1;"احذر من أن يقتلك الوهم pic.twitter.com/ugcYCrHsvk";;;;"936643852932452352";https://twitter.com/lightnorth11/status/936643852932452352;;في العدم,Pacific Time (US & Canada),
lightnorth11;2017-12-01 12:07;0;2;"دائماً وابداً مكتوب على أهل الهوا قلّة الراحه..";;;;"936643044669054977";https://twitter.com/lightnorth11/status/936643044669054977;;في العدم,Pacific Time (US & Canada),
lightnorth11;2017-12-01 12:02;0;0;"#شيء_ماتعرفه_عني امضيت ٥ سنوات تقريباً في صراع مع ذاتي حتى وصلت الى بر الأمان لم يكن الوصول له بالأمر السهل.";;;#;"936641739183489024";https://twitter.com/lightnorth11/status/936641739183489024;;في العدم,Pacific Time (US & Canada),
lightnorth11;2017-12-01 11:59;0;0;"في ذقني فطسه خفيفه وخدي اليمين غمازه ماتبين جدا الا اذا ضحكت من قلب";;;;"936641006975496193";https://twitter.com/lightnorth11/status/936641006975496193;;في العدم,Pacific Time (US & Canada),
lightnorth11;2017-12-01 01:00;0;1;"حبتش العافيه";;;;"936475160802201601";https://twitter.com/lightnorth11/status/936475160802201601;;في العدم,Pacific Time (US & Canada),
lightnorth11;2017-11-30 10:31;1;0;"جعله مايسقى ماانسى ذيك اللحظه اللي اول ماقصفوا وكيف كان الصوت غريب علي وكيف دخل علينا التراب والريحه وانقطع كل شيء الغريبه كان قريب منا جددا";;;;"936256497763409920";https://twitter.com/lightnorth11/status/936256497763409920;;في العدم,Pacific Time (US & Canada),
lightnorth11;2017-11-30 10:25;0;2;"المعاناه تصنع العظماء امثالك";;;;"936254828195532801";https://twitter.com/lightnorth11/status/936254828195532801;;في العدم,Pacific Time (US & Canada),
lightnorth11;2017-11-29 14:04;0;1;"كلام سليم";;;;"935947627912364037";https://twitter.com/lightnorth11/status/935947627912364037;;في العدم,Pacific Time (US & Canada),
lightnorth11;2017-11-29 14:02;0;0;"وكذلك قدرة تحمل الإنسان تختلف من زمن لآخر !!كيف تحمل زراعة الإخشاب والإسنان بهذا الشكل!!؟";;;;"935947106552074246";https://twitter.com/lightnorth11/status/935947106552074246;;في العدم,Pacific Time (US & Canada),
lightnorth11;2017-11-29 10:23;0;0;"الواجب على الإنسان هو السعي في هذه الحياه الى ان يقول الله قوله ولكن فكرة ان المنقذ غير موجود فلا اتفق معها لأن لكل زمان امامه وسيده وهذا ماقرأناه في التاريخ وكما هو معلوم عندنا.";;;;"935891955019649026";https://twitter.com/lightnorth11/status/935891955019649026;;في العدم,Pacific Time (US & Canada),
lightnorth11;2017-11-29 10:18;0;1;"جعلني مناكير";;;;"935890792874434560";https://twitter.com/lightnorth11/status/935890792874434560;;في العدم,Pacific Time (US & Canada),
lightnorth11;2017-11-29 10:13;0;1;"+١";;;;"935889501892825088";https://twitter.com/lightnorth11/status/935889501892825088;;في العدم,Pacific Time (US & Canada),
lightnorth11;2017-11-28 10:25;0;0;"pic.twitter.com/48HZ3kBCmu";;;;"935530038715396096";https://twitter.com/lightnorth11/status/935530038715396096;;في العدم,Pacific Time (US & Canada),
lightnorth11;2017-11-28 10:20;0;0;"كفوو لكن من اجل راحة راسش ونفسيتش";;;;"935528929548472320";https://twitter.com/lightnorth11/status/935528929548472320;;في العدم,Pacific Time (US & Canada),
lightnorth11;2017-11-28 10:14;0;0;"هذا الصوت الجميل مظلوم وين حن منه https:// twitter.com/khalid_il/stat us/935473216646254592 …";;;;"935527433582891009";https://twitter.com/lightnorth11/status/935527433582891009;;في العدم,Pacific Time (US & Canada),
lightnorth11;2017-11-28 10:10;0;0;"بيسه طيعيني وقفلي الصراحه وارتاحي من ذولا";;;;"935526229293314049";https://twitter.com/lightnorth11/status/935526229293314049;;في العدم,Pacific Time (US & Canada),