username;date;retweets;favorites;text;geo;mentions;hashtags;id;permalink;place_full_name;location;timezone;profile_location_name
LumossNoxx;2017-12-06 17:14;0;1;"Eh la pizzeria nuova u.u";;;;"938532004420902912";https://twitter.com/LumossNoxx/status/938532004420902912;;Hogwarts ⚡️,Rome,
LumossNoxx;2017-12-06 16:27;0;0;"Ora si é aggiunto pure Romualdo";;;;"938520264349974528";https://twitter.com/LumossNoxx/status/938520264349974528;;Hogwarts ⚡️,Rome,
LumossNoxx;2017-12-06 15:17;0;0;"Ed adesso coltiviamo l’amore #IlContadinoCercaMoglie";;;#IlContadinoCercaMoglie;"938502686722445314";https://twitter.com/LumossNoxx/status/938502686722445314;;Hogwarts ⚡️,Rome,
LumossNoxx;2017-12-06 15:15;0;0;"Rieccoci di Rocco";;;;"938502053076307972";https://twitter.com/LumossNoxx/status/938502053076307972;;Hogwarts ⚡️,Rome,
LumossNoxx;2017-12-06 13:26;0;0;"Quando alle 19 scopriamo che mia mamma non c’è a cena e mio babbo senza dire nulla, piglia e va a prendere le pizze";;;;"938474708789530629";https://twitter.com/LumossNoxx/status/938474708789530629;;Hogwarts ⚡️,Rome,
LumossNoxx;2017-12-06 09:58;0;0;"A volte piuttosto che ricevere la notifica dei ricordi di Facebook preferirei infilarmi degli spilli negli occhi, ma che minchia condividevo e dove mi taggavano? AHAHAHA";;;;"938422347962478594";https://twitter.com/LumossNoxx/status/938422347962478594;;Hogwarts ⚡️,Rome,
LumossNoxx;2017-12-06 09:28;0;1;"Hai fatto caso a quanto i nostri tweet si assomiglino a volte?";;;;"938414802451488768";https://twitter.com/LumossNoxx/status/938414802451488768;;Hogwarts ⚡️,Rome,
LumossNoxx;2017-12-06 08:48;0;0;"Finalmente dopo più di un anno dall'uscita americana Sky Uno decide di mandare in onda ANTM 23 ed anche se l'ho già guardato tutto in inglese, figuriamoci se non me lo riguardo!";;;;"938404708645048321";https://twitter.com/LumossNoxx/status/938404708645048321;;Hogwarts ⚡️,Rome,
LumossNoxx;2017-12-05 18:35;0;0;"Sono soddisfazioni queste! Animal Crossing pic.twitter.com/Wt7CEKzi6B";;;;"938190163288707072";https://twitter.com/LumossNoxx/status/938190163288707072;;Hogwarts ⚡️,Rome,
LumossNoxx;2017-12-05 14:21;0;1;"Tutte le volte che sento la sigla di Black Sails inizio a fare lalala cercando di seguire il ritmo, adoro ahah";;;;"938126318335557632";https://twitter.com/LumossNoxx/status/938126318335557632;;Hogwarts ⚡️,Rome,
LumossNoxx;2017-12-05 12:55;0;0;"All heroes please apply";;;;"938104681141821440";https://twitter.com/LumossNoxx/status/938104681141821440;;Hogwarts ⚡️,Rome,
LumossNoxx;2017-12-04 18:06;0;0;"Adoro https:// twitter.com/PoemsPorn/stat us/937773956681125888 …";;;;"937820485949251586";https://twitter.com/LumossNoxx/status/937820485949251586;;Hogwarts ⚡️,Rome,
LumossNoxx;2017-12-04 14:05;0;0;"Questo evento di Natale di Animal Crossing è troppo tosto, riuscirò mai a finirlo in tempo?";;;;"937759814310035457";https://twitter.com/LumossNoxx/status/937759814310035457;;Hogwarts ⚡️,Rome,
LumossNoxx;2017-12-04 14:04;0;0;"Amiche che ti taggano in trailer superfighi di Netflix, grazie di esistere";;;;"937759488240750593";https://twitter.com/LumossNoxx/status/937759488240750593;;Hogwarts ⚡️,Rome,
LumossNoxx;2017-12-04 13:54;0;0;"Per capodanno voglio andare in qualche posto pieno di neve";;;;"937757039513800705";https://twitter.com/LumossNoxx/status/937757039513800705;;Hogwarts ⚡️,Rome,
LumossNoxx;2017-12-04 11:58;0;0;"Miao pic.twitter.com/8SHtfP4HTX";;;;"937727930016452609";https://twitter.com/LumossNoxx/status/937727930016452609;;Hogwarts ⚡️,Rome,
LumossNoxx;2017-12-04 03:45;0;0;"Mi manca 50 tweet per averne scritto 15.000, ma di cosa mi drogo?";;;;"937603828563800064";https://twitter.com/LumossNoxx/status/937603828563800064;;Hogwarts ⚡️,Rome,
LumossNoxx;2017-12-03 16:47;0;0;"Volevo condividere qualche frase di stairway to heaven, ma riflettendoci meglio.. è talmente bella la canzone che mi sembra quasi un crimine non scriverla tutta";;;;"937438046454276098";https://twitter.com/LumossNoxx/status/937438046454276098;;Hogwarts ⚡️,Rome,
LumossNoxx;2017-12-03 14:43;0;0;"A.A.A Cercasi disperatamente nuove serie tv da vedere, vi prego aiutatemi";;;;"937407023079141380";https://twitter.com/LumossNoxx/status/937407023079141380;;Hogwarts ⚡️,Rome,
LumossNoxx;2017-12-03 14:43;0;0;"Attack of Titan è veramente bellissimo, ora che sono in pari, come lo aspetto luglio?";;;;"937406906955649024";https://twitter.com/LumossNoxx/status/937406906955649024;;Hogwarts ⚡️,Rome,
LumossNoxx;2017-12-03 13:07;0;0;"Esplodo";;;;"937382753187790848";https://twitter.com/LumossNoxx/status/937382753187790848;;Hogwarts ⚡️,Rome,
LumossNoxx;2017-12-03 13:07;0;0;"Oddio quanto mi sento GRASSA in questo momento";;;;"937382715095244800";https://twitter.com/LumossNoxx/status/937382715095244800;;Hogwarts ⚡️,Rome,
LumossNoxx;2017-12-03 08:55;0;0;"Detto fatto pic.twitter.com/MWDeFQ9p0Q";;;;"937319467385835522";https://twitter.com/LumossNoxx/status/937319467385835522;;Hogwarts ⚡️,Rome,
LumossNoxx;2017-12-03 05:53;0;0;"Oggi faccio 21 anni e 7 mesi, yee #3dicembre";;;#3dicembre;"937273562980933632";https://twitter.com/LumossNoxx/status/937273562980933632;;Hogwarts ⚡️,Rome,
LumossNoxx;2017-12-03 05:52;0;0;"E la rosticciana.";;;;"937273287004053504";https://twitter.com/LumossNoxx/status/937273287004053504;;Hogwarts ⚡️,Rome,
LumossNoxx;2017-12-03 05:18;0;0;"Alle altre regalate pure gioielli e trucchi, a me datemi una bistecca";;;;"937264693378502663";https://twitter.com/LumossNoxx/status/937264693378502663;;Hogwarts ⚡️,Rome,
LumossNoxx;2017-12-03 03:58;0;1;"Incoerenzaaa";;;;"937244681972473857";https://twitter.com/LumossNoxx/status/937244681972473857;;Hogwarts ⚡️,Rome,
LumossNoxx;2017-12-03 03:57;0;2;"Benvenuta amore mio, siamo gemelle #SummonersWar pic.twitter.com/jbfDDqGYTw";;;#SummonersWar;"937244366392971264";https://twitter.com/LumossNoxx/status/937244366392971264;;Hogwarts ⚡️,Rome,
LumossNoxx;2017-12-02 18:16;0;0;"A me guardare Shannara me la spezza troppo ahahahah";;;;"937098153068847104";https://twitter.com/LumossNoxx/status/937098153068847104;;Hogwarts ⚡️,Rome,
LumossNoxx;2017-12-02 16:02;0;1;"Ah ci devi pure riflettere";;;;"937064520664715264";https://twitter.com/LumossNoxx/status/937064520664715264;;Hogwarts ⚡️,Rome,
LumossNoxx;2017-12-02 14:39;0;0;"Io sono tutto tranne che cattiva";;;;"937043466344960000";https://twitter.com/LumossNoxx/status/937043466344960000;;Hogwarts ⚡️,Rome,
LumossNoxx;2017-12-02 14:25;0;0;"Ma non in questo caso, lo sei a prescindere";;;;"937040082703409152";https://twitter.com/LumossNoxx/status/937040082703409152;;Hogwarts ⚡️,Rome,
LumossNoxx;2017-12-02 14:18;0;0;"Mi difendo dalla tua antipatia colossale";;;;"937038395825672194";https://twitter.com/LumossNoxx/status/937038395825672194;;Hogwarts ⚡️,Rome,
LumossNoxx;2017-12-02 13:59;0;0;"La prossima volta ti metto il copyright così fai pochi fichi";;;;"937033484429877248";https://twitter.com/LumossNoxx/status/937033484429877248;;Hogwarts ⚡️,Rome,
LumossNoxx;2017-12-02 13:56;0;0;"Mah.. detta da te, può essere di tutto!";;;;"937032807032999936";https://twitter.com/LumossNoxx/status/937032807032999936;;Hogwarts ⚡️,Rome,
LumossNoxx;2017-12-02 13:51;0;0;"Di cosa sapeva questo commento?";;;;"937031531318661120";https://twitter.com/LumossNoxx/status/937031531318661120;;Hogwarts ⚡️,Rome,
LumossNoxx;2017-12-02 12:45;0;0;"Mi fa sempre piacere fare due chiacchiere con Tommolino, con la Benni e chiunque mi cerca dei miei amici dicendomi che sarebbe tanto bello rivedermi, mi fanno sentire so lucky";;;;"937014901842894848";https://twitter.com/LumossNoxx/status/937014901842894848;;Hogwarts ⚡️,Rome,
LumossNoxx;2017-12-02 12:35;0;1;"Effettivamente è indelebile";;;;"937012293308579842";https://twitter.com/LumossNoxx/status/937012293308579842;;Hogwarts ⚡️,Rome,
LumossNoxx;2017-12-02 11:02;0;3;"Ah, comunque giovedì abbiamo assistito a tutto ciò per non dimenticare #XF11 pic.twitter.com/LEkFkxNFE9";;;#XF11;"936988978594672640";https://twitter.com/LumossNoxx/status/936988978594672640;;Hogwarts ⚡️,Rome,
LumossNoxx;2017-12-02 10:57;0;0;"Ormai associo le emoji alle facce delle persone ahah, alcune espressioni sono identiche";;;;"936987742126460928";https://twitter.com/LumossNoxx/status/936987742126460928;;Hogwarts ⚡️,Rome,
LumossNoxx;2017-12-02 10:42;0;0;"Il mio ragazzo che mi regala a sorpresa Super Mario Odyssey ed io che mi commuovo come una tontina di prima categoria";;;;"936983947933822976";https://twitter.com/LumossNoxx/status/936983947933822976;;Hogwarts ⚡️,Rome,
LumossNoxx;2017-12-02 08:17;0;0;"Uno di questi sabati ci devo andare";;;;"936947467177914368";https://twitter.com/LumossNoxx/status/936947467177914368;;Hogwarts ⚡️,Rome,
LumossNoxx;2017-12-02 08:17;0;0;"Uhuhuh c’è il mercatino di Natale in Santa Croce, ogni volta che ci vado mi capita qualcosa di strano";;;;"936947390787047425";https://twitter.com/LumossNoxx/status/936947390787047425;;Hogwarts ⚡️,Rome,
LumossNoxx;2017-12-02 04:56;0;1;"Quella sensazione quando la gente che ti circonda ti sta stretta";;;;"936896793069027328";https://twitter.com/LumossNoxx/status/936896793069027328;;Hogwarts ⚡️,Rome,
LumossNoxx;2017-12-01 07:45;0;0;"Oggi a pranzo polliniii";;;;"936576995453960192";https://twitter.com/LumossNoxx/status/936576995453960192;;Hogwarts ⚡️,Rome,
LumossNoxx;2017-12-01 05:51;0;1;"Damiano cosa seiii #NuovaFotoProfilo #XF11 pic.twitter.com/yiwQptJItq";;;#NuovaFotoProfilo #XF11;"936548254396878849";https://twitter.com/LumossNoxx/status/936548254396878849;;Hogwarts ⚡️,Rome,
LumossNoxx;2017-12-01 05:49;0;0;"4";;;;"936547688593674240";https://twitter.com/LumossNoxx/status/936547688593674240;;Hogwarts ⚡️,Rome,
LumossNoxx;2017-12-01 03:55;0;1;"È tutto verooo, possiamo non ridormire!";;;;"936519229834178561";https://twitter.com/LumossNoxx/status/936519229834178561;;Hogwarts ⚡️,Rome,
LumossNoxx;2017-11-30 19:20;0;0;"Nel caso.. mi rimetto a dormire ahah";;;;"936389462313103361";https://twitter.com/LumossNoxx/status/936389462313103361;;Hogwarts ⚡️,Rome,
LumossNoxx;2017-11-30 18:02;0;0;"Ahahah magari è davvero un sogno";;;;"936369872283537410";https://twitter.com/LumossNoxx/status/936369872283537410;;Hogwarts ⚡️,Rome,
LumossNoxx;2017-11-30 17:55;0;0;"Ahah ci devo dormire sopra per metabolizzarla questa cosa ahah";;;;"936368136848334850";https://twitter.com/LumossNoxx/status/936368136848334850;;Hogwarts ⚡️,Rome,
LumossNoxx;2017-11-30 17:52;0;1;"Io sono commossa ahahah";;;;"936367349627793414";https://twitter.com/LumossNoxx/status/936367349627793414;;Hogwarts ⚡️,Rome,
LumossNoxx;2017-11-30 17:35;3;15;"E niente, per me la trasmissione può finire con questa schermata, grazie ciao. #XF11 pic.twitter.com/eBuul5gJv0";;;#XF11;"936363120133660672";https://twitter.com/LumossNoxx/status/936363120133660672;;Hogwarts ⚡️,Rome,
LumossNoxx;2017-11-30 17:30;0;0;"CHE. CALDO. #XF11 https:// twitter.com/xfactor_italia /status/936360255361048576 …";;;#XF11;"936361758557655042";https://twitter.com/LumossNoxx/status/936361758557655042;;Hogwarts ⚡️,Rome,
LumossNoxx;2017-11-30 17:29;1;3;"I Måneskin hanno vinto le prossime 10 edizioni di X Factor #XF11";;;#XF11;"936361498972229633";https://twitter.com/LumossNoxx/status/936361498972229633;;Hogwarts ⚡️,Rome,
LumossNoxx;2017-11-30 17:26;0;1;"Quel ragazzo è il sesso che cammina #XF11";;;#XF11;"936360893717282816";https://twitter.com/LumossNoxx/status/936360893717282816;;Hogwarts ⚡️,Rome,
LumossNoxx;2017-11-30 17:26;0;1;"Damiano sta sui tacchi meglio di me #XF11";;;#XF11;"936360843494731777";https://twitter.com/LumossNoxx/status/936360843494731777;;Hogwarts ⚡️,Rome,
LumossNoxx;2017-11-30 16:18;0;0;"Damiano in bianco ci piace un sacco, ma con il trucco nero sticazzi se è figo #XF11";;;#XF11;"936343600266383360";https://twitter.com/LumossNoxx/status/936343600266383360;;Hogwarts ⚡️,Rome,
LumossNoxx;2017-11-30 06:50;0;0;"Lo spirito natalizio che mi manca dal 2008 risorge oggi con l’evento natalizio di Animal Crossing";;;;"936200650991521793";https://twitter.com/LumossNoxx/status/936200650991521793;;Hogwarts ⚡️,Rome,
LumossNoxx;2017-11-30 06:38;0;0;"Mara stile di vita #XF11 @maramaionchi https:// twitter.com/xfactor_italia /status/935867571370373121 …";;@maramaionchi;#XF11;"936197843072835584";https://twitter.com/LumossNoxx/status/936197843072835584;;Hogwarts ⚡️,Rome,
LumossNoxx;2017-11-30 06:36;1;2;"Ormai il giovedì per me è diventato il giorno dei Måneskin @maneskinweare #XF11";;@maneskinweare;#XF11;"936197191655477249";https://twitter.com/LumossNoxx/status/936197191655477249;;Hogwarts ⚡️,Rome,
LumossNoxx;2017-11-30 05:51;0;0;"Posso piangere ad ogni puntata di This is us? Evidentemente si.";;;;"936185807005724672";https://twitter.com/LumossNoxx/status/936185807005724672;;Hogwarts ⚡️,Rome,
LumossNoxx;2017-11-30 04:17;0;1;"";;;;"936162241556119553";https://twitter.com/LumossNoxx/status/936162241556119553;;Hogwarts ⚡️,Rome,
LumossNoxx;2017-11-30 04:09;0;0;"Eh beh, si chiama gusto";;;;"936160208954576897";https://twitter.com/LumossNoxx/status/936160208954576897;;Hogwarts ⚡️,Rome,
LumossNoxx;2017-11-30 03:54;0;0;"La differenza sostanziale è che le mie foto sono veramente belle";;;;"936156536937828352";https://twitter.com/LumossNoxx/status/936156536937828352;;Hogwarts ⚡️,Rome,
LumossNoxx;2017-11-29 19:06;0;1;"“L'amore è avere armi senza fare male L'amore è così stupido ma vallo poi a capire”";;;;"936023702860386304";https://twitter.com/LumossNoxx/status/936023702860386304;;Hogwarts ⚡️,Rome,
LumossNoxx;2017-11-29 19:05;0;0;"La gente che mi dice “Ma non mi hai messo mi piace all’ultima foto su Instagram” me la spezza, se non te l’ho messo, non sarà forse perché la foto è brutta?";;;;"936023304602898432";https://twitter.com/LumossNoxx/status/936023304602898432;;Hogwarts ⚡️,Rome,
LumossNoxx;2017-11-29 18:50;0;0;"AHAHAHHA GEI HAI VINTO pic.twitter.com/rW8RAuQcSZ";;;;"936019539300675585";https://twitter.com/LumossNoxx/status/936019539300675585;;Hogwarts ⚡️,Rome,
LumossNoxx;2017-11-29 16:26;0;0;"Ma si può vedere una cosa del genere!? pic.twitter.com/1fv1nZvz2Y";;;;"935983298261782530";https://twitter.com/LumossNoxx/status/935983298261782530;;Hogwarts ⚡️,Rome,
LumossNoxx;2017-11-29 15:04;0;0;"Ed ora “Il contadino cerca moglie”";;;;"935962710856040448";https://twitter.com/LumossNoxx/status/935962710856040448;;Hogwarts ⚡️,Rome,
LumossNoxx;2017-11-29 15:01;0;0;"Ed invece si ma non lo ammetti, UTE.";;;;"935961900868886529";https://twitter.com/LumossNoxx/status/935961900868886529;;Hogwarts ⚡️,Rome,
LumossNoxx;2017-11-29 15:01;0;0;"https:// twitter.com/poemsporn/stat us/935961577337090048 …";;;;"935961812503269379";https://twitter.com/LumossNoxx/status/935961812503269379;;Hogwarts ⚡️,Rome,
LumossNoxx;2017-11-29 12:45;0;0;"(Credo, spero di si)";;;;"935927742872412160";https://twitter.com/LumossNoxx/status/935927742872412160;;Hogwarts ⚡️,Rome,
LumossNoxx;2017-11-29 12:11;0;0;"Vai anche oggi a farti menare? Speriamo in un po' di botte pese";;;;"935919221535625217";https://twitter.com/LumossNoxx/status/935919221535625217;;Hogwarts ⚡️,Rome,
LumossNoxx;2017-11-29 11:42;0;0;"Aaah belli i tuoi tweet da mestruato, sisi";;;;"935911923723497473";https://twitter.com/LumossNoxx/status/935911923723497473;;Hogwarts ⚡️,Rome,
LumossNoxx;2017-11-29 11:23;0;0;"Non resisti proprio a rovinare ogni mio bellissimo tweet";;;;"935907068334272513";https://twitter.com/LumossNoxx/status/935907068334272513;;Hogwarts ⚡️,Rome,
LumossNoxx;2017-11-29 03:44;0;0;"Continuo a scrollare gli alberi di Animal Crossing Pocket Camp con l’ansia che esca un qualche oggetto o la paura che escano le api, ma non succede niente..";;;;"935791619525181440";https://twitter.com/LumossNoxx/status/935791619525181440;;Hogwarts ⚡️,Rome,
LumossNoxx;2017-11-29 03:43;0;0;"Io adoro questo Animal Crossing, ma dove sono i fossili? Volete mettere il divertimento di farli analizzare al gufetto e poi invece di donarli al museo, andarli a vendere per fare i big money";;;;"935791385671847936";https://twitter.com/LumossNoxx/status/935791385671847936;;Hogwarts ⚡️,Rome,
LumossNoxx;2017-11-28 13:49;0;0;"MA QUANTO CAZZO SONO FIGHI https:// youtu.be/d22ueuFfGak #XF11";;;#XF11;"935581386144145408";https://twitter.com/LumossNoxx/status/935581386144145408;;Hogwarts ⚡️,Rome,
LumossNoxx;2017-11-28 04:04;0;0;"A volte mi meraviglio di quello che sogno";;;;"935434200110501888";https://twitter.com/LumossNoxx/status/935434200110501888;;Hogwarts ⚡️,Rome,
LumossNoxx;2017-11-27 18:23;0;0;"Non ho niente contro il trash perché anche io mi guardo dei programmi cretini, ma c’è un limite alla stupidità di un programma tv";;;;"935287881983299585";https://twitter.com/LumossNoxx/status/935287881983299585;;Hogwarts ⚡️,Rome,
LumossNoxx;2017-11-27 18:22;0;1;"Avere un gruppo su whatsapp con persone che parlano del GF mi irrita alquanto, ho silenziato più di 300 messaggi su quel programma osceno";;;;"935287642387828737";https://twitter.com/LumossNoxx/status/935287642387828737;;Hogwarts ⚡️,Rome,
LumossNoxx;2017-11-27 17:48;0;0;"Miao miao";;;;"935279308481982464";https://twitter.com/LumossNoxx/status/935279308481982464;;Hogwarts ⚡️,Rome,
LumossNoxx;2017-11-27 16:59;0;0;"Possibile che anche avvolta in 4 coperte ho freddo?";;;;"935266875671445504";https://twitter.com/LumossNoxx/status/935266875671445504;;Hogwarts ⚡️,Rome,
LumossNoxx;2017-11-27 14:14;0;1;"Amorosoooo https:// twitter.com/RiverdaleIta/s tatus/935225012415619072 …";;;;"935225358131048449";https://twitter.com/LumossNoxx/status/935225358131048449;;Hogwarts ⚡️,Rome,
LumossNoxx;2017-11-27 14:14;0;0;"https://www. youtube.com/watch?v=W9U2RO TlatY …";;;;"935225218624352263";https://twitter.com/LumossNoxx/status/935225218624352263;;Hogwarts ⚡️,Rome,
LumossNoxx;2017-11-27 13:57;0;0;"Ma vaia vai tu usi solo splash .-.";;;;"935220961795887104";https://twitter.com/LumossNoxx/status/935220961795887104;;Hogwarts ⚡️,Rome,
LumossNoxx;2017-11-27 13:50;0;0;"Ti blocco tra 3, 2, 1.";;;;"935219257385930757";https://twitter.com/LumossNoxx/status/935219257385930757;;Hogwarts ⚡️,Rome,
LumossNoxx;2017-11-27 13:13;0;0;"Capirai che novità";;;;"935209872458682368";https://twitter.com/LumossNoxx/status/935209872458682368;;Hogwarts ⚡️,Rome,
LumossNoxx;2017-11-27 12:46;0;0;"Eh circa 5/6 giorni, povero chi ti ha intorno! Ma che vuoi! Summoners War in da hart. pic.twitter.com/cLXEdOcUw9";;;;"935203199484661761";https://twitter.com/LumossNoxx/status/935203199484661761;;Hogwarts ⚡️,Rome,
LumossNoxx;2017-11-27 12:19;0;0;"Fatti i fatti tuoiii ragazzo mestruato, tanto lo so che ci giochi pure tu";;;;"935196349393448960";https://twitter.com/LumossNoxx/status/935196349393448960;;Hogwarts ⚡️,Rome,
LumossNoxx;2017-11-27 09:53;0;0;"Ciao persone, questo è il mio ID di Animal Crossing, diventiamo amici così ci aiutiamo 63730521965 #AnimalCrossing pic.twitter.com/nu9bHWceCD";;;#AnimalCrossing;"935159565619953665";https://twitter.com/LumossNoxx/status/935159565619953665;;Hogwarts ⚡️,Rome,