username;date;retweets;favorites;text;geo;mentions;hashtags;id;permalink;place_full_name;location;timezone;profile_location_name
mfpdx;2017-12-07 00:35;1;1;"TRUMP/ @POTUS OF COURSE! He lies consistently! Stop divisiveness: This is ONLY SOLUTION! #americaAboveParty #GOP #DEMOCRATS #CONGRESS @realDonaldTrump #EVERYONE https:// twitter.com/msruthedelaros a/status/938613686444351488 …";;@POTUS @realDonaldTrump;#americaAboveParty #GOP #DEMOCRATS #CONGRESS #EVERYONE;"938643073973678081";https://twitter.com/mfpdx/status/938643073973678081;;Pacific NW,Pacific Time (US & Canada),
mfpdx;2017-12-06 13:00;0;0;"No the “deep state” happens to belong to the Republicans! When did this become news? #FBI #CIA hope you’re paying attention this! #ImpeachTrump B4 he destroys America ! ##TrumpCult #Tribalism IS NOT IN OUR CONSTITUTION!! https:// twitter.com/wileesongdog/s tatus/938116480914411520 …";;;#FBI #CIA #ImpeachTrump # #TrumpCult #Tribalism;"938468085832359936";https://twitter.com/mfpdx/status/938468085832359936;;Pacific NW,Pacific Time (US & Canada),
mfpdx;2017-12-06 12:50;0;0;"Sadly DUE PROCESS is reserved for people like Roy Moore and @realDonaldTrump As well as othe accusations against R’s. I remember the illegal Diaper deviancy conduct of #DavidVitter WHO was THEN welcome back to the #SENATE w/a standing ovation (that’s ONE Example #Hypocrisy much? https:// twitter.com/repjohnconyers /status/934838606488891394 …";;@realDonaldTrump;#DavidVitter #SENATE #Hypocrisy;"938465797093056512";https://twitter.com/mfpdx/status/938465797093056512;;Pacific NW,Pacific Time (US & Canada),
mfpdx;2017-12-06 12:39;0;0;"@Johnconyers16 If U did those things I am so disappointed - at same time, I WOULD LIKE TO POINT OUT that a dem has 2 resign while #GOP - #roymoore & @realDonaldTrump , naming JUST 2, go on W/O ANY JUSTICE 4 THE WOMEN “THEY” assaulted! #AnyoneButADemocrat #Division #Hypocrisy https:// twitter.com/repjohnconyers /status/934838606488891394 …";;@Johnconyers16 @realDonaldTrump;#GOP #roymoore #AnyoneButADemocrat #Division #Hypocrisy;"938462859498885120";https://twitter.com/mfpdx/status/938462859498885120;;Pacific NW,Pacific Time (US & Canada),
mfpdx;2017-12-06 12:21;0;0;"S https:// twitter.com/whiphoyer/stat us/938456871668772864 …";;;;"938458502439190528";https://twitter.com/mfpdx/status/938458502439190528;;Pacific NW,Pacific Time (US & Canada),
mfpdx;2017-12-05 13:59;0;1;"@JimInhofe is also the great climate change denier, let’s not forget that either. #ClimateChangeIsReal - time to go @JimInhofe";;@JimInhofe @JimInhofe;#ClimateChangeIsReal;"938120555227635712";https://twitter.com/mfpdx/status/938120555227635712;;Pacific NW,Pacific Time (US & Canada),
mfpdx;2017-12-05 13:43;0;1;"@JimInhofe , like the rest of the GOP Congress, Only CLAIMS 2 have morals, con’s HAVE PROVEN they don’t over & over. What happened 2 the party Of low deficit & “moral values“? It’s lip service, that’s all it has been for decades #GOP #TrumpCult #tribalism https:// twitter.com/hach_g/status/ 937818570125328384 …";;@JimInhofe;#GOP #TrumpCult #tribalism;"938116644907315200";https://twitter.com/mfpdx/status/938116644907315200;;Pacific NW,Pacific Time (US & Canada),
mfpdx;2017-12-05 13:33;0;0;"Sadly it’s all about #tribalism at this point :( I don’t understand #Alabama or how they cld elect #RoyMoore , a pedophile. Only Young voters can stop this, but apparently in #Alabama they don’t vote. If A/one knows young pple who live there please contact them & ask them 2 vote! https:// twitter.com/garretthaake/s tatus/937812387088027649 …";;;#tribalism #Alabama #RoyMoore #Alabama;"938114049757163521";https://twitter.com/mfpdx/status/938114049757163521;;Pacific NW,Pacific Time (US & Canada),
mfpdx;2017-12-04 13:05;0;0;"SHOCKED? @realDonaldTrump AND BUSINESS ASSOC WILL Benefit A LOT from this tax cut, which I’m praying his supporters R SEEING. Bill helps big airlines Com; Big oil; takes away state tax deductions & College deductions, etc., SO, unless U R a corp or rich already, U LOSE, PERIOD:(";;@realDonaldTrump;;"937744583152230400";https://twitter.com/mfpdx/status/937744583152230400;;Pacific NW,Pacific Time (US & Canada),
mfpdx;2017-12-04 12:36;0;0;"@ChuckGrassley , it’s not the middle class or the lower-class that spends their money on liquor. They spend it on food and shelter and clothes! It’s the entitled rich & their kids you R helping who spend their money on booze and such (I’ll leave THAT 2 B filled in)! #TaxBillScam https:// twitter.com/millenpolitics /status/937725872852914177 …";;@ChuckGrassley;#TaxBillScam;"937737414222659584";https://twitter.com/mfpdx/status/937737414222659584;;Pacific NW,Pacific Time (US & Canada),
mfpdx;2017-12-04 12:32;0;0;"@realDonaldTrump lied, even many in his own base many of them R angry. But why are we surprised that he lied? Why are we surprise that the #GOP Led Congress is going to hurt those who need help and help those who don’t need help? Last chance- CALL UR REPS ABOUT #TaxScamBill2017 https:// twitter.com/sensanders/sta tus/937480245753667591 …";;@realDonaldTrump;#GOP #TaxScamBill2017;"937736373435482112";https://twitter.com/mfpdx/status/937736373435482112;;Pacific NW,Pacific Time (US & Canada),
mfpdx;2017-12-03 19:10;0;0;"The R’s didn’t even read it all B4 passing it. We know they do this! Some ppl may not WANT TO know it, but it’s true. Since the R’s have TOTAL CONTROL BUT STILL DIDNT READ IT, explains the Rep. “no need for” #affordableEducation BS! @HouseGOP @SenateGOP #WeWillRemember https:// twitter.com/senwarren/stat us/936756302000414720 …";;@HouseGOP @SenateGOP;#affordableEducation #WeWillRemember;"937474096366993408";https://twitter.com/mfpdx/status/937474096366993408;;Pacific NW,Pacific Time (US & Canada),
mfpdx;2017-12-03 16:54;1;0;"C’mon..... to them you’re JUST a fireman!! Guess his houses haven’t caught on fire....YET @ChuckGrassley #TRUMPTAXSCAM - BTW, WTH ARE “YOUR” TAX RETURNS @realDonaldTrump ??? #GOPFAIL - #RIPAMERICA #resist https:// twitter.com/kristiedecimal /status/937427905751207938 …";;@ChuckGrassley @realDonaldTrump;#TRUMPTAXSCAM #GOPFAIL #RIPAMERICA #resist;"937439891004129280";https://twitter.com/mfpdx/status/937439891004129280;;Pacific NW,Pacific Time (US & Canada),
mfpdx;2017-12-03 16:52;0;0;"@ChuckGrassley is SAYING the silver spoon rich kids, who did nothing 2 make that $$, are virtuous, DESERVING, & “investing wisely” so shld have e/thing handed to them w/out having 2 be taxed On essentially HUGE GIFTS. But The rest of us just drank our $? WHAT WORLD IS THAT UP IN? https:// twitter.com/purelypixel/st atus/937428301089517568 …";;@ChuckGrassley;;"937439389981880320";https://twitter.com/mfpdx/status/937439389981880320;;Pacific NW,Pacific Time (US & Canada),
mfpdx;2017-12-03 13:59;0;0;"This is what we were warned about: https:// twitter.com/i/moments/9369 75783028957185 …";;;;"937395844847886336";https://twitter.com/mfpdx/status/937395844847886336;;Pacific NW,Pacific Time (US & Canada),
mfpdx;2017-12-03 13:57;1;0;"Good for her I let Susan Collins know how very unhappy and disappointed I was in her. Apparently she does not care either-none of them seem too, after all, it won’t hurt them or their friends. I do have a brother with a small business that it will hurt:( https:// twitter.com/tomricks1/stat us/936961575122079744 …";;;;"937395334354845696";https://twitter.com/mfpdx/status/937395334354845696;;Pacific NW,Pacific Time (US & Canada),
mfpdx;2017-12-03 13:55;0;0;"Oh believe me, I neither voted for him, nor did I ever believed him. Our state is absolutely screwed. I am glad to see some Republicans who are unhappy about a bad Scale, but sadly, it’s too late. This should have been a parcel issue and it’s sad it turned out to be:( https:// twitter.com/deeznuts2182/s tatus/936898448359489537 …";;;;"937394989683712000";https://twitter.com/mfpdx/status/937394989683712000;;Pacific NW,Pacific Time (US & Canada),
mfpdx;2017-12-03 13:48;0;0;"Not sure what state you’re in, ours Loses out big time as well. I am very glad I didn’t vote for Trump, too bad that didn’t help me :( https:// twitter.com/kennystrs1216/ status/936904906010537985 …";;;;"937393035343626240";https://twitter.com/mfpdx/status/937393035343626240;;Pacific NW,Pacific Time (US & Canada),
mfpdx;2017-12-03 13:44;0;1;"Sorry you voted for him - I mean that sincerely.... I didn’t but still get dumped on #Teachers are just some of those who lose- many states hit harder than others too (and they didn’t even read the bill): NOT LEADERS @realDonaldTrump https:// twitter.com/funconnectedca r/status/936949645766303749 …";;@realDonaldTrump;#Teachers;"937392118892412928";https://twitter.com/mfpdx/status/937392118892412928;;Pacific NW,Pacific Time (US & Canada),
mfpdx;2017-12-03 13:32;0;0;"Surprisingly it can in #Alabama Go ahead and elect a pedophile. Never mind that you all have daughters mothers sisters cousins & friends, who will NOW be even LESS willing to report rape - nicely done - 2 steps back 4 women (you)! https:// twitter.com/nickiknowsnada /status/937358214928240641 …";;;#Alabama;"937389027329634305";https://twitter.com/mfpdx/status/937389027329634305;;Pacific NW,Pacific Time (US & Canada),
mfpdx;2017-12-03 13:17;0;0;"Shame on #Alabama - really women, do you NOT care about your daughters and other female friends and loved ones? I just don’t und HOW you can talk yourselves into buying his lies: This is Why Women Dont Report - even women blame THEM!! https:// twitter.com/remy_anne/stat us/937357452047249408 …";;;#Alabama;"937385402523983873";https://twitter.com/mfpdx/status/937385402523983873;;Pacific NW,Pacific Time (US & Canada),
mfpdx;2017-12-03 13:10;0;1;"I counted on you to have the sense not to vote for this. I was wrong. Yes some states “may” benefit, many won’t- Oregon just lost big time and ppl should ck their states as well. BUT BIG BUSINESS WILL DEFINITELY BENEFIT! Have Lost all respect https:// twitter.com/senatorcollins /status/936703445754662913 …";;;;"937383528123179008";https://twitter.com/mfpdx/status/937383528123179008;;Pacific NW,Pacific Time (US & Canada),
mfpdx;2017-12-03 13:06;0;0;"As I read it many states will hurt worse than other states, thank you for that-not. If you live in Oregon, we just got royally dumped on. Everybody out there might want to go check their state too https:// twitter.com/senatorcollins /status/936703445754662913 …";;;;"937382620689719296";https://twitter.com/mfpdx/status/937382620689719296;;Pacific NW,Pacific Time (US & Canada),
mfpdx;2017-12-03 13:04;0;0;"Finally, someone besides a Republican on the Sunday morning news channels. Thank you Senator King for trying to stand up for so many people; #taxscam will hurt many states more than others.....ppl better hope they’re state isn’t one hit hardest !! https:// twitter.com/senangusking/s tatus/937312953572962304 …";;;#taxscam;"937382097987047424";https://twitter.com/mfpdx/status/937382097987047424;;Pacific NW,Pacific Time (US & Canada),
mfpdx;2017-12-03 12:42;0;0;"@SenateMajLdr Nice talking McConnell, but I just read how much it’ll hurt oregonian’s, and you’re lying through your teeth. This tax thing is on you & #GOP the worse it gets overtime it’s still on you! #GOP HAS BLOWN IT-SHAME! #WeWontforget";;@SenateMajLdr;#GOP #GOP #WeWontforget;"937376421227331584";https://twitter.com/mfpdx/status/937376421227331584;;Pacific NW,Pacific Time (US & Canada),
mfpdx;2017-12-01 00:14;0;0;"No doubt trying to rip their heads off #SellOuts #hypocrites #Trumptaxscam Wake up PLZ: @SenJohnMcCain @lisamurkowski @SenatorCollins @SenBobCorker @lisamurkowski @SenJohnMcCain @SenFlakeStaff https:// twitter.com/sahilkapur/sta tus/936357651050565633 …";;@SenJohnMcCain @lisamurkowski @SenatorCollins @SenBobCorker @lisamurkowski @SenJohnMcCain @SenFlakeStaff;#SellOuts #hypocrites #Trumptaxscam;"936463427924459520";https://twitter.com/mfpdx/status/936463427924459520;;Pacific NW,Pacific Time (US & Canada),
mfpdx;2017-11-30 17:23;0;0;"#Trumptaxscam also #Healthcaredisaster which will hurt people with CANCER, among many others!? How can you vote for this @SenJohnMcCain ? Or ANY of those I thought had a conscience @lisamurkowski @SenatorCollins ? https:// twitter.com/sarahkliff/sta tus/935904801380098060 …";;@SenJohnMcCain @lisamurkowski @SenatorCollins;#Trumptaxscam #Healthcaredisaster;"936360185450323968";https://twitter.com/mfpdx/status/936360185450323968;;Pacific NW,Pacific Time (US & Canada),
mfpdx;2017-11-30 16:17;0;0;"Omg, she is absolutely a #fanatic and can’t even carry on a conversation #TrumpCult denials at every turn:( refuses to answer questions WITH ANSWERS rather than #rhetoric https:// twitter.com/billyjwells/st atus/936324059742310402 …";;;#fanatic #TrumpCult #rhetoric;"936343340856983552";https://twitter.com/mfpdx/status/936343340856983552;;Pacific NW,Pacific Time (US & Canada),
mfpdx;2017-11-30 16:06;0;0;"Do we still think people for #RT ? If so, TY! Still trying to figure out which hashtags that allowed me to interact with those people who are interested in the things I’m interested in and followers/following it’s embarrassing AND frustrating :(";;;#RT;"936340652912132096";https://twitter.com/mfpdx/status/936340652912132096;;Pacific NW,Pacific Time (US & Canada),
mfpdx;2017-11-30 15:28;0;0;"I know; SHOCKING, isn’t it ?! #TrumpTaxscam";;;#TrumpTaxscam;"936331073889320960";https://twitter.com/mfpdx/status/936331073889320960;;Pacific NW,Pacific Time (US & Canada),
mfpdx;2017-11-30 15:25;0;0;"@GottaLaff Ok, THIS is how they’ll blame the Democrats; this is carefully constructed to screw people over time - what was I thinking .... #Trumptaxscam https:// twitter.com/aeanyc/status/ 936307214947684357 …";;@GottaLaff;#Trumptaxscam;"936330312442724353";https://twitter.com/mfpdx/status/936330312442724353;;Pacific NW,Pacific Time (US & Canada),
mfpdx;2017-11-30 15:09;0;0;"Lost any respect I had for any of them-this will backfire, just not in time to stop the coming disaster:( @lisamurkowski @SenJohnMcCain @SenatorCollins SHAME!! https:// twitter.com/chelleld16/sta tus/936140817734950912 …";;@lisamurkowski @SenJohnMcCain @SenatorCollins;;"936326279489495040";https://twitter.com/mfpdx/status/936326279489495040;;Pacific NW,Pacific Time (US & Canada),
mfpdx;2017-11-30 15:05;0;0;"Not soon enough to help stop it... they will get ZERO pity from me!! #TrumpCult https:// twitter.com/left_side_stor y/status/936233529150791681 …";;;#TrumpCult;"936325330360352769";https://twitter.com/mfpdx/status/936325330360352769;;Pacific NW,Pacific Time (US & Canada),
mfpdx;2017-11-30 15:01;0;0;"Disgusting #TheFederalist https:// twitter.com/edkrassen/stat us/936224754310270977 …";;;#TheFederalist;"936324372851077120";https://twitter.com/mfpdx/status/936324372851077120;;Pacific NW,Pacific Time (US & Canada),
mfpdx;2017-11-30 14:59;0;0;"WTH @SenJohnMcCain ?? So if others don’t have the $$ you have, their life is not important enough to try to help them get treatment??? #cancer https:// twitter.com/gottalaff/stat us/936293987882639360 …";;@SenJohnMcCain;#cancer;"936323740933046272";https://twitter.com/mfpdx/status/936323740933046272;;Pacific NW,Pacific Time (US & Canada),
mfpdx;2017-11-30 14:55;0;0;"You are likely right although I’m not sure quite how they’ll do it since they have every branch of government. But Both of us know IF it can be done they be the ones to pull it off :( smh https:// twitter.com/gottalaff/stat us/936294531175084032 …";;;;"936322885047631872";https://twitter.com/mfpdx/status/936322885047631872;;Pacific NW,Pacific Time (US & Canada),
mfpdx;2017-11-30 14:53;0;0;"I have lost respect for you- THAT IS HOW I FEEL : @SenJohnMcCain ; I thought better of you:( https:// twitter.com/indivisible_sa z/status/936277634962530305 …";;@SenJohnMcCain;;"936322293440974848";https://twitter.com/mfpdx/status/936322293440974848;;Pacific NW,Pacific Time (US & Canada),
mfpdx;2017-11-30 14:48;0;0;"What say you “people of faith“ in #RepublicanTaxBill Congress ( and your religious supporters)? #TaxScamBill - anyone home??? https:// twitter.com/thehill/status /935994292518170624 …";;;#RepublicanTaxBill #TaxScamBill;"936321047149756416";https://twitter.com/mfpdx/status/936321047149756416;;Pacific NW,Pacific Time (US & Canada),
mfpdx;2017-11-30 14:41;0;0;"Just curious; were you ever on the old WaPo blog? I ask because I was, and there was someone with your moniker I had great debates with; just wondering if it might have bee you?";;;;"936319279372185600";https://twitter.com/mfpdx/status/936319279372185600;;Pacific NW,Pacific Time (US & Canada),
mfpdx;2017-11-30 14:33;0;0;"I wish I could say anything surprised me anymore, but the only thing that really surprises me is how so many absolutely have this #TrumpCult mentality :( https:// twitter.com/normornstein/s tatus/936268518848454656 …";;;#TrumpCult;"936317346095886336";https://twitter.com/mfpdx/status/936317346095886336;;Pacific NW,Pacific Time (US & Canada),
mfpdx;2017-11-30 14:27;0;0;"Jeeze, you must be missing the GOAL, which is that THEN ONLY the WELL OFF can get an education- been a goal for a loong time : FWIW, I Agree with you! https:// twitter.com/unpersuaded112 /status/929183386882793472 …";;;;"936315872087490561";https://twitter.com/mfpdx/status/936315872087490561;;Pacific NW,Pacific Time (US & Canada),
mfpdx;2017-11-30 14:21;0;0;"That was so painful to watch my head hurts! How in the hell does someone who knows nothing even get a hearing on that subject?? #ClimateChangeIsReal And we need somebody who “knows” something about it: SHE IS NOT THE ONE!! #climatedisaster https:// twitter.com/fmoniteau/stat us/929046655558660097 …";;;#ClimateChangeIsReal #climatedisaster;"936314152632516608";https://twitter.com/mfpdx/status/936314152632516608;;Pacific NW,Pacific Time (US & Canada),
mfpdx;2017-11-30 14:01;0;0;"@RoyMoore says despicable things and YET #TrumpCult STILL PROTECTS HIM! FYI “librul” is getting old....most of those accusing YOU are conservatives and/or Trump voters so #TryAgain #Resistance #ChildSexualAbuse IS NOT OK WITH GOD! #Hypocrite #liar #predator https:// twitter.com/fmoniteau/stat us/929353354723110912 …";;@RoyMoore;#TrumpCult #TryAgain #Resistance #ChildSexualAbuse #Hypocrite #liar #predator;"936309310115606528";https://twitter.com/mfpdx/status/936309310115606528;;Pacific NW,Pacific Time (US & Canada),
mfpdx;2017-11-30 13:39;0;0;"Yes, that’s why there are “supposed” triggers- ya know, IN CASE you are wrong, which you must know you are #TrumpTaxScam #TrumpCult will Believe anything, smh... https:// twitter.com/protectorelite /status/936091626832666625 …";;;#TrumpTaxScam #TrumpCult;"936303662141390848";https://twitter.com/mfpdx/status/936303662141390848;;Pacific NW,Pacific Time (US & Canada),
mfpdx;2017-11-30 13:35;0;0;"Yeah you all just keep taking credit for all the growth we’ve seen that did NOT happen under Trump and you damn well know it! It might surprise you to know that many of us know it too; in fact most of us. Can’t wait for the next election #ticktock #RIP REPUBLICANS https:// twitter.com/senategop/stat us/936287836638203904 …";;;#ticktock #RIP;"936302625418395649";https://twitter.com/mfpdx/status/936302625418395649;;Pacific NW,Pacific Time (US & Canada),
mfpdx;2017-11-30 13:26;0;0;"More BS #TAXBILLSCAM https:// twitter.com/senategop/stat us/936287836638203904 …";;;#TAXBILLSCAM;"936300451103875072";https://twitter.com/mfpdx/status/936300451103875072;;Pacific NW,Pacific Time (US & Canada),
mfpdx;2017-11-30 13:21;0;0;"Thank you for your service! And you’re right- republican tax scams always hurt us, but too many don’t seem to learn from history #TrumpTaxScam #https:// twitter.com/goss30goss/sta tus/934057014350794753 …";;;#TrumpTaxScam #https;"936299222776688640";https://twitter.com/mfpdx/status/936299222776688640;;Pacific NW,Pacific Time (US & Canada),
mfpdx;2017-11-30 13:18;0;0;"So great; can’t deduct my state taxes and can’t deduct my home mortgage interest. I hope all of you in #Congress who support this, care about ANYONE this will hurt Because it will hurt many of your constituents as well #TaxCutsForTrump won’t help you!! https:// twitter.com/nar_homeowners /status/935218585273806849 …";;;#Congress #TaxCutsForTrump;"936298426865655809";https://twitter.com/mfpdx/status/936298426865655809;;Pacific NW,Pacific Time (US & Canada),
mfpdx;2017-11-30 13:11;0;0;"Party above all else is the mantra of the #TrumpCult - WHERE are the 17 women accusing him of sexual assault? Y R he & #RoyMoore NOT subject 2 JUSTICE? He’s dismantled all of our regulatory agencies w/the collusion of a #RepublicanCongress , angered the world w/zero repercussions https:// twitter.com/fmoniteau/stat us/934512916505726979 …";;;#TrumpCult #RoyMoore #RepublicanCongress;"936296763316568064";https://twitter.com/mfpdx/status/936296763316568064;;Pacific NW,Pacific Time (US & Canada),
mfpdx;2017-11-30 12:58;0;0;"@Comey HAS FACTS; YOU DO NOT .....hmm #TrumpCult https:// twitter.com/garyshawkins/s tatus/936063029023772672 …";;@Comey;#TrumpCult;"936293390131462144";https://twitter.com/mfpdx/status/936293390131462144;;Pacific NW,Pacific Time (US & Canada),
mfpdx;2017-11-30 12:56;0;0;"Oh and @realDonaldTrump #ticktock https:// twitter.com/7lifeisart/sta tus/936269296346521600 …";;@realDonaldTrump;#ticktock;"936292957350543361";https://twitter.com/mfpdx/status/936292957350543361;;Pacific NW,Pacific Time (US & Canada),
mfpdx;2017-11-30 12:56;0;0;"And exactly WHAT DID #MUELLER DO, LMAO? Oh, you mean his investigation of @potus and pals; PLZ (gag)! #TrumpCult strikes again, smh https:// twitter.com/7lifeisart/sta tus/936269296346521600 …";;@potus;#MUELLER #TrumpCult;"936292754807693313";https://twitter.com/mfpdx/status/936292754807693313;;Pacific NW,Pacific Time (US & Canada),
mfpdx;2017-11-30 12:25;0;0;"@NYSky_007 is likely another #BOT , sigh... https:// twitter.com/nancy_kerschne r/status/936068545389170688 …";;@NYSky_007;#BOT;"936285068657541120";https://twitter.com/mfpdx/status/936285068657541120;;Pacific NW,Pacific Time (US & Canada),
mfpdx;2017-11-30 12:07;0;0;"They don’t understand statistics:( https:// twitter.com/merorschach/st atus/936243075512455169 …";;;;"936280474342760448";https://twitter.com/mfpdx/status/936280474342760448;;Pacific NW,Pacific Time (US & Canada),
mfpdx;2017-11-30 12:01;0;1;"This may be off topic but please please don’t vote for that #TaxReformScam !!";;;#TaxReformScam;"936279091610763264";https://twitter.com/mfpdx/status/936279091610763264;;Pacific NW,Pacific Time (US & Canada),
mfpdx;2017-11-29 18:04;0;0;"Please PLEASE don’t vote for this #TaxScamBill @SenBobCorker @SenatorCollins @lisamurkowski https:// twitter.com/dailykos/statu s/935977461292118016 …";;@SenBobCorker @SenatorCollins @lisamurkowski;#TaxScamBill;"936008053643546625";https://twitter.com/mfpdx/status/936008053643546625;;Pacific NW,Pacific Time (US & Canada),
mfpdx;2017-11-29 18:02;2;0;"Hmm... we don’t even know where to begin anymore with all the problems there are: #TaxDebate #Healthcare #NorthKorea #NetNeutrality #Niger #Sexualharassment It’s overwhelming- sad and sickened :( http:// nymag.com/daily/intellig encer/2017/10/voter-suppression-may-have-won-wisconsin-for-trump.html …";;;#TaxDebate #Healthcare #NorthKorea #NetNeutrality #Niger #Sexualharassment;"936007523848482816";https://twitter.com/mfpdx/status/936007523848482816;;Pacific NW,Pacific Time (US & Canada),
mfpdx;2017-11-29 15:30;1;0;"No. They. Don’t! @realDonaldTrump #Governmentshutdown will be ON REPUBLICANS! #GOPFAIL #GOPTaxBill #RoyMoore #RUSSIA #NorthKorea #Niger ... #GOP PROBLEMS....just a few :( https:// twitter.com/daveweigel/sta tus/935621622932918272 …";;@realDonaldTrump;#Governmentshutdown #GOPFAIL #GOPTaxBill #RoyMoore #RUSSIA #NorthKorea #Niger #GOP;"935969234848423936";https://twitter.com/mfpdx/status/935969234848423936;;Pacific NW,Pacific Time (US & Canada),
mfpdx;2017-11-29 14:47;0;0;"Sad...Republicans, it turns out, are NOT the one’s with a conscience :( So much for holier-than-thou #ConservativeMorality @congressdotgov http:// theweek.com/speedreads/738 999/poll-finds-more-republicans-vote-candidate-accused-sexual-harassment-than-not …";;@congressdotgov;#ConservativeMorality;"935958523233501185";https://twitter.com/mfpdx/status/935958523233501185;;Pacific NW,Pacific Time (US & Canada),
mfpdx;2017-11-29 14:24;0;0;"So much for the #religious folks.....funny thing is that those who have claimed to be better than others, turn out to protect #sexualharassment by their own. #hypocrites https://www. economist.com/news/united-st ates/21731597-party-moral-character-has-become-party-ends-justify …";;;#religious #sexualharassment #hypocrites;"935952560912982016";https://twitter.com/mfpdx/status/935952560912982016;;Pacific NW,Pacific Time (US & Canada),
mfpdx;2017-11-29 13:46;0;0;"Yes @WhoopiGoldberg , that would be the reason! All it was was a photo up for him; sad https:// twitter.com/theview/status /935915344606011393 …";;@WhoopiGoldberg;;"935943145782624256";https://twitter.com/mfpdx/status/935943145782624256;;Pacific NW,Pacific Time (US & Canada),
mfpdx;2017-11-29 13:45;0;0;"Real presidential of you - NOT @realDonaldTrump : http:// abcnews.go.com/Politics/trump -retweets-british-nationalist-anti-muslim-videos/story?id=51455324 …";;@realDonaldTrump;;"935942723906945024";https://twitter.com/mfpdx/status/935942723906945024;;Pacific NW,Pacific Time (US & Canada),
