username;date;retweets;favorites;text;geo;mentions;hashtags;id;permalink;place_full_name;location;timezone;profile_location_name
REttelson;2017-12-06 18:16;0;0;"As a psychologist I fully endorse this. https:// twitter.com/RanttNews/stat us/938546023806488576 …";;;;"938547607286067200";https://twitter.com/REttelson/status/938547607286067200;;Southern California,Pacific Time (US & Canada),
REttelson;2017-12-06 17:51;4;4;"What? Oh, states' rights is only to deny civil rights. https:// twitter.com/davidfrum/stat us/938531578581528581 …";;;;"938541472340512768";https://twitter.com/REttelson/status/938541472340512768;;Southern California,Pacific Time (US & Canada),
REttelson;2017-12-06 16:26;0;0;"Thank you, Seth!";;;;"938520055918223360";https://twitter.com/REttelson/status/938520055918223360;;Southern California,Pacific Time (US & Canada),
REttelson;2017-12-06 13:14;0;0;"Flynn Said Russian Sanctions Would be ‘Ripped Up,’ Whistle-Blower Says https:// nyti.ms/2AW5NB5";;;;"938471825348034560";https://twitter.com/REttelson/status/938471825348034560;;Southern California,Pacific Time (US & Canada),
REttelson;2017-12-06 09:03;0;0;"Meat is Heat: The Effects of Diet on Global Warming https:// nutritionfacts.org/2017/12/05/mea t-is-heat-the-effects-of-diet-on-global-warming/ … via @nutrition_facts";;@nutrition_facts;;"938408455395713024";https://twitter.com/REttelson/status/938408455395713024;;Southern California,Pacific Time (US & Canada),
REttelson;2017-12-05 22:48;0;0;"Poirot on the Potomac https://www. dcreport.org/2017/12/04/poi rot-on-the-potomac/ …";;;;"938253758030495749";https://twitter.com/REttelson/status/938253758030495749;;Southern California,Pacific Time (US & Canada),
REttelson;2017-12-05 20:23;0;0;"Portugal’s radical drugs policy is working. Why hasn’t the world copied it? https://www. theguardian.com/news/2017/dec/ 05/portugals-radical-drugs-policy-is-working-why-hasnt-the-world-copied-it?CMP=Share_AndroidApp_Tweet …";;;;"938217217400881152";https://twitter.com/REttelson/status/938217217400881152;;Southern California,Pacific Time (US & Canada),
REttelson;2017-12-05 19:17;0;0;"How about making gay people wear rainbow armbands? https:// twitter.com/Deanofcomedy/s tatus/938200063624523776 …";;;;"938200795023007744";https://twitter.com/REttelson/status/938200795023007744;;Southern California,Pacific Time (US & Canada),
REttelson;2017-12-05 16:02;0;0;"I'm on the FCC. Please stop us from killing net neutrality http://www. latimes.com/opinion/op-ed/ la-oe-rosenworcel-fcc-net-neutrality-repeal-20171122-story.html …";;;;"938151623649460225";https://twitter.com/REttelson/status/938151623649460225;;Southern California,Pacific Time (US & Canada),
REttelson;2017-12-05 08:51;0;0;"Woman shares new evidence of relationship with Roy Moore when she was 17 http:// wapo.st/2AoUTDq";;;;"938043191592239104";https://twitter.com/REttelson/status/938043191592239104;;Southern California,Pacific Time (US & Canada),
REttelson;2017-12-05 08:42;0;0;"The Republican War on Economics http:// nymag.com/daily/intellig encer/2017/12/the-republican-war-on-economics.html?utm_source=tw&utm_medium=s3&utm_campaign=sharebutton-t … via @intelligencer";;@intelligencer;;"938040906044776449";https://twitter.com/REttelson/status/938040906044776449;;Southern California,Pacific Time (US & Canada),
REttelson;2017-12-05 08:14;0;0;"The words of all those Republicans in Congress who voted to impeach Bill Clinton should come back to haunt them now.";;;;"938033926957711360";https://twitter.com/REttelson/status/938033926957711360;;Southern California,Pacific Time (US & Canada),
REttelson;2017-12-04 18:49;0;0;"Yemenis Are Worried About What Happens Now That Their Former President Has Been Killed https://www. buzzfeed.com/rosebuchanan/y emenis-are-worried-about-what-happens-now-that-their?utm_term=.ennVK2BJo … via @rose_catb";;@rose_catb;;"937831217486954503";https://twitter.com/REttelson/status/937831217486954503;;Southern California,Pacific Time (US & Canada),
REttelson;2017-12-04 18:43;1;0;"Yemen's deposed strongman Ali Abdullah Saleh has been killed, allies and opponents say http:// lat.ms/2jLaALi";;;;"937829717947719680";https://twitter.com/REttelson/status/937829717947719680;;Southern California,Pacific Time (US & Canada),
REttelson;2017-12-04 18:10;0;0;"Trump attacked by law enforcement over anti-FBI tweets http://www. newsweek.com/trump-gets-att acked-american-law-enforcement-over-anti-fbi-tweets-729893 …";;;;"937821509334077440";https://twitter.com/REttelson/status/937821509334077440;;Southern California,Pacific Time (US & Canada),
REttelson;2017-12-04 16:32;0;0;"Flynn’s Plea and the Significance of the Lying in the Russia Investigation http://www. lawfareblog.com/flynns-plea-an d-significance-lying-russia-investigation …";;;;"937796870578958336";https://twitter.com/REttelson/status/937796870578958336;;Southern California,Pacific Time (US & Canada),
REttelson;2017-12-04 14:34;0;1;"Isn't it a crime for a law enforcement officer, including POTUS, to make false accusations?";;;;"937767129658437632";https://twitter.com/REttelson/status/937767129658437632;;Southern California,Pacific Time (US & Canada),
REttelson;2017-12-04 12:49;0;0;"If that's true, we live in an absolute monarchy, not a constitutional democracy. https:// twitter.com/matthewamiller /status/937705395459588096 …";;;;"937740717941592064";https://twitter.com/REttelson/status/937740717941592064;;Southern California,Pacific Time (US & Canada),
REttelson;2017-12-04 12:48;0;0;"Rick Wilson: Everything Trump touches dies. https:// twitter.com/kurteichenwald /status/937730449199304704 …";;;;"937740330299834368";https://twitter.com/REttelson/status/937740330299834368;;Southern California,Pacific Time (US & Canada),
REttelson;2017-12-03 22:54;0;0;"Separately but equally, Trump and Netanyahu undermine the law to escape prosecution https://www. haaretz.com/israel-news/.p remium-1.826583 …";;;;"937530554974531587";https://twitter.com/REttelson/status/937530554974531587;;Southern California,Pacific Time (US & Canada),
REttelson;2017-12-03 21:11;0;0;"Oh yeah? Well, what about Chappaquiddick? http://www. kansascity.com/opinion/opn-co lumns-blogs/syndicated-columnists/article187662578.html …";;;;"937504648562319360";https://twitter.com/REttelson/status/937504648562319360;;Southern California,Pacific Time (US & Canada),
REttelson;2017-12-03 19:23;0;0;"I think it's that the GOP did not figure the payroll tax's additional burdens into their calculations, which increases the inequality of it all, since their donors do not have that burden.";;;;"937477402619396096";https://twitter.com/REttelson/status/937477402619396096;;Southern California,Pacific Time (US & Canada),
REttelson;2017-12-03 19:12;0;0;"December 2, 2017 – Tax cuts for the rich http:// stateofbelief.com/showarchive/20 17/this-week-tax-cuts-for-the-rich/ …";;;;"937474580683243520";https://twitter.com/REttelson/status/937474580683243520;;Southern California,Pacific Time (US & Canada),
REttelson;2017-12-03 19:08;0;0;"One cannot support law enforcement in general without supporting the preeminent law enforcement agency in the world, the FBI. https:// twitter.com/FBIAgentsAssoc /status/937451662238736386 …";;;;"937473576789196800";https://twitter.com/REttelson/status/937473576789196800;;Southern California,Pacific Time (US & Canada),
REttelson;2017-12-03 18:06;0;1;"Sorry I misunderstood";;;;"937457939954114560";https://twitter.com/REttelson/status/937457939954114560;;Southern California,Pacific Time (US & Canada),
REttelson;2017-12-03 17:32;0;0;"Fine, except they've been consistently and unrepentantly wrong on every economic issue. Look at their record. https:// twitter.com/yeselson/statu s/937411460963225601 …";;;;"937449440083718144";https://twitter.com/REttelson/status/937449440083718144;;Southern California,Pacific Time (US & Canada),
REttelson;2017-12-03 17:30;2;2;"If your morality is based on partisanship alone, you don't really have any morality. https:// twitter.com/jbendery/statu s/937408572383567872 …";;;;"937448969025732608";https://twitter.com/REttelson/status/937448969025732608;;Southern California,Pacific Time (US & Canada),
REttelson;2017-12-03 15:32;0;0;"Trump's America Would be a Living Hell for Jesus https:// johnpavlovitz.com/2017/12/03/tru mps-america-living-hell-jesus/ … via @johnpavlovitz";;@johnpavlovitz;;"937419359185649665";https://twitter.com/REttelson/status/937419359185649665;;Southern California,Pacific Time (US & Canada),
REttelson;2017-12-03 13:05;0;0;"3 Weddings In New York Synagogue. One Shared Act Of Defiance Against Israel’s Orthodox Rabbinate https:// forward.com/news/388661/wh en-a-wedding-is-also-a-protest-against-ultra-orthodox-rabbinate/?utm_source=twitter&utm_medium=social&utm_campaign=sumome_share … via @jdforward";;@jdforward;;"937382195127185408";https://twitter.com/REttelson/status/937382195127185408;;Southern California,Pacific Time (US & Canada),
REttelson;2017-12-03 12:56;0;0;"Texas prisons ban The Color Purple and Monty Python – but Mein Kampf is fine https://www. theguardian.com/us-news/2017/d ec/02/texas-prisons-ban-books-mein-kampf-color-purple?CMP=Share_AndroidApp_Tweet …";;;;"937380055977619456";https://twitter.com/REttelson/status/937380055977619456;;Southern California,Pacific Time (US & Canada),
REttelson;2017-12-03 12:38;0;0;"Anyone who casts aspersions on the FBI insults all law enforcement officers of every jurisdiction who enforce the law fairly and impartially. To denigrate the FBI is to denigrate the rule of law itself. https:// twitter.com/renato_mariott i/status/937306967441371136 …";;;;"937375513374371840";https://twitter.com/REttelson/status/937375513374371840;;Southern California,Pacific Time (US & Canada),
REttelson;2017-12-03 12:34;0;0;"Social Security is not an "entitlement." It's an insurance policy managed by the federal government. We all pay premiums. https:// twitter.com/nytpolitics/st atus/937133045882277888 …";;;;"937374618137927681";https://twitter.com/REttelson/status/937374618137927681;;Southern California,Pacific Time (US & Canada),
REttelson;2017-12-03 12:15;0;0;"Operative Offered Trump Campaign ‘Kremlin Connection’ Using N.R.A. Ties https://www. nytimes.com/2017/12/03/us/ politics/trump-putin-russia-nra-campaign.html …";;;;"937369779089711104";https://twitter.com/REttelson/status/937369779089711104;;Southern California,Pacific Time (US & Canada),
REttelson;2017-12-03 12:13;0;0;"Hypocrite. https:// twitter.com/saletan/status /937359775079260160 …";;;;"937369100640124929";https://twitter.com/REttelson/status/937369100640124929;;Southern California,Pacific Time (US & Canada),
REttelson;2017-12-03 01:47;0;0;"Treasury Secretary Mnuchin fails to deliver promised tax report http://www. msnbc.com/rachel-maddow/ watch/treasury-secretary-mnuchin-fails-to-deliver-promised-tax-report-1107338819941 … via @msnbc";;@msnbc;;"937211677434511360";https://twitter.com/REttelson/status/937211677434511360;;Southern California,Pacific Time (US & Canada),
REttelson;2017-12-03 01:45;0;0;"A Guilty Plea Closes A Chapter On How Russia Got Hold Of Top-Secret NSA Tools https://www. buzzfeed.com/kevincollier/a -guilty-plea-closes-a-chapter-on-how-russia-got-hold-of?utm_term=.rdyJZPB7N … via @kevincollier";;@kevincollier;;"937211056128081920";https://twitter.com/REttelson/status/937211056128081920;;Southern California,Pacific Time (US & Canada),
REttelson;2017-12-02 13:54;0;0;"Lie to your supporters. No problem. Lie to the press. No problem. Lie about your opponents. No problem. Lie to the FBI. BIG problem.";;;;"937032117371912192";https://twitter.com/REttelson/status/937032117371912192;;Southern California,Pacific Time (US & Canada),
REttelson;2017-12-02 12:45;0;0;"The very essence of corruption. https:// twitter.com/SenWhitehouse/ status/936792618649792515 …";;;;"937014873640153088";https://twitter.com/REttelson/status/937014873640153088;;Southern California,Pacific Time (US & Canada),
REttelson;2017-12-01 17:16;0;0;"Looking forward to seeing Jeffrey's work. https:// twitter.com/jfreewright/st atus/936718316265078784 …";;;;"936720794566115328";https://twitter.com/REttelson/status/936720794566115328;;Southern California,Pacific Time (US & Canada),
REttelson;2017-12-01 14:19;0;0;"Wow, the Democrats' control of Congress....wait a minute, the Republicans control Congress, with majorities in both houses! How are the Democrats to blame? Run that by me again. I don't get it. https:// twitter.com/PressSec/statu s/936449389127708674 …";;;;"936676055577800704";https://twitter.com/REttelson/status/936676055577800704;;Southern California,Pacific Time (US & Canada),
REttelson;2017-12-01 13:40;0;0;"Republicans to average American: "Stick 'em up!" https:// twitter.com/SteveSchmidtSE S/status/936645544881012738 …";;;;"936666415003615232";https://twitter.com/REttelson/status/936666415003615232;;Southern California,Pacific Time (US & Canada),
REttelson;2017-12-01 12:20;0;0;"https:// johnpavlovitz.com/2017/11/30/im- american-not-speak/ …";;;;"936646165398921216";https://twitter.com/REttelson/status/936646165398921216;;Southern California,Pacific Time (US & Canada),
REttelson;2017-12-01 12:19;0;0;"Americans should not feel superior with comparisons to tribal conflicts in Africa or Afghanistan. https:// twitter.com/thehill/status /936558258780860416 …";;;;"936645959408271360";https://twitter.com/REttelson/status/936645959408271360;;Southern California,Pacific Time (US & Canada),
REttelson;2017-12-01 12:14;0;0;"Oh my goodness. They left out ad campaigns in my doctoral chemical dependency curriculum in the "effective treatments" section. Trump Donates 3rd-Quarter Salary To HHS For Opioid Crisis Ad Campaign http:// talkingpointsmemo.com/news/trump-don ate-quarterly-salary-hhs-opioid-crisis-ad-campaign … via @TPM";;@TPM;;"936644636726009856";https://twitter.com/REttelson/status/936644636726009856;;Southern California,Pacific Time (US & Canada),
REttelson;2017-12-01 02:16;0;0;"Graduate students nationwide protest House tax bill, saying it could cost them thousands http:// lat.ms/2Apojla";;;;"936494176648151042";https://twitter.com/REttelson/status/936494176648151042;;Southern California,Pacific Time (US & Canada),
REttelson;2017-12-01 01:57;0;0;"https://www. washingtonpost.com/news/postevery thing/wp/2017/11/30/im-a-depression-historian-the-gop-tax-bill-is-straight-out-of-1929/?tid=ss_tw&utm_term=.c21579ffeea7 …";;;;"936489470660034560";https://twitter.com/REttelson/status/936489470660034560;;Southern California,Pacific Time (US & Canada),
REttelson;2017-12-01 00:38;0;0;"https://www. google.com/amp/s/mobile.n ytimes.com/2017/11/30/world/europe/trump-tweets-uk-visit.amp.html …";;;;"936469454648590341";https://twitter.com/REttelson/status/936469454648590341;;Southern California,Pacific Time (US & Canada),
REttelson;2017-12-01 00:32;0;0;"https://www. google.com/amp/s/amp.cnn. com/cnn/2017/11/30/politics/trump-anti-muslim-tweets-warning/index.html …";;;;"936468138035625984";https://twitter.com/REttelson/status/936468138035625984;;Southern California,Pacific Time (US & Canada),
REttelson;2017-12-01 00:13;1;0;"Trump Says G.O.P. Tax Bill Won’t Benefit Him. That’s Not True. https:// nyti.ms/2BxWzIJ";;;;"936463245065445376";https://twitter.com/REttelson/status/936463245065445376;;Southern California,Pacific Time (US & Canada),
REttelson;2017-11-30 12:55;0;0;"Bible: Blessed be the poor. GOP tax bill: Screw you poor, give us more of your meager earnings so we can give your money to the very rich.";;;;"936292503950462976";https://twitter.com/REttelson/status/936292503950462976;;Southern California,Pacific Time (US & Canada),
REttelson;2017-11-30 01:37;0;0;"What Comes After the Tax Bill? You Already Know. http://www. esquire.com/news-politics/ politics/a13976021/republican-tax-bill-outcome/ … via @Esquire";;@Esquire;;"936121880850731008";https://twitter.com/REttelson/status/936121880850731008;;Southern California,Pacific Time (US & Canada),
REttelson;2017-11-29 22:42;0;0;"Denying accuracy of Access Hollywood tape would be Trump's biggest lie https://www. theguardian.com/us-news/2017/n ov/29/denying-accuracy-of-access-hollywood-tape-would-be-trumps-biggest-lie?CMP=Share_AndroidApp_Tweet …";;;;"936077906777800704";https://twitter.com/REttelson/status/936077906777800704;;Southern California,Pacific Time (US & Canada),
REttelson;2017-11-29 17:50;0;0;"Here’s The Right Way To Cover Neo-Nazis https:// forward.com/opinion/nation al/388421/heres-the-right-way-to-cover-neo-nazis/?utm_source=twitter&utm_medium=social&utm_campaign=sumome_share … via @jdforward";;@jdforward;;"936004406918627328";https://twitter.com/REttelson/status/936004406918627328;;Southern California,Pacific Time (US & Canada),
REttelson;2017-11-28 19:35;0;0;"The latest conservative scam got exposed. But it’s just one piece of a much bigger fraud. http:// wapo.st/2hYfzHN";;;;"935668457420369922";https://twitter.com/REttelson/status/935668457420369922;;Southern California,Pacific Time (US & Canada),
REttelson;2017-11-28 09:59;0;0;"Seth Meyers says Trump is the neediest and most insecure president—and he is out of shape too http://www. newsweek.com/seth-meyers-do nald-trump-neediest-and-most-insecure-president-history-and-out-724164 …";;;;"935523610520776704";https://twitter.com/REttelson/status/935523610520776704;;Southern California,Pacific Time (US & Canada),
REttelson;2017-11-28 09:57;0;0;"https:// psmag.com/economics/the- long-list-of-lobbyists-visiting-mick-mulvaney … via @pacificstand";;@pacificstand;;"935523142780338176";https://twitter.com/REttelson/status/935523142780338176;;Southern California,Pacific Time (US & Canada),
REttelson;2017-11-28 01:11;0;0;"Gracious Navajo vets sidelined by Trump attacks http://www. msnbc.com/the-last-word/ watch/gracious-navajo-vets-sidelined-by-trump-attacks-1104841283573 … via @msnbc";;@msnbc;;"935390649708191744";https://twitter.com/REttelson/status/935390649708191744;;Southern California,Pacific Time (US & Canada),
REttelson;2017-11-28 00:25;0;0;"Dismantling the Foreign Service https:// nyti.ms/2i9p6Q9";;;;"935379189112348672";https://twitter.com/REttelson/status/935379189112348672;;Southern California,Pacific Time (US & Canada),
REttelson;2017-11-27 18:47;0;0;"Choice and the Insurance Mandate https:// nyti.ms/2k5IBd2";;;;"935294024897806337";https://twitter.com/REttelson/status/935294024897806337;;Southern California,Pacific Time (US & Canada),
REttelson;2017-11-27 18:34;0;0;"Republicans' latest plan to repeal Obamacare's insurance requirement could wreak havoc in some very red states http://www. latimes.com/politics/la-na -pol-insurance-mandate-repeal-20171127-story.html …";;;;"935290765424476160";https://twitter.com/REttelson/status/935290765424476160;;Southern California,Pacific Time (US & Canada),
REttelson;2017-11-27 18:05;0;0;"Discover #OperationSantaPaws —a special holiday for our 4-footed friends! via @DrRosane http:// ucdintegrativemedicine.com/2017/11/operat ion-santa-paws/ … via @UCDIM";;@DrRosane @UCDIM;#OperationSantaPaws;"935283448620519424";https://twitter.com/REttelson/status/935283448620519424;;Southern California,Pacific Time (US & Canada),
REttelson;2017-11-27 14:51;0;0;"The religious right’s scary, judgmental old men http:// wapo.st/2hNp90b";;;;"935234697877078016";https://twitter.com/REttelson/status/935234697877078016;;Southern California,Pacific Time (US & Canada),
REttelson;2017-11-27 14:49;0;0;"James Dobson Has ALWAYS 'Sided With Patriarchal Oppression in the Cause of Political Power' http:// po.st/CGPHod via @PatheosProgXn";;@PatheosProgXn;;"935234252920143873";https://twitter.com/REttelson/status/935234252920143873;;Southern California,Pacific Time (US & Canada),