username;date;retweets;favorites;text;geo;mentions;hashtags;id;permalink;place_full_name;location;timezone;profile_location_name
vanitasnohearts;2017-12-06 10:56;0;1;"three more exams and im done with this semester thank godddddd";;;;"938437069201903616";https://twitter.com/vanitasnohearts/status/938437069201903616;;bye lead,None,
vanitasnohearts;2017-12-05 16:55;0;2;"*diet pepsi but wow my brother knows me so well pic.twitter.com/D1WSi81zLs";;;;"938165044386377728";https://twitter.com/vanitasnohearts/status/938165044386377728;;bye lead,None,
vanitasnohearts;2017-12-04 19:44;0;0;"i cant wait till you forget about it againnnnn";;;;"937845110741655553";https://twitter.com/vanitasnohearts/status/937845110741655553;;bye lead,None,
vanitasnohearts;2017-12-04 19:43;0;3;"i love girls";;;;"937844857154031616";https://twitter.com/vanitasnohearts/status/937844857154031616;;bye lead,None,
vanitasnohearts;2017-12-04 19:33;0;1;"i love my son";;;;"937842377166917633";https://twitter.com/vanitasnohearts/status/937842377166917633;;bye lead,None,
vanitasnohearts;2017-12-03 22:50;0;2;"i miss when i was little and didnt know or understand what fandom was. those were the good days.";;;;"937529412320407553";https://twitter.com/vanitasnohearts/status/937529412320407553;;bye lead,None,
vanitasnohearts;2017-12-03 22:46;0;3;"i just had to see with my own two eyes someone saying how lenalee should just die. how do i unsee that?";;;;"937528591360888832";https://twitter.com/vanitasnohearts/status/937528591360888832;;bye lead,None,
vanitasnohearts;2017-12-03 22:14;0;2;"i really wish yenpress didnt call roland "laurent" for awhile cause im always gonna lowkey think of him with that name. rip.";;;;"937520545251430400";https://twitter.com/vanitasnohearts/status/937520545251430400;;bye lead,None,
vanitasnohearts;2017-12-03 21:57;0;1;"pls chokeeee";;;;"937516202070560769";https://twitter.com/vanitasnohearts/status/937516202070560769;;bye lead,None,
vanitasnohearts;2017-12-03 20:15;0;1;"if this sore throat isnt gone by tomorrow ill scream. well internally cause i dont wanna fuck up my throat anymore than it already is sjsjdjssksj";;;;"937490505449070593";https://twitter.com/vanitasnohearts/status/937490505449070593;;bye lead,None,
vanitasnohearts;2017-12-03 15:21;0;1;"im still thinking about this chapter lol";;;;"937416404080447488";https://twitter.com/vanitasnohearts/status/937416404080447488;;bye lead,None,
vanitasnohearts;2017-12-03 15:20;0;3;"this hurts me pic.twitter.com/wv8QVrB3oc";;;;"937416307175239680";https://twitter.com/vanitasnohearts/status/937416307175239680;;bye lead,None,
vanitasnohearts;2017-12-03 13:05;0;1;"i love reigen even more now and i didnt think that was possible";;;;"937382203360718848";https://twitter.com/vanitasnohearts/status/937382203360718848;;bye lead,None,
vanitasnohearts;2017-12-03 12:59;0;1;"reigen and dimple comforting shigeo pic.twitter.com/6oMOE2mYHh";;;;"937380675925233664";https://twitter.com/vanitasnohearts/status/937380675925233664;;bye lead,None,
vanitasnohearts;2017-12-03 12:56;0;1;"mp100 always gets better and better";;;;"937380077599383553";https://twitter.com/vanitasnohearts/status/937380077599383553;;bye lead,None,
vanitasnohearts;2017-12-03 12:56;0;2;"pic.twitter.com/5UT5DwASQs";;;;"937379982237687808";https://twitter.com/vanitasnohearts/status/937379982237687808;;bye lead,None,
vanitasnohearts;2017-12-03 12:55;0;1;"shigeo my boy my son pic.twitter.com/i3vHKhdhIi";;;;"937379733582635008";https://twitter.com/vanitasnohearts/status/937379733582635008;;bye lead,None,
vanitasnohearts;2017-12-03 12:50;0;4;":') pic.twitter.com/tFJRCB3PUo";;;;"937378606958997510";https://twitter.com/vanitasnohearts/status/937378606958997510;;bye lead,None,
vanitasnohearts;2017-12-03 12:47;0;0;"THE NEWEST MP100 CHAPTER GOT ME FUCKED UP OMF";;;;"937377783537438720";https://twitter.com/vanitasnohearts/status/937377783537438720;;bye lead,None,
vanitasnohearts;2017-12-03 10:59;0;1;"why did i have to get sick the day before my test??? bleh";;;;"937350542803832836";https://twitter.com/vanitasnohearts/status/937350542803832836;;bye lead,None,
vanitasnohearts;2017-12-03 10:58;0;1;"being sick fucking sucks";;;;"937350437837201408";https://twitter.com/vanitasnohearts/status/937350437837201408;;bye lead,None,
vanitasnohearts;2017-12-02 20:31;0;0;"asirpa is my daughter";;;;"937132199211659264";https://twitter.com/vanitasnohearts/status/937132199211659264;;bye lead,None,
vanitasnohearts;2017-12-02 17:01;2;2;"mochijun is so good at hurting me";;;;"937079260111671296";https://twitter.com/vanitasnohearts/status/937079260111671296;;bye lead,None,
vanitasnohearts;2017-12-02 16:54;0;0;"less than a month and then i can breatheee";;;;"937077609955028994";https://twitter.com/vanitasnohearts/status/937077609955028994;;bye lead,None,
vanitasnohearts;2017-12-02 16:53;0;1;"school has been taking over my life since the semester began so it really feels like barely a week between each new vnc chapter. which isnt actually a bad thing in a way lol.";;;;"937077272338747392";https://twitter.com/vanitasnohearts/status/937077272338747392;;bye lead,None,
vanitasnohearts;2017-12-02 16:51;0;3;"i finally got kyle in my camp im happy pic.twitter.com/6grMxJQh32";;;;"937076821283295232";https://twitter.com/vanitasnohearts/status/937076821283295232;;bye lead,None,
vanitasnohearts;2017-12-02 13:55;0;1;"i love erwin so much aahh :')";;;;"937032562970591232";https://twitter.com/vanitasnohearts/status/937032562970591232;;bye lead,None,
vanitasnohearts;2017-12-01 17:58;0;1;"";;;;"936731148021063681";https://twitter.com/vanitasnohearts/status/936731148021063681;;bye lead,None,
vanitasnohearts;2017-12-01 17:57;0;1;"";;;;"936731092073304064";https://twitter.com/vanitasnohearts/status/936731092073304064;;bye lead,None,
vanitasnohearts;2017-12-01 17:57;0;0;"reminds me of this lmao pic.twitter.com/rmdzyCvKXN";;;;"936731044027535360";https://twitter.com/vanitasnohearts/status/936731044027535360;;bye lead,None,
vanitasnohearts;2017-12-01 17:53;0;1;"nice! pic.twitter.com/jAbnOw5Raw";;;;"936730052204605440";https://twitter.com/vanitasnohearts/status/936730052204605440;;bye lead,None,
vanitasnohearts;2017-12-01 14:25;0;6;"it's almost 2018 like what? how?";;;;"936677702882521096";https://twitter.com/vanitasnohearts/status/936677702882521096;;bye lead,None,
vanitasnohearts;2017-12-01 14:23;0;1;"wow i just realized lead and me have been friends for two years now. time has passed so quickly wtf!";;;;"936677168754634754";https://twitter.com/vanitasnohearts/status/936677168754634754;;bye lead,None,
vanitasnohearts;2017-12-01 12:56;0;1;"make them";;;;"936655242619445249";https://twitter.com/vanitasnohearts/status/936655242619445249;;bye lead,None,
vanitasnohearts;2017-12-01 12:56;0;1;"NUH UH SOUP AND ME LOVE EACH OTHER CHOKEEEEE";;;;"936655145659699201";https://twitter.com/vanitasnohearts/status/936655145659699201;;bye lead,None,
vanitasnohearts;2017-12-01 12:55;0;1;"AWW I LOVE YOU TOO :')";;;;"936655033311080454";https://twitter.com/vanitasnohearts/status/936655033311080454;;bye lead,None,
vanitasnohearts;2017-11-30 13:57;0;2;"i really love soup lol";;;;"936308130488647681";https://twitter.com/vanitasnohearts/status/936308130488647681;;bye lead,None,
vanitasnohearts;2017-11-30 13:56;1;1;"lead knows me so well pic.twitter.com/Ua7bI67Q15";;;;"936308036582477824";https://twitter.com/vanitasnohearts/status/936308036582477824;;bye lead,None,
vanitasnohearts;2017-11-28 20:42;0;1;"how many months till i see her again aahh";;;;"935685364156633088";https://twitter.com/vanitasnohearts/status/935685364156633088;;bye lead,None,
vanitasnohearts;2017-11-28 20:42;0;1;"hello i love veronica";;;;"935685242232459264";https://twitter.com/vanitasnohearts/status/935685242232459264;;bye lead,None,